"https://amazon.com/dp/B0D3TMMQF5","https://m.media-amazon.com/images/I/71p1CtiELRL._SX450_.jpg","B0D3TMMQF5","Dual-Lens Borescope Camera 5mm lP67 Waterproof Digital Snake Camera AMTORIN Industrial Endoscope 5''IPS Screen 32GB Memory Card 16.4FT Semi-Rigid Cable Bore Scope for Home (16.4 ft-0.2 in Dual Lens)","AMTorin","FBA","Industrial & Scientific",210704,"N/A","N/A","N/A","N/A","Borescopes",429,79.99,-3,2,2,-84,175.98,125.84,36,4.1,"AMTorin","Japan",1,60,"N/A","Large Standard-Size",3.9,7.6,10.63,1.74,158.5,437.24,"07/31/2024",18,7,3,0.06
"https://amazon.com/dp/B0D3TV89KV","https://m.media-amazon.com/images/I/715lgHBZDLL._SX450_.jpg","B0D3TV89KV","Three Lenses Borescope Camera 8mm IP67 Waterproof Snake Camera AMTORIN Industrial Endoscope 5''IPS Screen 32GB Memory 16.4FT Semi-Rigid Cable Bore Scope for Home (8mm-5m（0.31 in-16.4 ft） Triple Lens)","AMTorin","FBA","Industrial & Scientific",210709,"N/A","N/A","N/A","N/A","Borescopes",429,89.99,-3,2,1,-84,175.98,50.02,36,4.1,"AMTorin","Japan",1,60,"N/A","Large Standard-Size",3.9,7.6,10.71,1.94,159.67,440.48,"07/31/2024",18,7,3,0.06
"https://amazon.com/dp/B0DRNW1YY9","https://m.media-amazon.com/images/I/81Sl2S+YqTL._SX450_.jpg","B0DRNW1YY9","Teslong Ultra-Thin 3.9mm Industrial Endoscope with Lights, 6"" IPS Screen Hnadle Borescope Automotive Mechanic Inspection Camera with 6000mAh Battery, 5FT Flexible Waterproof Gooseneck Probe","Teslong","FBA","Industrial & Scientific",211744,"N/A","N/A","N/A","N/A","Borescopes",439,329.99,-6,9,9,67,2956.05,2955.86,19,4.6,"Teslong","China",1,0,"N/A","Large Standard-Size",4.29,13.11,14.88,4.28,421.3,1162.21,"08/31/2025",11,8,0,0.47
"https://amazon.com/dp/B07RYBTQPC","https://m.media-amazon.com/images/I/613iRlNhcLL._SX450_.jpg","B07RYBTQPC","Dino-Lite Medical Trichoscope | Dino-Med Edge Series | USB Only | AF4115ZT(W)-T","Dino-Lite","FBM","Industrial & Scientific",211952,728795351236,"N/A",0728795351236,"N/A","Borescopes",431,669,1,3,2,,2031.4,1368.57,0,"N/A","MediScope","USA",1,28,"N/A","N/A","N/A","N/A","N/A","N/A","N/A","N/A","10/31/2024",21,7,2,"N/A"
"https://amazon.com/dp/B0CXT1RY3L","https://m.media-amazon.com/images/I/71vpFNBiftL._SX450_.jpg","B0CXT1RY3L","Borescope Camera with Light, 1920P HD Endoscope Inspection Camera with 8 Adjustable LED Lights, Snake Camera with 16.4ft/5m Semi-Rigid Snake Camera, 7.9mm IP67 Waterproof Inspection Camera for iOS","SMARTKLIK","FBA","Industrial & Scientific",214309,772388677364,"N/A",0772388677364,"N/A","Borescopes",446,14.99,-3,4,4,,67.38,67.27,1,5,"SMART KL!K","China",1,17,"N/A","Large Standard-Size",1.34,4.8,5.2,0.42,16.84,46.45,"07/31/2024",20,8,0,4.49
"https://amazon.com/dp/B0CRHS4VKM","https://m.media-amazon.com/images/I/61F-Z1U6I8L._SX450_.jpg","B0CRHS4VKM","FDGSAB Sewer Camera, 4.3"" Pipe Drain Inspection Camera with DVR Function & Snake Cable, Waterproof IP68 Borescope w/LED Lights (131.2ft/40M)","FDGSAB","FBA","Industrial & Scientific",214706,"N/A","N/A","N/A","N/A","Borescopes",443,249.99,-14,3,1,-71,696.77,130.76,3,3.6,"sijifeng","China",1,144,"N/A","Large Standard-Size",6.8,12,13.7,8.85,562.84,1552.67,"02/28/2025",22,7,5,1.03
"https://amazon.com/dp/B0CRHRRFFT","https://m.media-amazon.com/images/I/61F-Z1U6I8L._SX450_.jpg","B0CRHRRFFT","FDGSAB Sewer Camera, 4.3"" Pipe Drain Inspection Camera with DVR Function & Snake Cable, Waterproof IP68 Borescope w/LED Lights (66ft/20M)","FDGSAB","FBA","Industrial & Scientific",214764,"N/A","N/A","N/A","N/A","Borescopes",443,229.99,-3,3,1,-71,696.77,195.29,2,4.5,"sijifeng","China",1,144,"N/A","Large Standard-Size",6.7,11.9,13.5,7.75,541.91,1494.94,"02/28/2025",22,7,5,1.55
"https://amazon.com/dp/B0CRHSTV22","https://m.media-amazon.com/images/I/61F-Z1U6I8L._SX450_.jpg","B0CRHSTV22","FDGSAB Sewer Camera, 4.3"" Pipe Drain Inspection Camera with DVR Function & Snake Cable, Waterproof IP68 Borescope w/LED Lights (33ft/10M)","FDGSAB","FBA","Industrial & Scientific",214764,"N/A","N/A","N/A","N/A","Borescopes",443,194.99,1,3,1,-71,696.77,282.6,2,4.5,"sijifeng","China",1,144,"N/A","Large Standard-Size",6.9,12,13.5,6.75,562.78,1552.5,"02/28/2025",22,7,5,1.55
"https://amazon.com/dp/B0CRHRCG47","https://m.media-amazon.com/images/I/61F-Z1U6I8L._SX450_.jpg","B0CRHRCG47","FDGSAB Sewer Camera, 4.3"" Pipe Drain Inspection Camera with DVR Function & Snake Cable, Waterproof IP68 Borescope w/LED Lights (164ft/50M)","FDGSAB","FBA","Industrial & Scientific",214774,"N/A","N/A","N/A","N/A","Borescopes",443,299.99,-8,3,0,-71,696.77,"-","N/A","N/A","sijifeng","China",1,144,"N/A","Large Standard-Size",12,6.3,13.3,8,506.23,1396.5,"02/28/2025",22,7,5,"N/A"
"https://amazon.com/dp/B0DMVH4B71","https://m.media-amazon.com/images/I/71yvgrz9VUL._SX450_.jpg","B0DMVH4B71","Endoscope Camera with Light, Anhendeler 1080P HD Borescope 4.3"" IPS Screen, IP67 Waterproof Snake Camera， for Automotive, Pipe, Wall Inspection","Anhendeler","FBA","Industrial & Scientific",216115,"N/A","N/A","N/A","N/A","Borescopes",446,28.49,46,12,12,95,460.34,460.18,982,4.4,"Anhendeler","China",1,459,"N/A","Large Standard-Size",2.91,5.24,6.69,0.97,51.36,141.68,"01/31/2024",12,6,3,0.01
"https://amazon.com/dp/B0D6SDNFRH","https://m.media-amazon.com/images/I/71GJk2ihNEL._SX450_.jpg","B0D6SDNFRH","HBUDS Sewer Camera with Locator 100ft, 7mm Cable, Self Leveling Drain Cameras with Distance Counter, 9"" 1080P HD Plumbing Camera Snake with Light, Pipe Inspection Cam with Built-in Mic and DVR 32GB","HBUDS","FBA","Industrial & Scientific",216811,774049592283,"N/A",0774049592283,"N/A","Borescopes",802,1199.99,-24,4,3,-69,5605.11,3136.59,7,4.3,"Hanxuan tech","China",1,0,"N/A","Large bulky",15,15.2,19,21.15,2181.04,6016.67,"03/31/2025",17,8,5,0.6
"https://amazon.com/dp/B0D9JFTZX5","https://m.media-amazon.com/images/I/71aCD9xqgGL._SX450_.jpg","B0D9JFTZX5","Teslong Articulating Borescope, Autofocus 5-inch IPS Industrial Endoscope Inspection Camera with Two-Way Articulation Auto Focus Probe, Fiber Optic Scope for Automotive Mechanics (0.33inch-5FT)","Teslong","FBA","Industrial & Scientific",216991,"N/A","N/A","N/A","N/A","Borescopes",448,289.99,-4,2,2,-113,502.65,502.58,21,4.8,"Teslong","China",1,88,"N/A","Large Standard-Size",3.43,8.7,16.61,3.44,249.55,688.42,"01/31/2025",16,9,0,0.08
"https://amazon.com/dp/B0D9NV4JPY","https://m.media-amazon.com/images/I/71GCNJ0pVaL._SX450_.jpg","B0D9NV4JPY","Sewer Inspection Camera 100FT,with 32GB Card Meter Counter,JQKJCAM 17MM/0.67'' Plumbing Sewer Drain Snake Camera with Light 4.3'' Video Screen,HD Bore Scope for Drain Pipe Line (30M)","JQKJCAM","FBA","Industrial & Scientific",217057,"N/A","N/A","N/A","N/A","Borescopes",449,246.99,-4,11,3,3,2789.48,808.67,3,5,"JJKJ Cam","China",1,0,"N/A","Large Standard-Size",6.38,12,13.5,8.05,520.37,1435.5,"09/30/2025",16,7,2,3.67
"https://amazon.com/dp/B0DP1Z4V17","https://m.media-amazon.com/images/I/71KEZQfH-7L._SX450_.jpg","B0DP1Z4V17","ESANHAO Sewer Camera 100ft with Light, 4500mAh Battery, 0.9in/23mm Pipe Inspection Video & Audio Recording, Distance Counter, 7"" Screen, Included 32GB Card","ESANHAO","FBA","Industrial & Scientific",218825,"N/A","N/A","N/A","N/A","Borescopes",450,329.99,110,13,6,-15,5100.34,2036.17,4,4.5,"ESANHAO Store","China",1,0,"N/A","Large bulky",11.22,12.56,14.61,13.71,1036.59,2859.57,"07/31/2025",11,7,4,3.27
"https://amazon.com/dp/B0DP1XJSKS","https://m.media-amazon.com/images/I/71k4feKEcJL._SX450_.jpg","B0DP1XJSKS","ESANHAO Sewer Camera with Locator 100ft, 7"" HD Screen, Self Leveling Distance Counter Drain Pipe Inspection Camera, Video & Audio Recording Snake Camera with Light, Included 32GB Card","ESANHAO","FBA","Industrial & Scientific",218894,"N/A","N/A","N/A","N/A","Borescopes",450,659.99,1,13,1,-15,5100.34,849.35,4,4.5,"ESANHAO Store","China",1,0,"N/A","Large bulky",11.25,15.25,16.25,17.25,1403.63,3872.07,"07/31/2025",11,8,4,3.27
"https://amazon.com/dp/B0DP1ZV47C","https://m.media-amazon.com/images/I/71RHLbpmT9L._SX450_.jpg","B0DP1ZV47C","ESANHAO Sewer Camera 100ft, Self Leveling Pipe Camera, Distance Counter Inspection Camera, 4500mAh Battery Snake Camera with Light, 7"" Color HD Screen, Video & Audio Recording, Included 32GB Card","ESANHAO","FBA","Industrial & Scientific",218894,"N/A","N/A","N/A","N/A","Borescopes",450,359.99,1067,13,4,-15,5100.34,1321.29,4,4.5,"ESANHAO Store","China",1,0,"N/A","Large bulky",11,12.5,14.2,13.45,983.03,2711.81,"07/31/2025",11,7,4,3.27
"https://amazon.com/dp/B0BGBNFSV2","https://m.media-amazon.com/images/I/61t9pe2ZltL._SX450_.jpg","B0BGBNFSV2","ESANHAO 17MM Sewer Camera, Pipe Inspection Camera with 16GB TF Card, 9"" Monitor, AHD 720P, 25M/82ft, Silver, Waterproof","ESANHAO","FBA","Industrial & Scientific",218979,614019415528,"N/A",0614019415528,"N/A","Borescopes",451,278.99,14,1,1,-100,319.19,319.11,12,3.2,"ESANHAO","China",1,39,-71,"Large Standard-Size",5.39,9.65,11.34,6.17,296.96,819.21,"12/31/2023",38,6,0,0.1
"https://amazon.com/dp/B0BVZD1XBM","https://m.media-amazon.com/images/I/51FmDWQTqWL._SX450_.jpg","B0BVZD1XBM","Sanyipace FHD Camera Probe for Sewer Camera, 12pcs LED Lights, IP68 Waterproof, Drain Camera Head (ONLY for Sanyipace Model Number: F927ADFB, S8951DM)","Sanyipace","FBM","Industrial & Scientific",219472,"N/A","N/A","N/A","N/A","Borescopes",453,169.99,-34,13,5,-8,2511.11,912.73,3,4.7,"SanyipaceDirect Store","China",1,273,"N/A","Large Standard-Size",1.97,6.69,1.97,0.22,"N/A","N/A","05/31/2025",33,3,5,4.36
"https://amazon.com/dp/B0B3DH6L6Q","https://m.media-amazon.com/images/I/61QqGFleDiL._SX450_.jpg","B0B3DH6L6Q","Sanyipace Sewer Camera Probe with 512Hz Transmitter, Without Self-Leveling Function, 12pcs LED Lights, Drain Camera Head (ONLY for Sanyipace: F929DJTX, 9723WF, 9723D, 9300D)","Sanyipace","FBM","Industrial & Scientific",219485,"N/A","N/A","N/A","N/A","Borescopes",453,209.99,-108,13,0,-8,2511.11,"-",3,4.7,"SanyipaceDirect Store","China",1,273,"N/A","Large Standard-Size",2.05,2.05,6.89,0.33,"N/A","N/A","05/31/2025",41,3,5,4.36
"https://amazon.com/dp/B0B31HCHNB","https://m.media-amazon.com/images/I/71dVWp+wlfL._SX450_.jpg","B0B31HCHNB","Autel MaxiVideo MV108S Digital Inspection Camera, 2025 Upgrade MV108/ MV105S/ MV105, 2MP 1920x1080, IP67 Waterproof Industrial Endoscope, 39.37'' Flexible Snake Cable, Compatible w/Autel Scanner & PC","Autel","FBA","Industrial & Scientific",220275,762917121895,"N/A",0762917121895,"N/A","Borescopes",454,44.99,-4,7,7,-50,353.95,353.84,47,4.7,"Autel Store","China",1,251,-23,"Large Standard-Size",2.01,6.85,12.68,0.88,87.9,242.48,"10/31/2024",41,7,0,0.16
"https://amazon.com/dp/B0CQVGP1XH","https://m.media-amazon.com/images/I/7195i5O08SL._SX450_.jpg","B0CQVGP1XH","SKYBASIC Endoscope Camera with Light, 4.3'' LCD Screen HD Digital Handheld Borescope IP67 Waterproof Snake Sewer Inspection Camera with 8 LED Lights, 3 Accessories, Semi-Rigid Cable-15M(49.2FT)","SKYBASIC","FBA","Industrial & Scientific",221680,"N/A","N/A","N/A","N/A","Borescopes",443,69.99,-8,18,18,141,848.96,848.86,466,4.6,"PENGERKEJI","China",2,704,"N/A","Large Standard-Size",4.13,8.03,11.18,2.25,186.9,515.59,"05/31/2024",23,8,2,0.04
"https://amazon.com/dp/B06XKDL1YR","https://m.media-amazon.com/images/I/71AMaS+kW9L._SX450_.jpg","B06XKDL1YR","RIDGID 36848 Model Micro CA-150 Hand-Held Inspection Camera, Borescope","RIDGID","Amazon","Industrial & Scientific",221959,095691368485,00095691368485,0095691368485,"N/A","Borescopes",444,255.42,25,16,16,81,4098.03,4097.9,95,4.1,"Amazon","N/A",12,170,-22,"Large bulky",5.2,15.24,15.27,5.97,"N/A","N/A","11/30/2023",104,19,0,0.17
"https://amazon.com/dp/B0CRDRNHHD","https://m.media-amazon.com/images/I/614mEQb9gxL._SX450_.jpg","B0CRDRNHHD","Sewer Drain Camera 100FT,Waterproof 0.9''/23MM JQKJCAM Snake Plumbing Sewer Line Inspection Camera 100 Foot wtih 12 Light 16GB Card 4.3‘’ Screen 8500mAh Battery Meter Counter for Pipes (30m)","JQKJCAM","FBA","Industrial & Scientific",222691,"N/A","N/A","N/A","N/A","Borescopes",447,339.6,-6,11,8,3,2789.48,1980.52,3,5,"JJKJ Cam","China",1,0,"N/A","Large Standard-Size",6.25,12,13.75,8.8,519.21,1432.29,"09/30/2025",22,8,2,3.67
"https://amazon.com/dp/B0F2HP61PW","https://m.media-amazon.com/images/I/51BM98usI0L._SX450_.jpg","B0F2HP61PW","Okk Sewer Camera with Locator, Drain Camera 100ft, Pipe Inspection with 512Hz Sonde, Self-Leveling, Industrial Endoscope with DVR, 9"" LCD, Meter Counter, 7mm Cable, IP68 Waterproof, 12 LEDs, 32GB Card","okk","FBA","Industrial & Scientific",223030,"N/A","N/A","N/A","N/A","Borescopes",468,1199.99,-11,14,8,,18023.51,9176.67,10,4.4,"ZOZUS-DIRECT","China",1,0,"N/A","Large bulky",13,19,20.5,22.15,2549.33,7032.64,"10/31/2025",8,8,11,1.41
"https://amazon.com/dp/B07THMMMK9","https://m.media-amazon.com/images/I/61eG8n79N-L._SX450_.jpg","B07THMMMK9","BlueFire Dual Lens Wireless Endoscope,Zoomable Focus 1800mA Battery Wireless Endoscope,1080P 5.5mm Semi-Rigid Inspection Camera for iOS and Android Smartphone, Tablet(11.5FT)","BlueFire","FBA","Industrial & Scientific",223470,"N/A","N/A","N/A","N/A","Borescopes",471,30.99,13,10,10,457,309.36,309.14,37,4,"BlueFire Tech","China",1,76,12,"Large Standard-Size",2.3,4.4,4.9,0.57,24.97,68.87,"03/31/2025",76,6,0,0.27
"https://amazon.com/dp/B085H8FHBY","https://m.media-amazon.com/images/I/71RNp4LSCiL._SX450_.jpg","B085H8FHBY","Autel MaxiVideo MV460 Inspection Camera, 2025 1080P HD Industrial Endoscope, Digital Videoscope with 8.5mm 2MP Camera 1m Semi-Rigid Flexible Cable, 360°Rotation, 7 X Zoom, Upgraded Ver. of MV400","Autel","FBA","Industrial & Scientific",223678,706597653277,"N/A",0706597653277,"N/A","Borescopes",461,159.2,-32,1,1,,227.66,227.59,9,4.5,"Autel Official","Hong Kong",1,17,-70,"Large Standard-Size",5.79,12.01,15.12,5.47,529.36,1460.3,"10/31/2024",68,9,0,0.13
"https://amazon.com/dp/B09LTXDJBP","https://m.media-amazon.com/images/I/717u1SF6doL._SX450_.jpg","B09LTXDJBP","BlueFire Dual Lens Wireless Endoscope,1080P 8.0mm Semi-Rigid HD Inspection Camera, Zoomable Focus 1800mA Battery Dual Camera Borescope for Android and iOS Smartphones, Tablet (11.5FT)","BlueFire","FBA","Industrial & Scientific",224020,"N/A","N/A","N/A","N/A","Borescopes",449,30.99,17,29,29,-5,891,890.57,44,4.2,"BlueFire Tech","China",1,248,27,"Large Standard-Size",2.2,4.37,4.8,0.59,23.3,64.27,"07/31/2024",48,6,0,0.65
"https://amazon.com/dp/B0FK294Z6X","https://m.media-amazon.com/images/I/714dmq3IZTL._SX450_.jpg","B0FK294Z6X","Anysun 9'' Sewer Camera Self Leveling, Length Marker, 5100mAh, IPS Screen, HD 1080P with DVR - 32GB, IP68 Sewer Pipe Cam, Sewer Scope Pipe Drain Plumbing Inspection Cameras Borescope Snake (100Ft/30M)","anysun","FBA","Industrial & Scientific",224075,"N/A","N/A","N/A","N/A","Borescopes",462,469.99,9,46,46,,18831.92,18831.32,2,5,"Yongchangsheng tech","China",1,0,"N/A","Large bulky",12,12,12,8,870,2400,"10/31/2025",3,7,2,22.81
"https://amazon.com/dp/B09XDVLN1X","https://m.media-amazon.com/images/I/41gxLaDTNWL._SX450_.jpg","B09XDVLN1X","Sanyipace HD Camera Probe for Sewer Camera, 12pcs LED Lights, IP68 Waterproof, Drain Camera Head (ONLY for Sanyipace Model Number: 9723WF, 9723D, 9300D, S8968DM)","Sanyipace","FBM","Industrial & Scientific",226564,"N/A","N/A","N/A","N/A","Borescopes",454,169.99,-34,13,5,-8,2511.11,916.17,3,4.7,"SanyipaceDirect Store","China",1,273,"N/A","Large Standard-Size",2.05,6.34,6.77,0.26,"N/A","N/A","05/31/2025",43,6,5,4.36
"https://amazon.com/dp/B0BCK4ZV3G","https://m.media-amazon.com/images/I/51ZPRVdSJBL._SX450_.jpg","B0BCK4ZV3G","Sanyipace Sewer Camera Probe with 512Hz Transmitter & Self-Leveling Function, 12 LED Lights, 1080P FHD, IP68 Waterproof (ONLY for Sanyipace Model Number: F5800ADJKABTX, F5100DJKABTX)","Sanyipace","FBA","Industrial & Scientific",226564,"N/A","N/A","N/A","N/A","Borescopes",454,299.99,40,13,2,-8,2511.11,677.01,3,4.7,"SanyipaceDirect Store","China",1,273,"N/A","Large Standard-Size",1.54,3.94,7.13,0.44,21.78,60.09,"05/31/2025",39,5,5,4.36
"https://amazon.com/dp/B08HD8W26Y","https://m.media-amazon.com/images/I/61ZqbCtPjhL._SX450_.jpg","B08HD8W26Y","P40 Handheld Endoscope 1920 x 1080P Industrial Inspection Camera 4.3inch Color Display Screen Endoscope 8mm","FTVOGUE","FBA","Industrial & Scientific",226649,"N/A","N/A","N/A","N/A","Borescopes",464,49.36,-4,0,0,,"-","-",4,4.3,"Astyer-X","China",2,10,-33,"Large Standard-Size",2.6,4.96,8.62,1.01,55.95,154.36,"06/30/2024",62,9,0,0
"https://amazon.com/dp/B0DGQTDMBN","https://m.media-amazon.com/images/I/71Bwy23kedL._SX450_.jpg","B0DGQTDMBN","Anysun Sewer Camera with Locator Set, Self-Leveling, 7mm Cable with Depth Marker, IP68 Waterproof Plumbing Endoscope Drain Snake Camera with 9'' Color Screen, 12pcs Light, Recorder with 32GB(100FT)","anysun","FBA","Industrial & Scientific",226661,717331218850,"N/A",0717331218850,"N/A","Borescopes",464,899.99,-12,0,0,,"-","-",1,1,"ToBestGift","China",1,0,"N/A","Large bulky",13,19,20.5,23.65,2549.33,7032.64,"05/31/2025",23,7,0,0
"https://amazon.com/dp/B0DYDPG8WK","https://m.media-amazon.com/images/I/71qAIA60LfL._SX450_.jpg","B0DYDPG8WK","Dual-Lens Industrial Borescope Camera with 5 inch IPS Screen, 32GB Memory Card, Photo/Video Recording Enabled, 16.5FT/5M Semi-Rigid Cable with 8+1 Adjustable LEDs, IP67 Waterproof","KozyOne","FBA","Industrial & Scientific",227235,"N/A","N/A","N/A","N/A","Borescopes",465,59.99,-8,0,0,,"-","-",31,4.8,"KozyOne US","China",1,0,"N/A","Large Standard-Size",3.31,6.54,8.11,1.12,88.25,243.46,"06/30/2025",9,6,0,0
"https://amazon.com/dp/B0C22ZS2FC","https://m.media-amazon.com/images/I/81rImDVF4NL._SX450_.jpg","B0C22ZS2FC","Anysun Sewer Camera with Locator, Self Leveling, Distance Counter, 512Hz Pipe Inspection Camera with DVR Recorder, Waterproof IP68 Plumbing Camera, Industrial Drain Camera w 7"" HD Color Screen(100Ft)","anysun","FBA","Industrial & Scientific",227239,774196179610,"N/A",0774196179610,"N/A","Borescopes",683,800,-2,16,5,54,15100.08,3757.04,173,3.9,"Yongchangsheng tech","China",1,185,-35,"Large bulky",9,19.5,24,23.2,2120.63,5850,"03/31/2024",30,7,10,0.09
"https://amazon.com/dp/B0DJQMW9CJ","https://m.media-amazon.com/images/I/614FCZM0r2L._SX450_.jpg","B0DJQMW9CJ","Endoscope Camera with Light 1920P HD, 6FT Semi-Rigid Snake, 8 Adjustable LED Light, 8mm IP67 Waterproof Inspection Camera for iOS","ZOIOT","FBA","Industrial & Scientific",233709,"N/A","N/A","N/A","N/A","Borescopes",475,25.99,1,16,16,-6,417.11,416.8,47,3.7,"YFD_ZOIOT","China",1,0,"N/A","Large Standard-Size",0.83,5,5.04,0.2,10.53,29.05,"05/31/2025",13,7,0,0.34
"https://amazon.com/dp/B0CR3JKML1","https://m.media-amazon.com/images/I/51v+SkEGDvL._SX450_.jpg","B0CR3JKML1","Endoscope Camera for iPhone 14/13/12/11 Pro/Pro Max,1920P Inspection Camera with 8 Adjustable LED Lights, IP68 Waterproof Borescope Snake Camera for iPhone & iPad (16.5ft Semi-Rigid Cable)","LUKZATEN","FBA","Industrial & Scientific",234218,"N/A","N/A","N/A","N/A","Borescopes",476,21.95,-5,12,12,-59,261.78,261.67,17,4.2,"Lukzaten US","China",1,255,"N/A","Large Standard-Size",1.46,4.76,4.8,0.4,16.79,46.33,"06/30/2025",23,9,0,0.7
"https://amazon.com/dp/B0CX4C3QXK","https://m.media-amazon.com/images/I/51Im2mzfZuL._SX450_.jpg","B0CX4C3QXK","Teslong Mirrors Set of Rifle Borescope, Only Applies to NTG200H Barrel Bore Scope.","Teslong","FBA","Industrial & Scientific",234437,"N/A","N/A","N/A","N/A","Borescopes",463,19.99,-4,9,9,59,189.22,188.94,3,3.7,"Teslong","China",1,130,"N/A","Large Standard-Size",1.02,2.95,2.95,0.09,4.47,12.33,"02/28/2025",20,2,0,3.16
"https://amazon.com/dp/B09HTJP92P","https://m.media-amazon.com/images/I/51fH8feACrL._SX450_.jpg","B09HTJP92P","ANYSUN Sewer Camera's Accessories Camera with 512hz Sonde","anysun","FBM","Industrial & Scientific",234672,770887234361,"N/A",0770887234361,"N/A","Borescopes",477,299.99,5,17,17,150,5202.8,5202.51,5,2.9,"ToBestGift","China",1,89,53,"N/A","N/A","N/A","N/A","N/A","N/A","N/A","03/31/2024",49,4,0,3.46
"https://amazon.com/dp/B0FF9YGSVY","https://m.media-amazon.com/images/I/71YQIYhwtfL._SX450_.jpg","B0FF9YGSVY","Endoscope Camera with Light, 1920P HD Borescope Camera with 8 Adjustable LED Lights, 5.9ft Bellows Endoscope with Light, IP67 Waterproof 8mm Endoscope for iOS and Android (5004 PRO)","ZOIOT","FBA","Industrial & Scientific",235143,"N/A","N/A","N/A","N/A","Borescopes",465,29.99,15,32,32,,723.86,723.37,21,4,"YFD_ZOIOT","China",1,0,"N/A","Large Standard-Size",0.87,6.57,6.57,0.36,18.85,52,"09/30/2025",22,9,1,1.52
"https://amazon.com/dp/B0FSRJ2WMT","https://m.media-amazon.com/images/I/71YQIYhwtfL._SX450_.jpg","B0FSRJ2WMT","Endoscope Camera with Light, 1920P HD Borescope Camera with 8 Adjustable LED Lights, 5.9ft Bellows Endoscope with Light, IP67 Waterproof 8mm Endoscope for iOS and Android","ZOIOT","FBA","Industrial & Scientific",235795,"N/A","N/A","N/A","N/A","Borescopes",476,29.99,"N/A",32,0,,723.86,"-",23,4,"YFD_ZOIOT","China",0,0,"N/A","N/A","N/A","N/A","N/A","N/A","N/A","N/A","09/30/2025",4,9,1,1.59
"https://amazon.com/dp/B0FJFX23ZH","https://m.media-amazon.com/images/I/61VZ5ncgfYL._SX450_.jpg","B0FJFX23ZH","Sanyipace Portable Sewer Camera, Short-Distance Pipe Inspection Camera with 5"" HD Screen, 0.7in/18mm IP68 Waterproof Probe, Meter Markers, Magnetic Stand for Multiple Viewing Angles (100FT/30M)","Sanyipace","FBA","Industrial & Scientific",236303,"N/A","N/A","N/A","N/A","Borescopes",479,269.99,"N/A",44,7,,9345.14,1835.47,4,4,"SanyipaceDirect Store","China",1,0,"N/A","Large Standard-Size",8,10,11,8.95,443.06,1222.22,"10/31/2025",4,9,2,11.09
"https://amazon.com/dp/B0FHVPYYQ7","https://m.media-amazon.com/images/I/61HWs34qIML._SX450_.jpg","B0FHVPYYQ7","Sanyipace Portable Sewer Camera with Short-Range Lens, Drain Inspection Camera, 0.7in/18mm IP68 Waterproof Pipe Probe, Length Markers, Perfect Ideal for Plumbers, Homeowners, Contractors (65FT/20M)","Sanyipace","FBA","Industrial & Scientific",236377,"N/A","N/A","N/A","N/A","Borescopes",479,199.99,9,44,38,,9345.14,7509.38,4,4,"SanyipaceDirect Store","China",1,0,"N/A","Large bulky",9,10,11,8.3,498.44,1375,"10/31/2025",4,9,2,14.79
"https://amazon.com/dp/B0CPYFT4YL","https://m.media-amazon.com/images/I/81V+uR-tXyL._SX450_.jpg","B0CPYFT4YL","2-Way Articulating Borescope NIDAGE 0.24in Articulated Endoscope Camera with Light 5'' IPS Inspection Camera Flexible Fiber Optic Snake Scope Cam for Mechanic Aircraft Automotive Wall, 5.2FT","NIDAGE","FBA","Industrial & Scientific",236635,"N/A","N/A","N/A","N/A","Borescopes",468,99.99,-12,9,9,-35,906.89,906.65,52,4.2,"TELESION","China",1,198,"N/A","Large bulky",3,9,19,3,258.28,712.5,"08/31/2024",23,7,2,0.17
"https://amazon.com/dp/B0CNLB131J","https://m.media-amazon.com/images/I/71UZ9UJeIAL._SX450_.jpg","B0CNLB131J","ANYSUN Sewer Camera's Accessories- 9' Screen (Model： 9DX)","anysun","FBM","Industrial & Scientific",237491,774182335877,"N/A",0774182335877,"N/A","Borescopes",480,129.99,29,6,6,38,773.91,773.79,2,5,"ToBestGift","China",1,117,"N/A","N/A","N/A","N/A","N/A","N/A","N/A","N/A","01/31/2025",24,3,0,2.98
"https://amazon.com/dp/B0D4PP5W9S","https://m.media-amazon.com/images/I/7106wYloq9L._SX450_.jpg","B0D4PP5W9S","Triple Lens 1080P Borescope with 50FT Semi-Rigid Cable, 5"" IPS Screen Endoscope Camera with Lights, 1080P Industrial Borescope with 32G Storage Card,IP67 Waterproof Drain Camera","ALIESTFDNO","FBA","Industrial & Scientific",237586,"N/A","N/A",6977772634860,"N/A","Borescopes",470,72.98,2,22,22,-75,1572.06,1571.92,49,3.7,"Lingborx","China",2,536,"N/A","Large Standard-Size",3.43,6.5,8.27,2.2,92.83,256.08,"07/31/2025",18,8,0,0.44
"https://amazon.com/dp/B0DNMJ1WWW","https://m.media-amazon.com/images/I/71WG+ZUBEkL._SX450_.jpg","B0DNMJ1WWW","VEVOR Sewer Camera, 98 ft/30m, Self-Leveling Drain Inspection Tool with 9"" 1080P HD Screen, 36X Zoom, IP68 Waterproof Plumbing Camera with Lights-12 LED, 32GB Card for Duct Pipe","VEVOR","FBM","Industrial & Scientific",237764,197988811633,"N/A",0197988811633,"N/A","Borescopes",481,479.99,13842,15,15,480,7218.6,7218.35,10,5,"Supdear","China",2,0,"N/A","Large bulky",11.61,12.6,12.6,12.39,"N/A","N/A","09/30/2025",12,12,0,1.51
"https://amazon.com/dp/B0FPR1WXYW","https://m.media-amazon.com/images/I/71U52BDc5OL._SX450_.jpg","B0FPR1WXYW","Sanyipace Self-Leveling Sewer Camera 165FT/50M, Drain Inspection Camera with 512Hz Transmitter, Real-Time Distance Counter, 10"" IPS Screen Microphone Speaker, 0.27in Rigid Cable, 32GB TF Card Included","Sanyipace","FBA","Industrial & Scientific",237794,"N/A","N/A","N/A","N/A","Borescopes",471,1599.99,83,16,9,,29874.7,15017.31,3,4,"Urselection","China",1,0,"N/A","Extra-large 50+ to 70 lb",12,23,27,30.5,3751.88,10350,"10/31/2025",2,6,6,5.35
"https://amazon.com/dp/B0D2Z14P81","https://m.media-amazon.com/images/I/71mdLVIBjIL._SX450_.jpg","B0D2Z14P81","JINMEI Hard EVA Carrying Case Compatible with MugEasy/Daxiongmao/DEPSTECH Borescope Inspection Camera,Lens Industrial Endoscope storage case (5M-10M line can also be accommodated)","JINMEI","FBA","Industrial & Scientific",237818,"N/A","N/A","N/A","N/A","Borescopes",473,19.99,13,11,11,-50,215.98,215.78,26,4.4,"JINMEI STORE","China",1,332,"N/A","Large Standard-Size",3.5,7.83,8.31,0.44,114.66,316.3,"11/30/2024",19,8,0,0.42
"https://amazon.com/dp/B0F2RTP13K","https://m.media-amazon.com/images/I/61BAEQkGStL._SX450_.jpg","B0F2RTP13K","Portable Mini 4TH Generation Professional Body Scanner with 48 Reports Analyzer Tester","Generic","FBA","Industrial & Scientific",239036,"N/A","N/A","N/A","N/A","Borescopes",485,125.8,-3,2,2,300,238.41,238.35,"N/A","N/A","WuTao2024","China",1,0,"N/A","Large Standard-Size",7.82,5.9,3.92,1.82,91.06,251.2,"06/30/2025",8,4,0,"N/A"
"https://amazon.com/dp/B0DCV9B59W","https://m.media-amazon.com/images/I/71cd6V+-7eL._SX450_.jpg","B0DCV9B59W","Dual Lens Bore Scope Camera with Light, Boroscope Inspection Camera, Industrial Cameras 1080P 4.3"" Screen, Borescopes Waterproof, Sewer Drain Plumbing Snake Cameras, Gadgets for Men - 16.5ft, 32GB","Julaiwy","FBA","Industrial & Scientific",242079,"N/A","N/A","N/A","N/A","Borescopes",489,44.9,-9,1,1,-75,49.9,49.86,28,4.7,"Kecowl","China",1,57,"N/A","Large Standard-Size",3.82,5.28,10.43,1.34,105.91,292.18,"11/30/2024",15,9,0,0.04
