"https://amazon.com/dp/B0FB3815Z5","https://m.media-amazon.com/images/I/716H8SnI5qL._SX450_.jpg","B0FB3815Z5","Articulating Borescope 2-Way 210°- JESERAL 8.5mm Lens Endoscope camera with 6 light, HD1080P Inspection Camera with Steering Probe, Compatible with Android&iOS Phone, scope with 3.3FT Semi-Rigid Cable","Jeseral","FBA","Industrial & Scientific",347022,"N/A","N/A","N/A","N/A","Borescopes",675,129.99,-9,6,6,,812.45,812.31,5,5,"JESERAL","China",1,0,"N/A","Large Standard-Size",3.23,7.4,14.92,2.14,179.55,495.3,"09/30/2025",6,7,0,1.25
"https://amazon.com/dp/B0CMXZG7T4","https://m.media-amazon.com/images/I/61koHW1WmiL._SX450_.jpg","B0CMXZG7T4","3 in 1 Endoscope 3.9mm Lens Type C Inspection Camera IP67 Borescope Endoscope Snake Camera with 6 Adjustable Led Lights (5 Meters Soft Cord)","Walfront","FBA","Industrial & Scientific",348282,"N/A","N/A","N/A","N/A","Borescopes",677,27.29,-5,3,3,-40,83.11,83.01,"N/A","N/A","Dawnsou","China",2,0,"N/A","Large Standard-Size",6.3,6.3,1.57,0.29,31.46,86.79,"07/31/2025",24,9,0,"N/A"
"https://amazon.com/dp/B0DJSSV6X9","https://m.media-amazon.com/images/I/61d8+8-DywL._SX450_.jpg","B0DJSSV6X9","Dearsee ZX2-D1 Two-Way Articulating Borescope with Light, 0.25in Industrial Endoscope Inspection Camera, 5-inch IPS Articulated Snake Camera, 8X Zoom Video Inspection Scope - 10FT","Dearsee","FBA","Industrial & Scientific",348600,729162039696,"N/A",0729162039696,"N/A","Borescopes",678,169.8,23,0,0,-111,"-","-",7,4.2,"Dearsee","China",1,0,"N/A","Large Standard-Size",2.99,10.24,16.26,1.87,250.65,691.45,"01/31/2025",13,7,0,0
"https://amazon.com/dp/B01N4QY6B2","https://m.media-amazon.com/images/I/71UZU8tPTAL._SX450_.jpg","B01N4QY6B2","Vividia Ablescope VA-W03A WiFi Box USB to WiFi Converter for iPhones/iPad for USB Digital Borescopes and Microscopes","VIVIDIA","FBA","Industrial & Scientific",349960,759119544072,"N/A",0759119544072,"N/A","Borescopes",662,108,2,6,6,100,662.98,662.86,48,3.6,"DollarsNsense","USA",3,121,-36,"Large Standard-Size",2.6,5,7.4,0.55,48.43,133.61,"11/30/2023",106,9,0,0.13
"https://amazon.com/dp/B0DPM6L36H","https://m.media-amazon.com/images/I/71NqZhutl6L._SX450_.jpg","B0DPM6L36H","Borescope Inspection Camera,Anhendeler Endoscope Camera with Light, IP67 Waterproof, 1080P HD, 16.5ft Semi-Rigid Borescope for Automotive, Pipe,Gadgets Tool for Men (16.5FT)","Anhendeler","FBA","Industrial & Scientific",350375,"N/A","N/A","N/A","N/A","Borescopes",680,23.74,-3,5,5,60,120.75,120.54,78,4.4,"Anhendeler","China",1,0,"N/A","Large Standard-Size",2.72,5.2,7.01,1.04,49.92,137.71,"01/31/2025",11,6,2,0.06
"https://amazon.com/dp/B0FGH475P3","https://m.media-amazon.com/images/I/41AIoOSkc2L._SX450_.jpg","B0FGH475P3","Milwaukee Electric - M12. AUTO Technician BORESCOPE","Milwaukee","FBM","Industrial & Scientific",350742,045242821525,00045242821525,0045242821525,"N/A","Borescopes",665,546.96,158,7,7,,3458.22,3458.1,"N/A","N/A","Stevie’s Tool Garage","USA",3,0,"N/A","Large Standard-Size",7,5,2,1,"N/A","N/A","08/31/2025",3,3,0,"N/A"
"https://amazon.com/dp/B0DQYBRYMF","https://m.media-amazon.com/images/I/71B-79RH4bL._SX450_.jpg","B0DQYBRYMF","Endoscope Camera with Light, Jebousike 1080P HD Borescope Inspection Camera with 4.3"" IPS Screen, 98.4FT Flexible Sewer Camera, IP67 Waterproof Plumbing Snake Camera, Cool Gadgets for Men, Women","Jebousike","FBA","Industrial & Scientific",351008,"N/A","N/A","N/A","N/A","Borescopes",681,60.99,-9,3,0,-92,131.58,"-","N/A","N/A","Jebousike","China",1,0,"N/A","Large Standard-Size",11,8.07,3.93,3.4,175.64,484.54,"05/31/2025",11,7,6,"N/A"
"https://amazon.com/dp/B0DQY8P187","https://m.media-amazon.com/images/I/71iWD1+iRFL._SX450_.jpg","B0DQY8P187","Endoscope Camera with Light, 4.3"" Inspection Camera, 1920P HD Borescope Camera with 8 LED Lights, IP67 Waterproof Snake Sewer Camera, 32.8FT Semi-Rigid Cord Drain Pipe Camera Cool Gadgets Tool","Jebousike","FBA","Industrial & Scientific",351027,"N/A","N/A","N/A","N/A","Borescopes",681,52.99,-8,3,0,-92,131.58,"-","N/A","N/A","Jebousike","China",1,0,"N/A","Large Standard-Size",1.38,3.39,4.06,0.26,9.53,26.28,"05/31/2025",11,7,6,"N/A"
"https://amazon.com/dp/B0CSMV9Q1L","https://m.media-amazon.com/images/I/71LBY4aZ8vL._SX450_.jpg","B0CSMV9Q1L","Sewer Camera 150FT,9inch 16GB TFT Color Monitor,JQKJCAM 17MM/0.67'' Sewer Drain Plumbing Inspection Cameras 150 FT for 3/4 Pipe,Waterproof Sewer Scope with Light Meter Counter Big Spool (50M/165FT)","JQKJCAM","FBA","Industrial & Scientific",351045,"N/A","N/A","N/A","N/A","Borescopes",681,489.5,-5,10,6,12,5552.7,2889.55,3,5,"JJKJ Cam","China",1,96,"N/A","Large bulky",12.24,17.63,20.04,16.71,2177.24,6006.19,"09/30/2024",22,8,10,3.4
"https://amazon.com/dp/B0DQYBYJ4F","https://m.media-amazon.com/images/I/71cyHXEUZcL._SX450_.jpg","B0DQYBYJ4F","Dual Lens Endoscope Camera with Light - Inspection Borescope Camera with 4.3"" IPS Screen, 1920P HD Snake Camera with 8 LED Lights, 3.3FT Semi-Rigid Cord Bore Scope, IP67 Waterproof Endoscope for Sewer","Jebousike","FBA","Industrial & Scientific",351047,"N/A","N/A","N/A","N/A","Borescopes",681,44.99,-5,3,1,-92,131.58,39.99,"N/A","N/A","Jebousike","China",1,0,"N/A","Large Standard-Size",3.11,5.43,7.83,0.78,66.66,183.88,"05/31/2025",11,8,6,"N/A"
"https://amazon.com/dp/B0F4X1ZCXC","https://m.media-amazon.com/images/I/71eku3WlexL._SX450_.jpg","B0F4X1ZCXC","Sewer Camera 200FT Self Leveling,JQKJCAM 23MM/0.9'' Drain Pipe Borescope Sewer Inspection Camera Snake with 12 Light 9'' 16GB Screen Meter Counter Big Spool Roller Guide Wheel for Plumber (200 FT/61M)","JQKJCAM","FBA","Industrial & Scientific",351059,"N/A","N/A","N/A","N/A","Borescopes",681,661,-17,10,2,12,5552.7,1355.49,3,5,"JJKJ Cam","China",1,96,"N/A","Large bulky",11.75,17.25,19.75,18.05,2015.44,5559.83,"09/30/2024",7,8,10,3.4
"https://amazon.com/dp/B0DQY9BM4H","https://m.media-amazon.com/images/I/71LRZvpCcHL._SX450_.jpg","B0DQY9BM4H","Dual Lens Borescope, Endoscope Camera with Light, IP67 Waterproof Endoscope, 1080P HD Inspection Camera, Borescope Camera with Light, Snake Camera, 32.8ft Endoscope Camera, Gadgets for Men (4.3”)","Jebousike","FBA","Industrial & Scientific",351114,"N/A","N/A","N/A","N/A","Borescopes",682,53.99,8,3,0,-92,131.58,"-","N/A","N/A","Jebousike","China",1,0,"N/A","Large Standard-Size",3.11,5.35,7.83,1.44,65.69,181.21,"05/31/2025",11,7,6,"N/A"
"https://amazon.com/dp/B0DQYBZDX5","https://m.media-amazon.com/images/I/71rfZw4NMRL._SX450_.jpg","B0DQYBZDX5","Dual Lens Industrial Endoscope, 1080P Digital Borescope Inspection Camera, 7.9mm IP67 Waterproof Camera, Sewer Camera with 4.3"" LCD Screen, 8 LED Lights, 16.5FT Semi-Rigid Cable","Jebousike","FBA","Industrial & Scientific",351115,"N/A","N/A","N/A","N/A","Borescopes",681,46.99,-1,3,1,-92,131.58,29.77,16,4.6,"Jebousike","China",1,0,"N/A","Large Standard-Size",8.07,5.3,3.15,1.1,67.83,187.12,"05/31/2025",11,7,6,0.17
"https://amazon.com/dp/B0DQY8XVZT","https://m.media-amazon.com/images/I/71buxscaTkL._SX450_.jpg","B0DQY8XVZT","Industrial Endoscope Inspection Camera, 4.3"" IPS Borescope Sewer Camera with IP67 Waterproof Snake Camera with 8 LED Lights, 1080P Digital Borescope Inspection Camera 65.6FT Semi-Rigid Cable","Jebousike","FBA","Industrial & Scientific",351115,"N/A","N/A","N/A","N/A","Borescopes",681,55.99,-5,3,0,-92,131.58,"-","N/A","N/A","Jebousike","China",1,0,"N/A","Large Standard-Size",3.86,8.19,11.14,2.46,177.24,488.92,"05/31/2025",11,7,6,"N/A"
"https://amazon.com/dp/B0DKX9FZ8M","https://m.media-amazon.com/images/I/71CmC8rGZ2L._SX450_.jpg","B0DKX9FZ8M","Anysun Sewer Camera Self Leveling with 512Hz Sonde, 7MM Thick Pushrod, Length Mark, 32GB Card, 9'' HD Monitor with DVR, 300Ft Sewer Scope Pipe Drain Inspection Camera IP68 Borescope w/Adjustable LEDs","anysun","FBA","Industrial & Scientific",351796,"N/A","N/A","N/A","N/A","Borescopes",1111,999.99,-10,8,1,87,6116.31,645.84,2,5,"Yongchangsheng tech","China",1,0,"N/A","Large bulky",13.75,19,20.75,25.15,2729.29,7529.08,"02/28/2025",11,8,7,4.21
"https://amazon.com/dp/B0FQPK66F7","https://m.media-amazon.com/images/I/7186TNp6btL._SX450_.jpg","B0FQPK66F7","3.9mm Small Hole Borescope, Aperture Endoscope Camera - Suitable for. 20 Caliber and Larger Pipes, Gun Barrel Inspection Tool, Suitable for Android and iOS Smartphones iPhone, iPad, Samsung","StrongTools","FBA","Industrial & Scientific",352466,"N/A","N/A","N/A","N/A","Borescopes",685,35.99,"N/A",23,23,,1096.45,1096.34,17,3.5,"StrongTools","China",1,0,"N/A","Large Standard-Size",2.2,4.69,5.16,0.31,26.82,73.99,"09/30/2025",2,8,0,1.36
"https://amazon.com/dp/B08Z9THK1B","https://m.media-amazon.com/images/I/717am8N275L._SX450_.jpg","B08Z9THK1B","DrainTrain Video Camera Roller Skid for Pipe Inspection. Works with Any Camera up to 1.375"" or 35mm in Diameter. Centers Cameras in 3"" (75mm) Pipes","CPI Products","FBM","Industrial & Scientific",352753,858724002578,"N/A",0858724002578,"N/A","Borescopes",672,135,"N/A",3,3,38,396.24,396.18,14,3.4,"Handy Products by Cavallero Products","USA",1,57,-46,"Large Standard-Size",4.49,4.61,7.24,0.53,"N/A","N/A","01/31/2024",56,8,0,0.21
"https://amazon.com/dp/B08Q4CGT1D","https://m.media-amazon.com/images/I/51SHGMJvSFL._SX450_.jpg","B08Q4CGT1D","USB Endosecope, 3 in 1 Endoscope 5.5mm Lens Borescope Inspection Camera with 6 Adjustable LED 5M Cable Scope Camera IP67 Type-C USB Video Compatible with Phones/Tablets/Computers","Oumefar","FBA","Industrial & Scientific",353564,"N/A","N/A",9588084492351,"N/A","Borescopes",687,15.89,3,3,3,-82,31.18,31.12,11,3.4,"Lanxued","China",2,77,64,"Large Standard-Size",1.26,5,5.08,0.29,16.11,44.43,"08/31/2025",59,8,0,0.23
"https://amazon.com/dp/B09WMFVTWJ","https://m.media-amazon.com/images/I/81znhrYb6cL._SX450_.jpg","B09WMFVTWJ","Teslong Endoscope Replacement Cable with Light, Triple Lens Inspection Camera 7.9mm/0.3inch Waterproof Probe Compatible with NTS500, NTS300(16.5FT)","Teslong","FBA","Industrial & Scientific",354052,"N/A","N/A","N/A","N/A","Borescopes",688,99.99,-5,5,5,-32,546.22,546.07,7,4.5,"Teslong","China",1,89,287,"Large Standard-Size",2.44,8.82,9.61,1.98,104.13,287.24,"03/31/2025",44,6,0,0.78
"https://amazon.com/dp/B0DTDY464M","https://m.media-amazon.com/images/I/61EIK+QLciL._SX450_.jpg","B0DTDY464M","Gzpce Two-Way Articulating Endoscope with Light, Industrial Endoscopic with 5"" IPS Screen,6.4mm IP67 Waterproof Borescope,Snake Camera with 3.28FT Semi-Rigid Cable,32GB SD Card","gzpce","FBA","Industrial & Scientific",355858,"N/A","N/A","N/A","N/A","Borescopes",692,99.9,-5,2,2,,154.31,154.27,1,5,"gzpce","China",1,0,"N/A","Large Standard-Size",2.91,8.39,17.09,2.58,210.07,579.51,"07/31/2025",15,8,0,1.54
"https://amazon.com/dp/B0CS68VYN9","https://m.media-amazon.com/images/I/71u5YkefJoL._SX450_.jpg","B0CS68VYN9","Sewer Camera 150ft,with 9'' Ultra HD 16GB DVR Screen,1080P JQKJCAM Drain Endoscope Pipe Camera Snake with 12 Light and Meter Counter for Sewer Plumbing Duct Inspection (50M/165FT)","JQKJCAM","FBA","Industrial & Scientific",357415,"N/A","N/A","N/A","N/A","Borescopes",681,441.75,"N/A",0,0,40,"-","-",4,4.3,"JJKJ Cam","China",1,0,"N/A","Large bulky",11.18,11.73,12.36,11.95,816.08,2251.26,"01/31/2025",22,8,0,0
"https://amazon.com/dp/B0BWVCMWT4","https://m.media-amazon.com/images/I/51Z80GmO4XL._SX450_.jpg","B0BWVCMWT4","3 in 1 High Definition Endoscope Pipe Inspection Borescope TypeC USB Mobile Phone 3.9mm for Borescopes and Fiberscopes (3.5m Flexible Cord)","Walfront","FBA","Industrial & Scientific",358148,"N/A","N/A","N/A","N/A","Borescopes",684,25.3,-22,0,2,43,"-",58.96,5,3.6,"Luoyuu","China",2,218,54,"Large Standard-Size",1.46,4.84,4.96,0.26,17.62,48.6,"11/30/2024",33,9,0,0.04
"https://amazon.com/dp/B072JCVB6T","https://m.media-amazon.com/images/I/716MR-eVGNL._SX450_.jpg","B072JCVB6T","Professional Borescope Camera Case for Depstech USB, Wireless Endoscope, Goodan, Shekar, Pancellent, Fantronics, Sokos, BlueFire, Smart Divider, Designed Accessories Pockets for USB, Side View Mirror","CaseSack","FBA","Industrial & Scientific",358684,729680113144,"N/A",0729680113144,"N/A","Borescopes",687,15.98,-3,7,7,-22,109.08,108.92,275,4.3,"Casesack","Hong Kong",2,149,23,"Large Standard-Size",2.5,5.5,7,0.34,48.46,133.68,"06/30/2025",99,7,0,0.02
"https://amazon.com/dp/B0FK5LD87G","https://m.media-amazon.com/images/I/71V0MCbAGhL._SX450_.jpg","B0FK5LD87G","Sewer Camera, Self-Leveling Distance Counter Borescope Pipe Inspection Camera with Pull Rod,9"" HD 1080P Screen DVR/Audio Recorder 32G Card 7mm Cable Plumbing Snake Endoscope IP68 Waterproof","SYOWNFS","FBA","Industrial & Scientific",360159,"N/A","N/A","N/A","N/A","Borescopes",696,883.49,"N/A",0,0,,"-","-","N/A","N/A","ENNIO","China",1,0,"N/A","Large bulky",12.5,16,20.5,25.15,2064.24,5694.44,"-",4,7,4,"N/A"
"https://amazon.com/dp/B0DP4KY3GR","https://m.media-amazon.com/images/I/71NNuAK5BZL._SX450_.jpg","B0DP4KY3GR","Sewer Camera Self-Leveling with Locator, 512Hz Sonde Transmitter, Built-in Distance Counter, 9"" HD Screen, Zoom, Adjustable LED, Portable Wheeled Suitcase for Drains, Pipe, Industrial Use (200FT)","PeachLeaf","FBA","Industrial & Scientific",361241,717504238739,"N/A",0717504238739,"N/A","Borescopes",699,1599.99,-7,11,3,288,14582.48,4885.29,1,5,"YoJo-Tech","China",1,0,"N/A","Extra-large 50+ to 70 lb",18.02,21.05,24,42.45,4583.46,12644.03,"02/28/2025",12,9,4,11.2
"https://amazon.com/dp/B0DP32X7SS","https://m.media-amazon.com/images/I/51JcLQHNv0L._SX450_.jpg","B0DP32X7SS","Sewer Camera Self-Leveling with 512Hz Sonde Transmitter, Built-in Distance Counter, 9"" HD Screen, Zoom, Adjustable LED, Portable Wheeled Suitcase Design for Drain, Pipe, and Industrial Use (200FT)","PeachLeaf","FBA","Industrial & Scientific",361280,717504238715,"N/A",0717504238715,"N/A","Borescopes",699,959.99,-7,11,8,288,14582.48,9696.79,1,5,"YoJo-Tech","China",1,0,"N/A","Extra-large 50+ to 70 lb",17,21.5,23.4,37.5,4306.05,11878.75,"02/28/2025",12,8,4,11.2
"https://amazon.com/dp/B0DDQ1JTTL","https://m.media-amazon.com/images/I/51V1bXfzKFL._SX450_.jpg","B0DDQ1JTTL","Two-Way 180°﻿ Articulated Snake Endoscope,0.25in/6.3mm Borescope Camera with Adjustable Light,IP67,Inspection of Narrow Pipelines in car Engines,Gifts for Men (3.3FT)","LANTOTEK","FBA","Industrial & Scientific",362464,739240108213,"N/A",0739240108213,"N/A","Borescopes",700,58.88,"N/A",2,2,,132.36,132.3,"N/A","N/A","LANTOTEK","China",1,0,"N/A","Large Standard-Size",12,5,3,2,90.63,250,"09/30/2025",15,6,1,"N/A"
"https://amazon.com/dp/B0C7G8J4C9","https://m.media-amazon.com/images/I/41ZQaJ25u1L._SX450_.jpg","B0C7G8J4C9","0.67inch/17mm Sewer Camera Head Protective Cover with Screwdriver,Sewer Camera Accessories","SYANSPAN","FBM","Industrial & Scientific",364938,"N/A","N/A","N/A","N/A","Borescopes",703,29.99,-9,5,5,950,142.77,142.59,7,2.5,"pipe camera","China",1,128,"N/A","Large Standard-Size",2.52,3.94,6.73,0.13,"N/A","N/A","12/31/2024",29,1,0,0.73
"https://amazon.com/dp/B0BYX3PGP9","https://m.media-amazon.com/images/I/41Yx+50uMdL._SX450_.jpg","B0BYX3PGP9","USB Endoscope for OTG Android Phone, Laptop, 5.5mm Borescope Inspection Camera Waterproof with USB Type C, Micro-USB Plug 3in1, Pure Copper Cord with 6 LED Lights, Compatible with Most Phone, PC (5m)","iW899Bytto","FBM","Industrial & Scientific",366888,"N/A","N/A","N/A","N/A","Borescopes",698,18.99,-5,7,1,188,111.94,10.61,1,5,"InWorld","Hong Kong",1,37,"N/A","Large Standard-Size",5.2,4.72,1.65,0.27,"N/A","N/A","10/31/2024",32,6,3,6.75
"https://amazon.com/dp/B0BYX46HMS","https://m.media-amazon.com/images/I/41Yx+50uMdL._SX450_.jpg","B0BYX46HMS","USB Endoscope for OTG Android Phone, Laptop, 5.5mm Borescope Inspection Camera Waterproof with USB Type C, Micro-USB Plug 3in1, Pure Copper Cord with 6 LED Lights, Compatible with Most Phone, PC","iW899Bytto","FBM","Industrial & Scientific",366892,"N/A","N/A","N/A","N/A","Borescopes",698,15.99,"N/A",7,0,188,111.94,"-",1,5,"InWorld","Hong Kong",0,37,"N/A","N/A","N/A","N/A","N/A","N/A","N/A","N/A","10/31/2024",32,6,3,6.75
"https://amazon.com/dp/B0BYX2KPDF","https://m.media-amazon.com/images/I/41Yx+50uMdL._SX450_.jpg","B0BYX2KPDF","USB Endoscope for OTG Android Phone, Laptop, 5.5mm Borescope Inspection Camera Waterproof with USB Type C, Micro-USB Plug 3in1, Pure Copper Cord with 6 LED Lights, Compatible with Most Phone, PC (10m)","iW899Bytto","FBM","Industrial & Scientific",366893,"N/A","N/A","N/A","N/A","Borescopes",698,22.99,1,7,0,188,111.94,"-",1,5,"InWorld","Hong Kong",1,37,"N/A","Large Standard-Size",5.24,4.72,1.65,0.51,"N/A","N/A","10/31/2024",32,6,3,6.75
"https://amazon.com/dp/B0BYX25G5L","https://m.media-amazon.com/images/I/41Yx+50uMdL._SX450_.jpg","B0BYX25G5L","USB Endoscope for OTG Android Phone, Laptop, 5.5mm Borescope Inspection Camera Waterproof with USB Type C, Micro-USB Plug 3in1, Pure Copper Cord with 6 LED Lights, Compatible with Most Phone, PC (2m)","iW899Bytto","FBM","Industrial & Scientific",366916,"N/A","N/A","N/A","N/A","Borescopes",698,15.99,-3,7,6,188,111.94,94.53,1,5,"InWorld","Hong Kong",1,37,"N/A","Large Standard-Size",4.53,3.98,0.98,0.18,"N/A","N/A","10/31/2024",32,6,3,6.75
"https://amazon.com/dp/B0BBW9DBL7","https://m.media-amazon.com/images/I/51we07itVzL._SX450_.jpg","B0BBW9DBL7","USB Industrial Endoscope with 6 LED Lights and 7mm Probe for Pipe Inspection","LiebeWH","FBA","Industrial & Scientific",371965,"N/A","N/A","N/A","N/A","Borescopes",705,13.91,15,3,1,125,36.54,10.53,1,3,"Vinnier bm","China",2,27,50,"Large Standard-Size",1.5,4.8,4.84,0.15,17.52,48.33,"08/31/2024",39,9,2,2.91
"https://amazon.com/dp/B0BBWC74DX","https://m.media-amazon.com/images/I/31nahnxpHnL._SX450_.jpg","B0BBWC74DX","USB Industrial Endoscope 6 LED Lights 7mm Probe IP67 Pipe Inspection Camera for Measuring Pipes Underwater Viewing 2M","LiebeWH","FBA","Industrial & Scientific",371967,"N/A","N/A","N/A","N/A","Borescopes",705,12.44,-2,3,2,125,36.54,25.76,"N/A","N/A","Vinnier bm","China",1,27,50,"Large Standard-Size",4.72,4.72,1.57,0.19,17.7,48.82,"08/31/2024",39,9,2,"N/A"
"https://amazon.com/dp/B0C5M8SRQ8","https://m.media-amazon.com/images/I/71VumbWT-jL._SX450_.jpg","B0C5M8SRQ8","Inspection Camera - Endoscope Camera with Light, 1920P HD Bore Scope Borescope with 8 Lights, Waterproof 16.4FT Semi-Rigid Cord for Pipe Inspection, Industrial Endoscope for Phones(Blue)","MugEasy","FBA","Industrial & Scientific",372383,765133804801,"N/A",0765133804801,"N/A","Borescopes",707,29.99,-4,2,2,,71.51,71.37,921,4.3,"EmdoscopeZ","China",1,0,"N/A","Large Standard-Size",1.5,4.65,4.8,0.4,16.81,46.37,"02/28/2025",30,7,0,0
"https://amazon.com/dp/B0D9NT979V","https://m.media-amazon.com/images/I/71cpmS-45FL._SX450_.jpg","B0D9NT979V","Sewer Camera 100FT,with 4.3'' 32GB HD Screen,JQKJCAM 23MM Sewer Pipe Line Cameras,0.9'' Drain Scope Pluming Snake Camera with 12 Light Meter Counter 100FT Cable Waterproof for Pipes Plumber (30m)","JQKJCAM","FBA","Industrial & Scientific",373652,"N/A","N/A","N/A","N/A","Borescopes",715,259.99,-9,5,2,-86,1387.44,414.25,10,4.2,"JJKJ Cam","China",1,116,"N/A","Large Standard-Size",6.5,12.1,14,8.3,554.37,1529.31,"05/31/2024",16,8,19,0.55
"https://amazon.com/dp/B0D9NVPM2Q","https://m.media-amazon.com/images/I/41vnDTBNWkL._SX450_.jpg","B0D9NVPM2Q","Snake Drain Camera 150FT,with 32GB Card 4.3'' Video Screen,JQKJCAM Sewer Inspection Drain Pipe Camera with Light Meter Counter,17MM/0.67'' Plumbing Borescope for Plumber Householder(50M)","JQKJCAM","FBA","Industrial & Scientific",373652,"N/A","N/A","N/A","N/A","Borescopes",715,299.9,"N/A",5,0,-86,1387.44,"-",11,4.3,"JJKJ Cam","China",1,116,"N/A","Large Standard-Size",13.39,11.8,6.3,9.26,501.16,1382.52,"05/31/2024",16,8,19,0.5
"https://amazon.com/dp/B0D9NXWB82","https://m.media-amazon.com/images/I/41s-P-XnQFL._SX450_.jpg","B0D9NXWB82","150 FT Sewer Camera Snake,with 12 LED 32GB Card 4.3'' Video Screen,HD JQKJCAM Plumbing Pipe Drain Inspection Camera with Light Distance Counter for Plumber Householder(50M/165FT)","JQKJCAM","-","Industrial & Scientific",373741,"N/A","N/A","N/A","N/A","Borescopes",715,299.9,"N/A",5,0,-86,1387.44,"-","N/A","N/A",,"N/A",1,116,"N/A","Large Standard-Size",13.39,11.8,6.3,9.26,"N/A","N/A","05/31/2024",16,"N/A",19,"N/A"
"https://amazon.com/dp/B0CTMXJG7V","https://m.media-amazon.com/images/I/61UA4uTBhTL._SX450_.jpg","B0CTMXJG7V","JQKJCAM Sewer Camera Battery,12V 4500mAh Borescope Battery Box for Sewer Camera with 512HZ Sonde 9600F SP09F WP90F,Input 12.6V Output LED 9V Output Camera 9V for Pipe Inspection Camera with Locator","JQKJCAM","FBM","Industrial & Scientific",374088,"N/A","N/A","N/A","N/A","Borescopes",717,159.99,4,6,6,4,942.64,942.55,2,4.5,"JJKJ Cam","China",1,137,"N/A","Large Standard-Size",4.4,3.15,2.44,0.9,"N/A","N/A","04/30/2025",22,9,3,2.95
"https://amazon.com/dp/B005NHJIDU","https://m.media-amazon.com/images/I/41Tn-tkrNQL._SX450_.jpg","B005NHJIDU","ViVidia AbleScope VA-800 USB Flexible Inspection Camera Borescope Vedioscope with 180 Degree Articulating 8.5mm Diameter Probe","VIVIDIA","FBA","Industrial & Scientific",374953,759119543990,"N/A",0759119543990,"N/A","Borescopes",707,399.99,10,0,0,-83,"-","-",25,3.8,"DollarsNsense","USA",2,12,-40,"Large Standard-Size",3.7,11.8,14,2.95,307.74,848.94,"03/31/2024",151,9,0,0
"https://amazon.com/dp/B08QCN6B9G","https://m.media-amazon.com/images/I/71P-NOb5YyL._SX450_.jpg","B08QCN6B9G","Teslong Endoscope Replacement Cable with Light, Dual Lens Inspection Camera 5.5mm/0.21inch Waterproof Probe Compatible with NTS500, NTS300(10FT)","Teslong","FBA","Industrial & Scientific",375044,"N/A","N/A","N/A","N/A","Borescopes",719,99.99,"N/A",4,4,850,444.67,444.54,13,5,"Teslong","China",1,59,90,"Large Standard-Size",2.01,5.75,6.5,0.73,37.82,104.34,"10/31/2023",59,6,0,0.34
"https://amazon.com/dp/B0D1FNRCPV","https://m.media-amazon.com/images/I/519yvEB+IaL._SX450_.jpg","B0D1FNRCPV","HBUDS Protective Cover for Sewer Camera Head Probe, Suitable for 0.87in/22mm and 0.9in/23mm Diameter Drain Pipe Camera Head, Protective Case Compatible with Model: 7D3A/7D1","HBUDS","FBM","Industrial & Scientific",375162,717203890870,"N/A",0717203890870,"N/A","Borescopes",709,23.99,25,0,0,,"-","-","N/A","N/A","Hanxuan tech","China",1,25,"N/A","N/A","N/A","N/A","N/A","N/A","N/A","N/A","03/31/2025",19,4,0,"N/A"
"https://amazon.com/dp/B0FNQSLBVH","https://m.media-amazon.com/images/I/71h5B+UJIPL._SX450_.jpg","B0FNQSLBVH","Sewer Camera with Self-Leveling, 9'' 1080P HD Screen, 165ft Plumbing Snake with Light, IP68 Waterproof Inspection Camera, Drain Pipe with DVR 16GB","DYTesa","FBM","Industrial & Scientific",379356,"N/A","N/A",6967790319481,"N/A","Borescopes",725,729.99,58,7,5,,5259.24,3621.73,"N/A","N/A","ZBL Industrial","China",1,0,"N/A","Large bulky",19.88,17.52,12.01,17.42,"N/A","N/A","10/31/2025",3,7,2,"N/A"
"https://amazon.com/dp/B0FNQWPL5C","https://m.media-amazon.com/images/I/71W9IVYM+ZL._SX450_.jpg","B0FNQWPL5C","Sewer Camera with Self Leveling, 300Ft Plumber's Snake Camera with 9"" Screen, DVR, IP68 Waterproof, 512Hz Transmitter and Receiver, 12 LEDs, 16GB SD Card for Sewer Lines, Home Drains, Ducts & Plumbing","DYTesa","Amazon","Industrial & Scientific",379356,"N/A","N/A",6967790319498,"N/A","Borescopes",725,899.99,-17,7,2,,5259.24,1637.22,"N/A","N/A","Amazon","N/A",2,0,"N/A","Large bulky",22.83,17.32,12.99,24.69,"N/A","N/A","10/31/2025",3,8,2,"N/A"
"https://amazon.com/dp/B08HH9899J","https://m.media-amazon.com/images/I/61KFDmh6LRL._SX450_.jpg","B08HH9899J","Camera Head for Pipe Inspection Camera Waterproof (IP68) Industrial Endoscope Video Inspection System Camera Head","anysun","FBM","Industrial & Scientific",380140,779675573187,"N/A",0779675573187,"N/A","Borescopes",714,179.99,-5,5,5,33,920.59,920.46,21,4,"HZDZ_Shop","China",1,66,-50,"N/A","N/A","N/A","N/A","N/A","N/A","N/A","03/31/2024",62,5,0,0.26
"https://amazon.com/dp/B0CRKG9Y8G","https://m.media-amazon.com/images/I/71vsacwJjIL._SX450_.jpg","B0CRKG9Y8G","Pipe Snake Sewer Camera 100ft,Waterproof 16GB DVR JQKJCAM 0.67in/17mm Plumbing Borescope Camera for Drain Hole Wall Inspection, Cable wtih Length Marks (30M)","JQKJCAM","FBM","Industrial & Scientific",380723,"N/A","N/A","N/A","N/A","Borescopes",715,279.99,"N/A",5,1,-86,1387.44,253.45,8,3.9,"JJKJ Cam","China",1,116,"N/A","Large Standard-Size",6.77,11.89,13.31,8.35,"N/A","N/A","05/31/2024",22,7,19,0.69
"https://amazon.com/dp/B0D9NVFZNM","https://m.media-amazon.com/images/I/71GCNJ0pVaL._SX450_.jpg","B0D9NVFZNM","Sewer Pipe Snake Camera 25FT,with 32GB Card 4.3'' Video Screen,HD JQKJCAM Duct Sewer Drain Inspection Camera with Light Meter Counter,17MM/0.67‘’ Industrial Endoscope for Pipes(10M/33FT)","JQKJCAM","FBM","Industrial & Scientific",380723,"N/A","N/A","N/A","N/A","Borescopes",715,239.9,26,5,2,-86,1387.44,554.63,8,3.9,"JJKJ Cam","China",1,116,"N/A","Large Standard-Size",13.39,11.8,6.3,7,"N/A","N/A","05/31/2024",16,8,19,0.69
"https://amazon.com/dp/B0CRKGM7L8","https://m.media-amazon.com/images/I/71dGmlv98eL._SX450_.jpg","B0CRKGM7L8","JQKJCAM 23mm Rigid Sewer Camera - 100FT Waterproof Borescope for Hole Drain Wall Inspection, 16GB DVR Plumbing Camera with 12 LED Lights (30M)","JQKJCAM","FBM","Industrial & Scientific",380723,"N/A","N/A","N/A","N/A","Borescopes",715,315,"N/A",5,1,-86,1387.44,164.71,8,3.9,"JJKJ Cam","China",1,116,"N/A","Large Standard-Size",6.61,11.97,13.31,8.65,"N/A","N/A","05/31/2024",22,7,19,0.69
"https://amazon.com/dp/B0D7HS5BWL","https://m.media-amazon.com/images/I/71DFd403-UL._SX450_.jpg","B0D7HS5BWL","OnBeam Sewer Camera 100ft, Drain Camera with DVR Recorder, 4.3"" Plumbing Cameras Snake with 8 Adjustable LED Lights, Waterproof IP68 & 16GB, Industrial Endoscope for Duct Sewer Line Pipe Inspection","OnBeam","FBA","Industrial & Scientific",380984,762736106820,"N/A",0762736106820,"N/A","Borescopes",716,379.99,37,3,3,450,1224.94,1224.8,2,5,"weigangus","China",1,0,"N/A","Large bulky",7.48,15.59,15.67,9.44,920.01,2537.96,"03/31/2025",17,7,0,3.36