"https://amazon.com/dp/B0D5M8PB92","https://m.media-amazon.com/images/I/51jJS3D65XL._SX450_.jpg","B0D5M8PB92","Anysun Sewer Camera with Locator, Self Leveling, Distance Counter, 7MM Thicker Cable, 165Ft/50M Pipe Inspection Cameras with 9'' 1080P Monitor, Video Drain Camera IP68 Industrial Borescope Snake, 32GB","anysun","FBA","Industrial & Scientific",61590,"N/A","N/A","N/A","N/A","Borescopes",188,1147.49,-6,64,13,-11,86658.21,19403.59,92,4.3,"Yongchangsheng tech","China",2,722,"N/A","Large bulky",15,15.5,19,24.1,2224.09,6135.42,"01/31/2025",15,8,8,0.7
"https://amazon.com/dp/B0D5M795JC","https://m.media-amazon.com/images/I/71o798nhaEL._SX450_.jpg","B0D5M795JC","Anysun Self Leveling Sewer Camera with Locator, Distance Counter, 7MM Thicker Cable, 300Ft/91.5M Pipe Inspection Cameras with 9'' 1080P IPS Screen, IP68 Sewer Drain Cam with DVR Recorder & 32GB Card","anysun","FBA","Industrial & Scientific",61590,"N/A","N/A","N/A","N/A","Borescopes",188,1614.99,-5,64,6,-11,86658.21,12316.47,92,4.3,"Yongchangsheng tech","China",1,722,"N/A","Large bulky",13,19,27.5,33.7,3419.84,9434.03,"01/31/2025",15,8,8,0.7
"https://amazon.com/dp/B0DLS8RHMK","https://m.media-amazon.com/images/I/71IsfO7S-FL._SX450_.jpg","B0DLS8RHMK","Anysun Sewer Camera with Locator, Self Leveling, Distance Counter, 7MM Thicker Cable, Pipe Inspection Cameras with 9'' 1080P Monitor, Video Drain Cam IP68 Waterproof Industrial Borescope (200Ft/60M)","anysun","FBA","Industrial & Scientific",61590,"N/A","N/A","N/A","N/A","Borescopes",188,1359.99,-10,64,3,-11,86658.21,5026.3,92,4.3,"Yongchangsheng tech","China",1,722,"N/A","Large bulky",13.4,19,20.5,25.5,2627.77,7249.03,"01/31/2025",10,8,8,0.7
"https://amazon.com/dp/B0D5M89BT1","https://m.media-amazon.com/images/I/71o798nhaEL._SX450_.jpg","B0D5M89BT1","Anysun Sewer Camera Self Leveling with Locator, Distance Counter, 7MM Thicker Cable, 100Ft Sewer Inspection Cameras with 9'' 1080P Screen, IP68 Drain Pipe Cam Borescope Cams with Light, 32GB Card","anysun","FBA","Industrial & Scientific",61598,"N/A","N/A","N/A","N/A","Borescopes",188,1399.99,-6,64,25,-11,86658.21,34887.98,92,4.3,"Yongchangsheng tech","China",1,722,"N/A","Large bulky",15.3,15.3,18.8,21.45,2215.73,6112.35,"01/31/2025",15,8,8,0.7
"https://amazon.com/dp/B09441WDJ9","https://m.media-amazon.com/images/I/714VFKxqchL._SX450_.jpg","B09441WDJ9","Anysun Sewer Inspection Camera with Locator, 165ft Pipe Camera with 512Hz Sonde Transmitter and Receiver, IP68 Waterproof Industrial Plumbing Endoscope Drain Snake Cam with 7"" LCD Monitor","anysun","FBA","Industrial & Scientific",61607,770456985113,"N/A",0770456985113,"N/A","Borescopes",188,723.34,-3,64,7,-11,86658.21,5955.54,91,4.3,"Yongchangsheng tech","China",1,722,"N/A","Large bulky",8.03,19.06,24.41,23.39,1880.97,5188.88,"01/31/2025",54,9,8,0.7
"https://amazon.com/dp/B0BG27Q1JS","https://m.media-amazon.com/images/I/71awfokgyDL._SX450_.jpg","B0BG27Q1JS","Teslong Telescopic Camera with Light, 4.5"" IPS Screen Endoscope Inspection Camera with 5FT Telescoping Pole, IP67 Waterproof Flexible Borescope for Home Ceiling, Wall, Chimney, Automotive & HVAC","Teslong","FBA","Industrial & Scientific",61742,"N/A","N/A","N/A","N/A","Borescopes",189,119.99,1,39,39,141,4666.46,4665.9,86,4.4,"Teslong","China",1,532,-18,"Large Standard-Size",1.93,7.13,17.99,1.52,124.64,343.83,"01/31/2025",38,7,0,0.45
"https://amazon.com/dp/B0DPF4RZNY","https://m.media-amazon.com/images/I/61C9SPoHxIL._SX450_.jpg","B0DPF4RZNY","16.2 Feet Inspection Endoscope Camera with Light, 1080P HD Borescope Camera with Light, 4.3"" IPS Screen, IP67 Waterproof Sewer Borescope, 16.2Ft Semi-Rigid Cord Drain Pipe Endoscope Cool Gadgets Tool","COOVIE","FBA","Industrial & Scientific",61761,"N/A","N/A","N/A","N/A","Borescopes",190,33.79,-10,62,62,,1669.79,1669.05,39,4.4,"Alice Windowshop","China",1,0,"N/A","Large Standard-Size",3.03,5.43,7.09,1.1,58.73,162.02,"10/31/2025",11,7,0,1.58
"https://amazon.com/dp/B0FQC32XV7","https://m.media-amazon.com/images/I/71UAKNA5MhL._SX450_.jpg","B0FQC32XV7","DEPSTECH Dual Lens Borescope Camera with Light, Two-Way Articulating Borescope, 5"" IPS Dual View Endoscope with 0.33in Slim Probe, 1080P Waterproof Inspection Camera for Wall Auto Engine Inspect-5FT","DEPSTECH","FBA","Industrial & Scientific",62641,"N/A","N/A","N/A","N/A","Borescopes",191,159.99,"N/A",0,0,,"-","-",15,4.6,"DEPSTECH Authorized Store","China",1,0,"N/A","Large Standard-Size",3.11,8.9,17.52,3.04,244.15,673.52,"-",0,9,0,0
"https://amazon.com/dp/B0FCMCJD8F","https://m.media-amazon.com/images/I/71aNBY2Of0L._SX450_.jpg","B0FCMCJD8F","Triple Lens 5"" IPS Borescope Inspection Camera, Ginocaco 1080P Digital Video Endoscope with Light, Waterproof Scope Camera with 16.5FT Semi-Rigid Cable, Drain Pipe Tool, Carrying Case, 32G Card","GinoCaco","FBA","Industrial & Scientific",63440,"N/A","N/A","N/A","N/A","Borescopes",192,89.99,"N/A",30,9,387,2210.82,698.68,8,4.2,"GinoCaco Direct","China",1,0,"N/A","Large Standard-Size",3.66,6.81,9.17,1.85,115.07,317.44,"09/30/2025",5,7,3,3.74
"https://amazon.com/dp/B0F4JKZWBZ","https://m.media-amazon.com/images/I/81+FaojrLcL._SX450_.jpg","B0F4JKZWBZ","5‘’ Dual Lens Endoscope Camera with Light, 1080P Borescope Inspection Camera with Photo & Video, 7.9mm IP67 Waterproof Sewer with 7 LED Lights,16.5FT Semi-Rigid Cable, Built-in 32G Card","GinoCaco","FBA","Industrial & Scientific",63440,"N/A","N/A","N/A","N/A","Borescopes",192,48.99,-15,30,17,387,2210.82,966.8,8,4.2,"GinoCaco Direct","China",1,0,"N/A","Large Standard-Size",3.7,6.93,9.17,1.87,118.38,326.57,"09/30/2025",7,7,3,3.74
"https://amazon.com/dp/B0FCMDKKZC","https://m.media-amazon.com/images/I/71pGzz048fL._SX450_.jpg","B0FCMDKKZC","50FT Triple Lens 5"" IPS Borescope Inspection Camera, Ginocaco 1080P Digital Video Endoscope with Light, Waterproof Scope Camera with Semi-Rigid Cable, Drain Pipe Tool, Carrying Case, 32G Card","GinoCaco","FBA","Industrial & Scientific",63456,"N/A","N/A","N/A","N/A","Borescopes",192,139.99,"N/A",30,4,387,2210.82,544.8,8,4.2,"GinoCaco Direct","China",1,0,"N/A","Large Standard-Size",4.72,6.89,9.09,2.76,148.83,410.58,"09/30/2025",5,7,3,3.74
"https://amazon.com/dp/B0FCF1CC7D","https://m.media-amazon.com/images/I/71B4FErL7EL._SX450_.jpg","B0FCF1CC7D","Dual Lens Articulating Borescope NIDAGE Two-Way Endoscope Camera with Light Articulated Probe, 0.25in Engine Inspection Camera Waterproof Fiber Optic Scope Cam Tool for Automotive Wall Mechanics 5.3FT","NIDAGE","FBA","Industrial & Scientific",64954,"N/A","N/A","N/A","N/A","Borescopes",194,119.98,-14,43,11,-37,3972.2,1252.12,72,4.6,"TELESION","China",1,0,"N/A","Large bulky",2.3,8.8,18.4,2.65,187.5,517.24,"09/30/2025",5,7,2,0.59
"https://amazon.com/dp/B0DHRPXGRL","https://m.media-amazon.com/images/I/718xfb8rv+L._SX450_.jpg","B0DHRPXGRL","NIDAGE Two-Way Articulating Borescope with Light Industrial Endoscope for Engine Inspection 0.24in Articulated Snake Camera Flexible Fiberscope Tool for Automotive Aircraft Mechanics, 5.2FT","NIDAGE","FBA","Industrial & Scientific",64977,"N/A","N/A","N/A","N/A","Borescopes",194,89.99,-2,43,32,-37,3972.2,2719.41,72,4.6,"TELESION","China",1,0,"N/A","Large bulky",2.48,8.82,18.39,1.68,202.52,558.69,"09/30/2025",14,7,2,0.59
"https://amazon.com/dp/B0D2RCQM7W","https://m.media-amazon.com/images/I/71WPwUpV9iL._SX450_.jpg","B0D2RCQM7W","Borescope Camera with Light, 1080P HD Industrial Endoscope with 4.3"" Screen, Semi-Rigid Cable, IP67 Waterproof Scope Camera for Pipe, Plumbing, Engine Inspection","EFUTONPRO","FBA","Industrial & Scientific",65065,628603143865,"N/A",0628603143865,"N/A","Borescopes",195,28.99,28,37,8,-85,1069.96,247.88,83,4.5,"Supermarket2010","China",1,1370,"N/A","Large Standard-Size",2.6,6.89,11.73,1.08,105.8,291.85,"06/30/2025",19,7,3,0.45
"https://amazon.com/dp/B0D2R6Y6W7","https://m.media-amazon.com/images/I/71WPwUpV9iL._SX450_.jpg","B0D2R6Y6W7","Borescope Camera with Light, 1080P HD Industrial Endoscope with 4.3"" Screen, Semi-Rigid Cable, IP67 Waterproof Scope Camera for Pipe, Plumbing, Engine Inspection","EFUTONPRO","FBA","Industrial & Scientific",65066,628458129373,"N/A",0628458129373,"N/A","Borescopes",195,36.99,-10,37,4,-85,1069.96,145.04,83,4.5,"Supermarket2010","China",1,1370,"N/A","Large Standard-Size",3.03,7.24,11.02,1.48,121.71,335.76,"06/30/2025",19,8,3,0.45
"https://amazon.com/dp/B08D9GDQD5","https://m.media-amazon.com/images/I/71EVKoAubeL._SX450_.jpg","B08D9GDQD5","Teslong Rigid Rifle Borescope, 0.2inch Rod Digital Gun Barrel Bore Scope Gun Cleaning Camera-Fits .20 Caliber & Larger Hunting Shooting Firearms, 26inch Long Insertion Tube & 4.5inch 1080P HD Screen","Teslong","FBA","Industrial & Scientific",65451,"N/A","N/A","N/A","N/A","Borescopes",196,149.99,-15,56,56,79,8371.88,8371.74,388,4.7,"Teslong","China",1,837,-11,"Large bulky",2.05,4.14,30.69,2.54,131.14,361.76,"11/30/2023",64,7,0,0.14
"https://amazon.com/dp/B0CZKMVL56","https://m.media-amazon.com/images/I/71w6FW9OYYL._SX450_.jpg","B0CZKMVL56","Endoscope Camera with Light, 1920P HD Borescope with 8+1 Adjustable LED Lights, IP67 Waterproof 16.5FT Semi-Rigid Snake Cord Inspection Camera for iPhone, iPad and Android Phone (Single-Lens)","Pipirich","FBA","Industrial & Scientific",65565,721691244800,"N/A",0721691244800,"N/A","Borescopes",197,19.98,-9,62,46,1,1318.86,915.46,144,4.2,"JIGUANGGUOJIMAOYI","China",1,1788,"N/A","Large Standard-Size",1.46,5.04,5.2,0.44,19.26,53.14,"11/30/2024",19,7,2,0.43
"https://amazon.com/dp/B0CZL3XTYQ","https://m.media-amazon.com/images/I/71tjIDf+c1L._SX450_.jpg","B0CZL3XTYQ","[Dual-Lens] Endoscope Camera with Light, 1920P HD Borescope with 8+1 Adjustable LED Lights, IP67 Waterproof 16.5FT Semi-Rigid Snake Cord Inspection Camera for iPhone, iPad and Android Phone","Pipirich","FBA","Industrial & Scientific",65587,721691244794,"N/A",0721691244794,"N/A","Borescopes",197,24.98,-8,62,16,1,1318.86,402.48,144,4.2,"JIGUANGGUOJIMAOYI","China",1,1788,"N/A","Large Standard-Size",1.42,5.12,5.16,0.42,18.89,52.1,"11/30/2024",19,7,2,0.43
"https://amazon.com/dp/B07Q78WXFP","https://m.media-amazon.com/images/I/51QV+5moWEL._SX450_.jpg","B07Q78WXFP","Klein Tools ET20 Wi-Fi Borescope, 9 mm 6-Foot Armored Waterproof Gooseneck Snake, LED Lights, Rechargeable Battery, Endoscope Inspection Camera","KLEIN TOOLS","Amazon","Industrial & Scientific",65935,092644692314,00092644692314,0092644692314,"N/A","Borescopes",198,99.99,-16,70,70,117,6826.17,6825.46,435,4.2,"Amazon","N/A",8,893,-34,"Large Standard-Size",2.09,7.76,10.59,1.5,"N/A","N/A","11/30/2024",80,11,0,0.16
"https://amazon.com/dp/B07HVT2XZL","https://m.media-amazon.com/images/I/71p9XI9ImnL._SX450_.jpg","B07HVT2XZL","5MP Auto-Focus Endoscope, Teslong 3rd Generation USB Borescope with 5.0 Megapixel Inspection Camera, 16.5ft Waterproof Semi-Rigid Cable & Adjustable Led Lights Probe for Android Phone Windows MacBook","Teslong","FBA","Industrial & Scientific",67280,"N/A","N/A","N/A","N/A","Borescopes",199,49.99,-2,51,51,5,2540.05,2539.89,374,4.1,"Teslong","China",1,692,-3,"Large Standard-Size",2.28,5.67,7.28,1,47.47,130.96,"11/30/2023",86,8,0,0.14
"https://amazon.com/dp/B0F64LBZW5","https://m.media-amazon.com/images/I/81Zzff2aTlL._SX450_.jpg","B0F64LBZW5","GearView 210°Articulating Borescope Camera - Inspection Camera 6 Light, Endoscope with 6.2mm IP67 Waterproof Probe, 3X Zoom 2-Way Borescope with Flexible Cablegabg","GearView","FBA","Industrial & Scientific",67635,762849245232,"N/A",0762849245232,"N/A","Borescopes",200,69.99,-3,50,37,-30,4254.6,2586.63,14,3.6,"GearView","China",1,0,"N/A","Large Standard-Size",3.54,11.14,12.64,2.23,250.96,692.31,"09/30/2025",7,7,2,3.57
"https://amazon.com/dp/B0F64N1M1N","https://m.media-amazon.com/images/I/81RD5-NaeKL._SX450_.jpg","B0F64N1M1N","GearView Two-Way 360°Articulating Borescope Camera,6.2mm Inspection Camera,IP67 Waterproof Inspection Borescope,for Automotive, HVAC & Mechanics Sewer","GearView","FBA","Industrial & Scientific",67643,762849245294,"N/A",0762849245294,"N/A","Borescopes",200,129.99,-5,50,13,-30,4254.6,1667.28,14,3.6,"GearView","China",1,0,"N/A","Large Standard-Size",3.62,11.06,12.6,2.09,253.99,700.65,"09/30/2025",7,7,2,3.57
"https://amazon.com/dp/B0BV2Q92RJ","https://m.media-amazon.com/images/I/71eyWMyGlYL._SX450_.jpg","B0BV2Q92RJ","VEVOR Sewer Camera 300ft/91.5m with 9"" Screen, DVR, IP68 Waterproof, 12 LEDs, 16GB SD Card for Sewer Lines, Home Drains, Ducts & Plumbing","VEVOR","FBM","Industrial & Scientific",68161,840281561674,"N/A",0840281561674,"N/A","Borescopes",202,575.99,9,55,7,-72,28944.69,3711.91,74,4.1,"TttopKing","China",1,960,-14,"Large bulky",21,17,12,20.9,"N/A","N/A","02/29/2024",33,15,7,0.74
"https://amazon.com/dp/B0BV2SYJDK","https://m.media-amazon.com/images/I/71vkc+-D25L._SX450_.jpg","B0BV2SYJDK","VEVOR Sewer Camera 165ft/50m with 9"" Screen, DVR, IP68 Waterproof, 12 LEDs, 16GB SD Card for Sewer Lines, Home Drain Pipes, Ducts & Plumbing","VEVOR","FBM","Industrial & Scientific",68161,840281561681,"N/A",0840281561681,"N/A","Borescopes",202,467.99,-3,55,18,-72,28944.69,8542.82,75,4.1,"TttopKing","China",1,960,-14,"Large bulky",18,16,16,25.8,"N/A","N/A","02/29/2024",33,11,7,0.73
"https://amazon.com/dp/B0BV2V59XB","https://m.media-amazon.com/images/I/71qbqgQ1IML._SX450_.jpg","B0BV2V59XB","VEVOR Sewer Camera, 230 ft/70 m, 9"" Screen Pipeline Inspection Camera with DVR Function, 12 Adjustable LEDs, 16 GB SD Card, Waterproof IP68 for Sewer Line, Home, Duct Drain Pipe Plumbing","VEVOR","FBM","Industrial & Scientific",68162,840281561698,00197988567998,0840281561698,"N/A","Borescopes",202,526.9,-5,55,9,-72,28944.69,4746.45,75,4.1,"TttopKing","China",2,960,-14,"Large bulky",23.03,17.72,12.91,19.07,"N/A","N/A","02/29/2024",33,9,7,0.73
"https://amazon.com/dp/B0BV2VFMVZ","https://m.media-amazon.com/images/I/71qlRabB19L._SX450_.jpg","B0BV2VFMVZ","VEVOR Sewer Camera 393ft/120m with 9"" Screen, DVR, IP68 Waterproof, 12 LEDs, 16GB SD Card for Sewer Lines, Home Drains, Ducts & Plumbing","VEVOR","FBM","Industrial & Scientific",68162,840281561704,"N/A",0840281561704,"N/A","Borescopes",202,632.99,5,55,5,-72,28944.69,3081.06,75,4.1,"TttopKing","China",1,960,-14,"Large bulky",21,16,12,23.1,"N/A","N/A","02/29/2024",33,15,7,0.73
"https://amazon.com/dp/B0BTP4K3H7","https://m.media-amazon.com/images/I/71qlRabB19L._SX450_.jpg","B0BTP4K3H7","VEVOR Sewer Camera, 150FT, 9"" Screen Pipeline Inspection Camera with DVR Function & 8 GB SD Card, Waterproof IP68 Borescope w/LED Lights, Industrial Endoscope for Home Wall Duct Drain Pipe Plumbing","VEVOR","FBM","Industrial & Scientific",68164,840349912929,"N/A",0840349912929,"N/A","Borescopes",202,475.99,2,55,13,-72,28944.69,6213.76,75,4.1,"TttopKing","China",1,960,-14,"Large bulky",19,16,13,15.5,"N/A","N/A","02/29/2024",33,11,7,0.73
"https://amazon.com/dp/B0DD3K4FG1","https://m.media-amazon.com/images/I/713a-3DQZXL._SX450_.jpg","B0DD3K4FG1","Dual-Lens Endoscope Camera with Light, WOVTE 1920P Borescope with 8+1 Adjustable LED Lights, 16.5ft Snake Camera, IP67 Waterproof Inspection Camera for iOS/Android/PC","WOVTE","FBA","Industrial & Scientific",69004,"N/A","N/A","N/A","N/A","Borescopes",201,25.99,-9,53,21,-79,1256.73,546.15,165,4.3,"Get It Home","China",1,2459,"N/A","Large Standard-Size",1.06,6.46,6.61,0.49,22.79,62.86,"11/30/2024",15,8,3,0.32
"https://amazon.com/dp/B0DD7NT7SQ","https://m.media-amazon.com/images/I/71WhQfUMY0L._SX450_.jpg","B0DD7NT7SQ","WOVTE 4 in 1 Endoscope with Light, 16.5Ft Snake Camera, 1920P HD Borescope with 8 Adjustable LED Lights, IP67 Waterproof Semi-Rigid Industrial Inspection Camera for iOS, Android, PC","WOVTE","FBA","Industrial & Scientific",69027,"N/A","N/A","N/A","N/A","Borescopes",201,25.99,6,53,21,-79,1256.73,544.94,165,4.3,"ProChosen Official","China",1,2459,"N/A","Large Standard-Size",0.87,6.54,6.65,0.47,18.96,52.31,"11/30/2024",15,7,3,0.32
"https://amazon.com/dp/B0FPL965MM","https://m.media-amazon.com/images/I/711lFpkMUtL._SX450_.jpg","B0FPL965MM","Endoscope Camera with Light, 2.8"" IPS 1080P HD Handheld Borescope, 8 Adjustable LEDs, 16.4ft Semi-Rigid Snake Inspection Camera, IP67 Waterproof, for Automotive, Sewer, HVAC, Men Tools Cool Gadgets","FFXET","FBA","Industrial & Scientific",69769,726852694616,"N/A",0726852694616,"N/A","Borescopes",203,25.99,-137,13,13,,519.87,519.85,13,4.3,"FFXET","N/A",1,0,"N/A","Large Standard-Size",3.27,4.92,9.84,1.08,79.7,219.87,"10/31/2025",2,8,0,"N/A"
"https://amazon.com/dp/B0F4QR3BF1","https://m.media-amazon.com/images/I/61mta6++hhL._SX450_.jpg","B0F4QR3BF1","1920P HD Dual Lens Endoscope Camera Semi-Rigid Snake Cable IP67 Waterproof 8LED Lights Dimmable HD Industrial Pipeline Inspection Probe Compatible with Smartphones Endoscope Camera (16.4ft)","LAUREII","FBA","Industrial & Scientific",70183,"N/A","N/A","N/A","N/A","Borescopes",204,30,4,14,3,20,291.88,65.54,32,4.2,"Laureii Direct","China",1,0,"N/A","Large Standard-Size",1.46,5.08,5.16,0.42,19.21,52.99,"06/30/2025",7,8,3,0.42
"https://amazon.com/dp/B0F4QQLWK5","https://m.media-amazon.com/images/I/61N8y7s2VML._SX450_.jpg","B0F4QQLWK5","1920P HD Dual Lens Endoscope Camera Semi-Rigid Snake Cable IP67 Waterproof 8LED Lights Dimmable HD Industrial Pipeline Inspection Probe Compatible with Smartphones Endoscope Camera (9.9ft)","LAUREII","FBA","Industrial & Scientific",70183,"N/A","N/A","N/A","N/A","Borescopes",204,32,70,14,4,20,291.88,81.68,"N/A","N/A","Laureii Direct","China",1,0,"N/A","Large Standard-Size",1.5,5.04,5.2,0.18,19.73,54.42,"06/30/2025",7,8,3,"N/A"
"https://amazon.com/dp/B0F4QQK5BN","https://m.media-amazon.com/images/I/61hd6KToPLL._SX450_.jpg","B0F4QQK5BN","1920P HD Dual Lens Endoscope Camera Semi-Rigid Snake Cable IP67 Waterproof 8LED Lights Dimmable HD Industrial Pipeline Inspection Probe Compatible with Smartphones Endoscope Camera (3.5ft)","LAUREII","FBA","Industrial & Scientific",70183,"N/A","N/A","N/A","N/A","Borescopes",204,29,62,14,7,20,291.88,144.14,32,4.2,"Laureii Direct","China",1,0,"N/A","Large Standard-Size",9.1,9.1,3.15,0.1,131.33,362.29,"06/30/2025",7,8,3,0.42
"https://amazon.com/dp/B0DP9NH88V","https://m.media-amazon.com/images/I/71Ms6bqVuyL._SX450_.jpg","B0DP9NH88V","Sanyipace Sewer Camera 100FT with 512Hz Locator, Self-Leveling Drain Camera Pipe Inspection Cámara, Distance Counter, IP68 Waterproof, 9"" HD Color Screen, Video Record up to 128GB","Sanyipace","FBA","Industrial & Scientific",71372,"N/A","N/A","N/A","N/A","Borescopes",205,799.99,-18,35,1,,14843.25,814.94,103,4,"SanyipaceDirect Store","China",1,0,"N/A","Large bulky",13.08,17.08,18,22.15,2024.62,5585.16,"10/31/2025",12,6,19,0.34
"https://amazon.com/dp/B0BR7NB31V","https://m.media-amazon.com/images/I/71gj3WZ4U2L._SX450_.jpg","B0BR7NB31V","Sanyipace Sewer Camera 100FT/30M, 1080P FHD, Zoom in, Remote Control, Sapphire Lens, Battery Level Display, 12 Adjustable White LEDs, 7'' LCD Screen, Plumbing Pipe Drain Camera, 16GB TF Card","Sanyipace","FBA","Industrial & Scientific",71375,"N/A","N/A","N/A","N/A","Borescopes",205,259.99,-31,35,5,,14843.25,1403.02,103,4,"SanyipaceDirect Store","China",1,0,"N/A","Large bulky",7.09,14.17,16.14,11.73,816.27,2251.78,"10/31/2025",33,7,19,0.34
"https://amazon.com/dp/B0DP9TL922","https://m.media-amazon.com/images/I/71Fn4bh9R5L._SX450_.jpg","B0DP9TL922","Sanyipace Self-Leveling Sewer Camera 165FT/50M, Drain Camera with 512Hz Transmitter, Pipe Plumbing Camera with Meter Marks, IP68 Waterproof Camera Probe, 9"" HD Color Screen, 16GB TF Card","Sanyipace","FBA","Industrial & Scientific",71375,"N/A","N/A","N/A","N/A","Borescopes",205,569.99,-10,35,2,,14843.25,1073.33,103,4,"SanyipaceDirect Store","China",1,0,"N/A","Large Standard-Size",8,14,16,13.6,902.22,2488.89,"10/31/2025",12,7,19,0.34
"https://amazon.com/dp/B0DP9TH46X","https://m.media-amazon.com/images/I/71RZgEyNRsL._SX450_.jpg","B0DP9TH46X","Sanyipace Self-Leveling Sewer Camera 165FT, Drain Plumbing Camera with 512Hz Pipe Locator, Feet Meter Counter, for Plumbers Homeowner Home Inspectors Construction Maintenance Worker","Sanyipace","FBA","Industrial & Scientific",71375,"N/A","N/A","N/A","N/A","Borescopes",205,899.99,-10,35,1,,14843.25,787.96,103,4,"Urselection","China",1,0,"N/A","Large bulky",13,17,17.55,23.55,1952.74,5386.88,"10/31/2025",12,6,19,0.34
"https://amazon.com/dp/B0DP9S17QP","https://m.media-amazon.com/images/I/71Be5LANlYL._SX450_.jpg","B0DP9S17QP","Sanyipace Sewer Camera 65FT/20M, Self-Leveling Drain Pipe Plumbing Camera with 512Hz Transmitter, Clear Meter Marks, for Plumbers Homeowner Home Inspectors Construction Maintenance Worker","Sanyipace","FBA","Industrial & Scientific",71379,"N/A","N/A","N/A","N/A","Borescopes",205,469.99,-11,35,3,,14843.25,1226.12,103,4,"Urselection","China",1,0,"N/A","Large Standard-Size",7,14,16,11.7,789.44,2177.78,"10/31/2025",10,7,19,0.34
"https://amazon.com/dp/B0DP9TKWT4","https://m.media-amazon.com/images/I/71Be5LANlYL._SX450_.jpg","B0DP9TKWT4","Sanyipace Sewer Camera 100FT/30M with 512Hz Transmitter, Drain Camera Pipe Inspection Camera with Self-Leveling, Clear Meter Marks, IP68 Waterproof, 9"" HD Color Screen, Video Record up to 128GB","Sanyipace","FBA","Industrial & Scientific",71379,"N/A","N/A","N/A","N/A","Borescopes",205,499.99,-18,35,2,,14843.25,1094.68,103,4,"SanyipaceDirect Store","China",1,0,"N/A","Large Standard-Size",7.5,14,16.5,12.2,872.27,2406.25,"10/31/2025",12,7,19,0.34
"https://amazon.com/dp/B0BKSRTCRL","https://m.media-amazon.com/images/I/71gj3WZ4U2L._SX450_.jpg","B0BKSRTCRL","Sanyipace Sewer Scope Camera, 1080P FHD, 165FT/50M, 5X Zoom in, Remote Control, Sapphire Lens, Battery Level Display, Drain Inspection Camer with 12 Adjustable LED Lights, 7'' LCD Screen,16GB TF Card","Sanyipace","FBA","Industrial & Scientific",71394,"N/A","N/A","N/A","N/A","Borescopes",205,299.99,-5,35,5,,14843.25,1398.41,103,4,"SanyipaceDirect Store","China",1,0,"N/A","Large Standard-Size",6.69,13.78,15.75,12.96,731.23,2017.17,"10/31/2025",33,7,19,0.34
"https://amazon.com/dp/B09MHR62G4","https://m.media-amazon.com/images/I/71PLaBmKrTL._SX450_.jpg","B09MHR62G4","Sanyipace Sewer Camera with Locator 100 FT/30 M, Drain Pipe Inspection Camera with Detector, Waterproof Cámara Probe w/h 512Hz Transmitter, Distance Counter, 9"" Color Screen, 16GB TF Card, 5mm Cable","Sanyipace","FBA","Industrial & Scientific",71394,"N/A","N/A","N/A","N/A","Borescopes",205,709.99,-3,35,1,,14843.25,1006.68,103,4,"SanyipaceDirect Store","China",1,0,"N/A","Large bulky",10.63,16.38,17,17.4,1490.29,4111.15,"10/31/2025",48,7,19,0.34
"https://amazon.com/dp/B09L5ND94Q","https://m.media-amazon.com/images/I/71OyHT9gatL._SX450_.jpg","B09L5ND94Q","Sanyipace Sewer Camera 165FT/50M with WiFi Wireless Transmission, Drain Camera with Lights, Pipe Sewer Scope Inspection Camera with IP68 Waterproof Camera Probe, 7"" Color Screen, Camera Guide Wheel","Sanyipace","FBA","Industrial & Scientific",71394,"N/A","N/A","N/A","N/A","Borescopes",205,429.99,-3,35,3,,14843.25,1279.36,103,4,"SanyipaceDirect Store","China",1,0,"N/A","Large bulky",7.25,14.2,16,12.95,829.32,2287.78,"10/31/2025",48,7,19,0.34
"https://amazon.com/dp/B09MTF7YZQ","https://m.media-amazon.com/images/I/71w8IkaWikL._SX450_.jpg","B09MTF7YZQ","Sanyipace Sewer Camera with Locator 165 FT/50 M, Drain Pipe Inspection Camera with Detector, Waterproof Cámara Probe w/h 512Hz Transmitter, Distance Counter, 9"" Color Screen, 16GB TF Card, 5mm Cable","Sanyipace","FBA","Industrial & Scientific",71399,"N/A","N/A","N/A","N/A","Borescopes",205,759.99,-3,35,1,,14843.25,900.64,104,4,"SanyipaceDirect Store","China",1,0,"N/A","Large bulky",11,16.25,17,18.8,1529.93,4220.49,"10/31/2025",47,7,19,0.34
"https://amazon.com/dp/B0BWXV4PS6","https://m.media-amazon.com/images/I/71XWcf-k7JL._SX450_.jpg","B0BWXV4PS6","Sanyipace Sewer Camera 65FT/20M with WiFi Wireless Transmission, Drain Camera with Lights, Pipe Sewer Scope Inspection Camera with IP68 Waterproof Camera Probe, 7"" Color Screen, Camera Guide Wheel","Sanyipace","FBA","Industrial & Scientific",71399,"N/A","N/A","N/A","N/A","Borescopes",205,329.99,-38,35,4,,14843.25,1173.77,103,4,"SanyipaceDirect Store","China",1,0,"N/A","Large Standard-Size",7,14,16,11,789.44,2177.78,"10/31/2025",32,6,19,0.34
"https://amazon.com/dp/B09L4Z7T89","https://m.media-amazon.com/images/I/71RC++c-iyL._SX450_.jpg","B09L4Z7T89","Sanyipace 165FT/50M Drain Camera with Lights, Pipe Sewer Scope with IP68 Waterproof Probe, 7"" Color Screen, 16GB SD Card, Camera Guide Wheel","Sanyipace","FBA","Industrial & Scientific",71403,"N/A","N/A","N/A","N/A","Borescopes",205,359.99,-23,35,3,,14843.25,1088.7,103,4,"SanyipaceDirect Store","China",1,0,"N/A","Large Standard-Size",7,9.6,14.4,13.1,487.2,1344,"10/31/2025",43,6,19,0.34
"https://amazon.com/dp/B09MTFFT74","https://m.media-amazon.com/images/I/71+J3E5dWxL._SX450_.jpg","B09MTFFT74","Sanyipace Sewer Camera with Locator 65 FT/20 M, Drain Pipe Inspection Camera with Detector, Waterproof Cámara Probe w/h 512Hz Transmitter, Distance Counter, 9"" Color Screen, 16GB TF Card, 5mm Cable","Sanyipace","FBA","Industrial & Scientific",71403,"N/A","N/A","N/A","N/A","Borescopes",205,659.99,-3,35,2,,14843.25,1054.67,103,4,"SanyipaceDirect Store","China",1,0,"N/A","Large bulky",11,16.5,17,17.2,1553.46,4285.42,"10/31/2025",47,7,19,0.34
"https://amazon.com/dp/B0CCJ5R7RF","https://m.media-amazon.com/images/I/611XYYBfbqL._SX450_.jpg","B0CCJ5R7RF","Endoscope Camera with Light, 1920P HD Borescope with 8 Adjustable LED Lights, with iOS System,not for 15+","OKUBOX","FBA","Industrial & Scientific",72100,701807732650,"N/A",0701807732650,"N/A","Borescopes",206,14.99,21,69,69,-46,936.57,935.74,186,3.9,"OKUBOX","China",1,2341,74,"Large Standard-Size",1.26,5.31,5.55,0.37,18.71,51.63,"03/31/2025",28,6,0,0.37
