"https://amazon.com/dp/B0CQ55VS2B","https://m.media-amazon.com/images/I/61hkols6rZL._SX450_.jpg","B0CQ55VS2B","LSOSVSEU 23mm Pipe Sewer Inspection Camera Protective Cover, 90mm Guide Wheels Protect The Pipe Video Inspection Camera in The Pipe Walls, Pipe Inspection Camera Accessories","LSOSVSEU","FBA","Industrial & Scientific",185032,"N/A","N/A","N/A","N/A","Borescopes",393,24.99,-4,17,17,164,416.03,415.7,12,3.8,"Outdoor Relax","China",1,219,"N/A","Large Standard-Size",1.89,3.78,5.35,0.22,19.24,53.09,"02/29/2024",23,9,0,1.39
"https://amazon.com/dp/B0F8V51XJ7","https://m.media-amazon.com/images/I/71YUXX7-6ML._SX450_.jpg","B0F8V51XJ7","MR CARTOOL Two-Way Articulating Borescope with Light, Industrial Endoscope Camera with 0.24in/6.25mm Articulated Probe, IP67 Waterproof Snake Inspection Scope for Mechanic Aircraft Automotive Engine","MR CARTOOL","FBA","Industrial & Scientific",186398,"N/A","N/A","N/A","N/A","Borescopes",394,75.89,-25,7,5,67,490.4,312.84,10,4.4,"MR CARTOOL DIRECT","China",1,0,"N/A","Large Standard-Size",2.91,12.05,15.39,1.65,271.7,749.53,"09/30/2025",6,9,2,0.68
"https://amazon.com/dp/B0DK6RFMLT","https://m.media-amazon.com/images/I/71tUfo5tOKL._SX450_.jpg","B0DK6RFMLT","N150 Articulating Borescope, 210° Two-Way Endoscope Camera with 0.24in IP67 Waterproof Probe, 3.3FT Flexible Hose, Borescope Tool for Appliances, Automotive HVAC and Industrial Machinery","MR CARTOOL","FBA","Industrial & Scientific",186407,"N/A","N/A","N/A","N/A","Borescopes",394,99.89,-18,7,2,67,490.4,177.26,10,4.4,"MR CARTOOL DIRECT","China",1,0,"N/A","Large Standard-Size",3.19,8.54,12.64,2.18,173.37,478.26,"09/30/2025",13,8,2,0.68
"https://amazon.com/dp/B0FC639HC1","https://m.media-amazon.com/images/I/71Qeg9Lvk2L._SX450_.jpg","B0FC639HC1","Sewer Camera with 18mm 512hz Transmit,Pipe Inspection Camera 7"" DVR Waterproof IP68 Borescope Plumbing Drain Endoscope 32GB Card for Home Wall Duct Drain Pipe Plumbing","JINXINEBAY","FBA","Industrial & Scientific",186743,"N/A","N/A","N/A","N/A","Borescopes",395,370.49,-3,11,11,13,4090.87,4090.61,1,5,"31yoosee","China",1,0,"N/A","Large bulky",10.75,12.9,14.5,13,1012.38,2792.76,"09/30/2025",5,6,2,10.57
"https://amazon.com/dp/B0FQJP4QXD","https://m.media-amazon.com/images/I/71uxoAcIFkL._SX450_.jpg","B0FQJP4QXD","Anysun All in 1 Sewer Camera with Locator & Wheels & Pull Handle, 7MM Cable, Self Leveling, Distance Counter, 32GB Card, 9'' HD Monitor, Pipe Drain Inspection Camera IP68 Borescope (300FT/91.5M)","anysun","FBA","Industrial & Scientific",186984,717931041766,"N/A",0717931041766,"N/A","Borescopes",441,2399.99,6594,24,4,,47416.52,9275.36,1,5,"Yongchangsheng tech","China",1,0,"N/A","Large bulky",20,20,16,28,3222.22,8888.89,"10/31/2025",2,8,2,23.94
"https://amazon.com/dp/B0D7VDMM6J","https://m.media-amazon.com/images/I/71Nj9GxQrhL._SX450_.jpg","B0D7VDMM6J","Julaiwy Borescope Camera with 8 LED Light, Industrial Endoscope Cameras with Light 4.3"" IPS 1920P HD Screen, Inspection Camera with 16.5ft Semi-Rigid Cable Waterproof, Sewer Drain Pipe Snake Cameras","Julaiwy","FBA","Industrial & Scientific",189676,"N/A","N/A","N/A","N/A","Borescopes",396,29.9,-21,16,16,142,518.25,518.04,39,4.6,"Kecowl","China",1,251,"N/A","Large Standard-Size",2.72,5.71,10.43,1.23,81.56,224.99,"11/30/2024",17,9,0,0.41
"https://amazon.com/dp/B0F212TN9N","https://m.media-amazon.com/images/I/51baThekuBL._SX450_.jpg","B0F212TN9N","SG Store 1 Set 7.9mm Endoscope Hook Magnet Protective Cap Accessories Compatible with DEPSTECH DS300 DS520 WF028 DS350 DS500 DS600 DS450 Dual Lens Inspection Camera","SG Store","FBA","Industrial & Scientific",190362,"N/A","N/A",4895253941790,"N/A","Borescopes",397,8.99,"N/A",7,7,278,64.41,64.28,"N/A","N/A","Sundry Goods Store","Hong Kong",1,0,"N/A","Small Standard-Size",0.59,2.99,4.76,0.04,4.24,11.69,"08/31/2025",8,7,0,"N/A"
"https://amazon.com/dp/B0DDG3FMPV","https://m.media-amazon.com/images/I/81HZoHO+hBL._SX450_.jpg","B0DDG3FMPV","[Dual-Lens] Inspection Endoscope, Industrial Borescope Camera with Light, IP67 Waterproof Drain Pipe Scope Camera, 16.5ft Semi-Rigid Cord Borescope with Light, 1080 HD Screen(32GB Capacity)","COOVIE","FBA","Industrial & Scientific",191127,"N/A","N/A","N/A","N/A","Borescopes",398,44.99,-8,10,10,6,454.35,454.24,22,3.9,"Alice Windowshop","China",1,136,"N/A","Large Standard-Size",3.9,5.2,10.35,1.34,105.68,291.52,"04/30/2025",15,6,0,0.46
"https://amazon.com/dp/B0FQTDBMZR","https://m.media-amazon.com/images/I/71zeAWP3BbL._SX450_.jpg","B0FQTDBMZR","Sanyipace Sewer Camera Drain Pipe Sewer Scope Inspection Camera","Sanyipace","FBA","Industrial & Scientific",191187,"N/A","N/A","N/A","N/A","Borescopes",414,1399.99,"N/A",31,0,,29914.62,"-",120,4.1,"Urselection","China",0,0,"N/A","N/A","N/A","N/A","N/A","N/A","N/A","N/A","09/30/2025",2,7,17,0.26
"https://amazon.com/dp/B0F9KZ44WV","https://m.media-amazon.com/images/I/71EaE1PQcaL._SX450_.jpg","B0F9KZ44WV","Sewer Camera 100ft,SPRIDRAIN Drain Pipe Camera HD 5in Screen with 32GB DVR,Waterproof IP68 Works Underwater Up to 10Meters Sewer Inspection borescopes for Plumber(Fits Pipes>0.7"" Diameter,100ft/30M)","SPRIDRAIN","FBA","Industrial & Scientific",192724,"N/A","N/A","N/A","N/A","Borescopes",400,248,"N/A",5,5,,917.98,917.96,2,5,"SYANSPAN TECH","China",2,0,"N/A","Large Standard-Size",11.2,8,12,11,541.33,1493.33,"-",2,6,0,1.67
"https://amazon.com/dp/B0B2VGF8L5","https://m.media-amazon.com/images/I/71YI0sEgguL._SX450_.jpg","B0B2VGF8L5","Pipe Camera's Kit Cable Used for Brand Anysun HBUDS Sewer Camera 165ft Extension Cable for Pipe Camera,165ft Cable Parts for Pipe Inspection Camera(50M/165FT Cable) (50m/165ft)","anysun","FBM","Industrial & Scientific",193131,774980345511,"N/A",0774980345511,"N/A","Borescopes",401,299.99,"N/A",13,3,53,3373.14,1037.26,13,4.4,"HZDZ_Shop","China",1,137,8,"N/A","N/A","N/A","N/A","N/A","N/A","N/A","11/30/2024",41,3,2,1.01
"https://amazon.com/dp/B0B2VN9NCN","https://m.media-amazon.com/images/I/71YI0sEgguL._SX450_.jpg","B0B2VN9NCN","Pipe Camera's Kit Cable Used for Brand Anysun HBUDS Sewer Camera 100ft Extension Cable for Pipe Camera,100ft Cable Parts for Pipe Inspection Camera(30M/100FT Cable) (30m/100ft)","anysun","FBM","Industrial & Scientific",193140,774980345498,"N/A",0774980345498,"N/A","Borescopes",401,239.92,-3,13,10,53,3373.14,2335.48,13,4.4,"HZDZ_Shop","China",1,137,8,"N/A","N/A","N/A","N/A","N/A","N/A","N/A","11/30/2024",41,3,2,1.01
"https://amazon.com/dp/B0DJ7Q8YNX","https://m.media-amazon.com/images/I/81IFtMfANRL._SX450_.jpg","B0DJ7Q8YNX","Sewer Camera Self-Leveling, Built-in 512HZ Transmitter, 9'' HD Plumbing Camera with Depth Marking, Zoom, and Adjustable LED Lights, Ideal for Drain, Pipes, Wells, and Industrial Applications","PeachLeaf","FBA","Industrial & Scientific",193677,717331239183,"N/A",0717331239183,"N/A","Borescopes",402,639.99,-16,1,0,-20,851.23,"-",3,5,"YoJo-Tech","China",1,0,"N/A","Large bulky",12.17,18.5,21.61,19.91,2449.59,6757.48,"04/30/2025",14,8,5,0.39
"https://amazon.com/dp/B0DJ7P2Y1J","https://m.media-amazon.com/images/I/81IFtMfANRL._SX450_.jpg","B0DJ7P2Y1J","Sewer Camera Self-Leveling, Built-in 512HZ Transmitter, 9'' HD Plumbing Camera with Depth Marking, Zoom, and Adjustable LED Lights, Ideal for Drain, Pipes, Wells, and Industrial Applications","PeachLeaf","FBA","Industrial & Scientific",193711,717331239015,"N/A",0717331239015,"N/A","Borescopes",402,499.99,-11,1,1,-20,851.23,455.39,3,5,"YoJo-Tech","China",1,0,"N/A","Large bulky",12,17.2,20,16.6,2078.33,5733.33,"04/30/2025",14,9,5,0.39
"https://amazon.com/dp/B0DJ7PDJPW","https://m.media-amazon.com/images/I/81IFtMfANRL._SX450_.jpg","B0DJ7PDJPW","Sewer Camera Self-Leveling, Built-in 512HZ Transmitter, 9'' HD Plumbing Camera with Depth Marking, Zoom, and Adjustable LED Lights, Ideal for Drain, Pipes, Wells, and Industrial Applications","PeachLeaf","FBA","Industrial & Scientific",193717,717331239169,"N/A",0717331239169,"N/A","Borescopes",402,569.99,-5,1,0,-20,851.23,"-","N/A","N/A","YoJo-Tech","China",1,0,"N/A","Large bulky",11.85,17.32,20,18.25,2066.67,5701.17,"04/30/2025",13,8,5,"N/A"
"https://amazon.com/dp/B0F87Y7V3N","https://m.media-amazon.com/images/I/61mIJWMsd6L._SX450_.jpg","B0F87Y7V3N","gzpce Two-Way Articulating Borescope with 8 Adjustable LED Light， IP67 Waterproof Snake Camera,6.4mm Lens, 1920P HD,Compatible with Phone and Android - 3.3 FT","gzpce","FBA","Industrial & Scientific",194905,612715733571,"N/A",0612715733571,"N/A","Borescopes",404,47.99,-3,30,22,76,1487.71,1059.5,4,4.1,"gzpce","China",1,0,"N/A","Large Standard-Size",2.8,6.69,14.72,1.01,138.69,382.6,"09/30/2025",6,7,2,7.46
"https://amazon.com/dp/B0FJRT1PLG","https://m.media-amazon.com/images/I/71rkLzul8eL._SX450_.jpg","B0FJRT1PLG","Endoscope Camera with Light, 1080P Dual-Lens Industrial Borescope with 4.3"" IPS Screen & 32GB Card, IP67 Waterproof Snake Camera with 16.5ft Semi-Rigid Cable for Auto, Sewer, Pipe Inspection","DTVSUBS","FBA","Industrial & Scientific",194909,"N/A","N/A","N/A","N/A","Borescopes",405,45.99,-48,8,3,,409.06,167.65,15,4.6,"Bison America","USA",1,0,"N/A","Large Standard-Size",2.64,5.12,8.82,1.06,60.02,165.58,"08/31/2025",2,7,3,0.56
"https://amazon.com/dp/B0DTDV4CNL","https://m.media-amazon.com/images/I/61aSk-UomzL._SX450_.jpg","B0DTDV4CNL","gzpce Dual Lens 180° 2-Way Endoscope Camera Compatible with Android & iPhone, 8.5mm Lens Industrial Borescope IP67 Waterproof Probe, HD 1080P,9 Adjustable LED Light, 3.3FT Semi-Rigid Cable","gzpce","FBA","Industrial & Scientific",194914,"N/A","N/A","N/A","N/A","Borescopes",404,54.99,-3,30,8,76,1487.71,427.94,4,4.1,"gzpce","China",1,0,"N/A","Large Standard-Size",2.8,6.81,14.72,1.06,141.14,389.35,"09/30/2025",17,8,2,7.46
"https://amazon.com/dp/B0F7LGXGBM","https://m.media-amazon.com/images/I/71gQh54eOnL._SX450_.jpg","B0F7LGXGBM","Dual Lens Industrial Endoscope, 1080P Digital Borescope Inspection Camera with Light, 5.0mm Sewer Camera with 4.3"" IPS Screen, 7 LED Lights, 16.5FT Semi-Rigid Cable, 32GB Card (JR501)","DTVSUBS","FBA","Industrial & Scientific",194952,"N/A","N/A","N/A","N/A","Borescopes",405,43.99,-49,8,5,,409.06,241.14,15,4.6,"Bison America","USA",1,0,"N/A","Large Standard-Size",2.68,5.08,8.74,1.06,59.91,165.26,"08/31/2025",2,7,3,0.56
"https://amazon.com/dp/B0FL7HD4PD","https://m.media-amazon.com/images/I/81qaJEXKSzL._SX450_.jpg","B0FL7HD4PD","Sewer Camera 100FT/30M 23mm Pipe Inspection Camera DVR & Audio Recorder with 7"" IPS Screen, Plumbing Snake Borescope 12 LEDs HD 1000TVL, Included 32GB Card","GAMWATER","FBA","Industrial & Scientific",194996,614019415177,"N/A",0614019415177,"N/A","Borescopes",406,275.38,-18,29,29,,8315.42,8315.27,2,5,"huizhoushishanmaikejiyouxiangongsi","China",1,0,"N/A","Large Standard-Size",16.9,13,7.88,11.1,871.63,2404.49,"10/31/2025",3,6,0,14.68
"https://amazon.com/dp/B0DBVC7H92","https://m.media-amazon.com/images/I/51eL31jlghL._SX450_.jpg","B0DBVC7H92","17MM Sewer Camera Guide Wheel,JQKJCAM Sewer Camera Roller Guide Accessory/Parts,90MM/3.5'' Protector Cover with Pulleys for 0.67'' Pipe Drain Duct Inspection Camera","JQKJCAM","FBA","Industrial & Scientific",196136,"N/A","N/A","N/A","N/A","Borescopes",408,22.8,1,16,16,2,360.35,360,6,4.1,"JJKJ Cam","China",1,0,"N/A","Large Standard-Size",2.4,3.74,10.04,0.64,45.37,125.17,"07/31/2025",15,1,0,2.63
"https://amazon.com/dp/B00SUZ0P7U","https://m.media-amazon.com/images/I/71xGojiBMwL._SX450_.jpg","B00SUZ0P7U","Autel MaxiVideo MV105S Digital Inspection Camera, 5.5mm Diameter Waterproof Industrial Endoscope with Super Bright LED, 39.37 '' Flexible Snake Cable, Compatible with Autel MaxiCOM MaxiSYS series & PC","Autel","FBA","Industrial & Scientific",196484,701160468920,"N/A",0701160468920,"N/A","Borescopes",402,49,1,16,16,74,795.93,795.8,186,4.5,"Motorzone","China",1,176,-15,"Large Standard-Size",2.6,6.89,9.84,0.86,88.75,244.82,"10/31/2023",130,7,0,0.09
"https://amazon.com/dp/B0F8B96XV6","https://m.media-amazon.com/images/I/71dLDyo7POL._SX450_.jpg","B0F8B96XV6","Two-Way Articulating Borescope Camera with Light,360°Rotation,1920P, 6.2 mm Industrial Endoscope IP67 Waterproof Flexible Semi-Rigid Cable for Automotive, Pipe Inspection","Vafafinder","FBA","Industrial & Scientific",197193,"N/A","N/A","N/A","N/A","Borescopes",409,97.93,7,6,6,78,565.32,565.17,14,4.8,"Wayfinder Gift store","China",1,0,"N/A","Large Standard-Size",3.35,9.88,17.63,1.98,293.78,810.44,"07/31/2025",6,9,0,0.4
"https://amazon.com/dp/B0D8119TJ5","https://m.media-amazon.com/images/I/71DZJ1LECYL._SX450_.jpg","B0D8119TJ5","Sewer Camera with Locator, 9"" IPS 1080P Drain Camera with Self Leveling, Distance Counter, DVR Function, 7mm Cable, 100 ft Sewer Scope with 512Hz Sonde, IP68 Waterproof, 32GB Card for Pipe Plumbing","OnBeam","FBA","Industrial & Scientific",198451,762736109388,"N/A",0762736109388,"N/A","Borescopes",616,1299.99,1,14,10,,14474.84,13282.5,3,5,"weigangus","China",1,0,"N/A","Large bulky",15.5,15.5,19,21.45,2298.22,6339.93,"10/31/2025",17,7,7,4.7
"https://amazon.com/dp/B0D7Z8KQ9Q","https://m.media-amazon.com/images/I/71DZJ1LECYL._SX450_.jpg","B0D7Z8KQ9Q","Sewer Camera with Locator, 9"" IPS 1080P Drain Camera with Self Leveling, Distance Counter, DVR Function, 7mm Cable, 200 ft Sewer Scope with 512Hz Sonde, IP68 Waterproof, 32GB Card for Pipe Plumbing","OnBeam","FBA","Industrial & Scientific",198500,762736109418,"N/A",0762736109418,"N/A","Borescopes",616,1599.99,-3,14,4,,14474.84,6489.65,3,5,"weigangus","China",1,0,"N/A","Large bulky",15.25,15.5,18,24.85,2142.15,5909.37,"10/31/2025",17,7,7,4.7
"https://amazon.com/dp/B0F9KTCD56","https://m.media-amazon.com/images/I/51la8qlVu2L._SX450_.jpg","B0F9KTCD56","Articulating Borescope Inspection Camera, 180° Rotatable Head, 1M/3.28FT, IP67 Waterproof, 6 LED Lights, Android iOS Compatible","LANTOTEK","FBA","Industrial & Scientific",198528,"N/A","N/A","N/A","N/A","Borescopes",410,48,"N/A",3,3,,144,143.97,"N/A","N/A","LANTOTEK","China",1,0,"N/A","Large Standard-Size",2.36,4.17,13.86,1.17,68.67,189.44,"10/31/2025",6,6,0,"N/A"
"https://amazon.com/dp/B08QCP8YFM","https://m.media-amazon.com/images/I/61E-f5AWFSL._SX450_.jpg","B08QCP8YFM","Teslong Endoscope Replacement Cable with Light, Single Lens Inspection Camera 5.5mm/0.21inch Waterproof Probe Compatible with NTS500, NTS300(3.3FT)","Teslong","FBA","Industrial & Scientific",200113,"N/A","N/A","N/A","N/A","Borescopes",407,59.99,-4,6,6,54,329.94,329.82,18,4.8,"Teslong","China",1,92,1214,"Large Standard-Size",1.93,5.63,6.61,0.33,36.16,99.75,"01/31/2025",59,5,0,0.31
"https://amazon.com/dp/B0FG71K4QD","https://m.media-amazon.com/images/I/71MdBHTnOWL._SX450_.jpg","B0FG71K4QD","𝟐𝟎𝟐𝟔 𝐧𝐞𝐰 7” Trolley Sewer Camera, HD 1080P w/DVR-32GB,[Quick-Unlock Y Clamp] Sewer Pipe Camera,Telescoping Aluminum Handle (3 Adjustable Heights),5000mAh, [360°Rotate] Drain Camera,165ft/50m","ChoosePRO","FBA","Industrial & Scientific",200916,"N/A","N/A","N/A","N/A","Borescopes",414,499.99,-3,7,7,,3375.02,3374.84,5,5,"ChoosePRO Direct","Hong Kong",1,0,"N/A","Large bulky",9,19,21,18,1807.97,4987.5,"09/30/2025",4,6,0,1.35
"https://amazon.com/dp/B0B8332C5S","https://m.media-amazon.com/images/I/616AUwhwofL._SX450_.jpg","B0B8332C5S","Performance Tool W50146 2.4in LCD Inspection Camera","Performance Tool","FBM","Industrial & Scientific",201014,039564001451,"N/A",0039564001451,"N/A","Borescopes",412,57.74,-27,0,0,-100,"-","-",1,5,"Performance Guarantee✅","USA",21,27,"N/A","Large Standard-Size",2.6,5.16,9.84,0.75,"N/A","N/A","02/28/2025",40,11,3,0.42
"https://amazon.com/dp/B08L8FTY8G","https://m.media-amazon.com/images/I/71umk1QlDtL._SX450_.jpg","B08L8FTY8G","Performance Tool W50145 2.4-Inch LCD Monitor Submersible Inspection Camera - Ideal for Engine Compartments and Hard to Reach Areas","Performance Tool","FBA","Industrial & Scientific",201023,039564138515,"N/A",0039564138515,"N/A","Borescopes",412,67.71,-10,0,0,-100,"-","-",1,5,"RJF Brands","USA",15,27,"N/A","Large Standard-Size",1.97,9.49,12.44,1.26,116.99,322.73,"02/28/2025",61,4,3,0.42
"https://amazon.com/dp/B0DHXGJRX8","https://m.media-amazon.com/images/I/710JGH+-FBL._SX450_.jpg","B0DHXGJRX8","Sewer Camera 100ft,SYANSPAN 4.3in HD Screen,32GB SD Card DVR,12 LED Lights,Fiberglass Cable w/Meter Counter,8500mAh Battery Pipe Snake Camera for Plumber(30M/100ft,32GB DVR)","SYANSPAN","FBA","Industrial & Scientific",201371,"N/A","N/A","N/A","N/A","Borescopes",426,259.99,-5,2,0,-106,375.74,"-",3,3.6,"pipe camera","China",1,0,"N/A","Large Standard-Size",13,12.6,6.3,8.25,519.55,1433.25,"05/31/2025",14,8,4,0.52
"https://amazon.com/dp/B0CVXKQ5YB","https://m.media-amazon.com/images/I/71l6UgGLFHL._SX450_.jpg","B0CVXKQ5YB","4.3"" inch Pipe Drain Inspection Camera, 100FT/30M Sewer Camera with DVR Function & Snake Cable, Waterproof IP68 Borescope w/LED Lights Industrial Endoscope for Plumber Wall Duct Drain Pipe Plumbing","VicSec","FBA","Industrial & Scientific",202246,"N/A","N/A","N/A","N/A","Borescopes",417,259.99,-25,8,8,2300,2139.97,2139.77,27,3.8,"HOTSALE-US","China",1,197,"N/A","Large bulky",11.18,12.36,14.17,11.93,985.84,2719.55,"12/31/2024",21,6,0,0.31
"https://amazon.com/dp/B0F2HJD3C6","https://m.media-amazon.com/images/I/71cDSDpU3XL._SX450_.jpg","B0F2HJD3C6","Sewer Camera,7"" HD IPS Screen Drain Camera with DVR Distance Marker,23MM 12PC Lights IP68 Waterproof Borescope Drain Pipe Endoscope 32GB Card,for Plumbers and Homeowners (17MM Camera/20M)","JINXINEBAY","FBA","Industrial & Scientific",203419,"N/A","N/A","N/A","N/A","Borescopes",417,279.99,-10,7,1,-52,1938.21,306.12,2,5,"31yoosee","China",1,0,"N/A","Large bulky",11.38,13.39,15.47,10.76,1186.83,3274.01,"07/31/2025",8,6,3,3.69
"https://amazon.com/dp/B071ZHXRZZ","https://m.media-amazon.com/images/I/51epBJViJEL._SX450_.jpg","B071ZHXRZZ","Komshine Fiber Optic Inspection Video Probe KIP-600V 400X Magnification Real-time Video Recording + 4 UPC Tips + 3.5 inch HD LCD Display + 4,000mAh Large Battery Capacity FTTX Tool","KOMSHINE","FBA","Industrial & Scientific",204080,"N/A","N/A",7849717739994,"N/A","Borescopes",450,535,-5,19,3,137,3572.31,1691.36,3,5,"Just fiber optic","China",2,191,"N/A","Large Standard-Size",3.86,8.03,11.97,1.74,186.73,515.11,"11/30/2024",102,9,4,6.46
"https://amazon.com/dp/B0D9JZP3YH","https://m.media-amazon.com/images/I/51vKDFGTpYL._SX450_.jpg","B0D9JZP3YH","Endoscope Camera with Light, Borescope with Adjustable LED Light,Endoscope Camera,Waterproof Inspection Camera","MEIBAOGE","FBA","Industrial & Scientific",204404,"N/A","N/A",7645120370461,"N/A","Borescopes",422,11.99,90,19,5,-15,202.68,60.37,12,3,"YinQiBeauty","China",2,319,"N/A","Large Standard-Size",1.1,5.2,5.51,0.2,15.9,43.86,"01/31/2025",16,8,12,1.71
"https://amazon.com/dp/B0D9K3J5W8","https://m.media-amazon.com/images/I/51vKDFGTpYL._SX450_.jpg","B0D9K3J5W8","MEIBAOGE Endoscope Camera With Adjustable LED Light, Waterproof Inspection Borescope, 1 Meter Soft Cord","MEIBAOGE","FBA","Industrial & Scientific",204443,"N/A","N/A",7645120370430,"N/A","Borescopes",422,9.78,2,19,11,-15,202.68,105.35,12,3,"YisiyuanTc","China",3,319,"N/A","Large Standard-Size",1.26,5.12,5.16,0.13,16.76,46.23,"01/31/2025",16,8,12,1.57
"https://amazon.com/dp/B0D9K3BNRY","https://m.media-amazon.com/images/I/51vKDFGTpYL._SX450_.jpg","B0D9K3BNRY","Endoscope Camera with Light, Borescope with Adjustable LED Light,Endoscope Camera,Waterproof Inspection Camera","MEIBAOGE","FBA","Industrial & Scientific",204443,"N/A","N/A",7645120370454,"N/A","Borescopes",422,11.89,"N/A",19,1,-15,202.68,12.8,"N/A","N/A","YinQiBeauty","China",2,319,"N/A","Large Standard-Size",1.3,5.2,5.24,0.17,17.8,49.1,"01/31/2025",16,8,12,"N/A"
"https://amazon.com/dp/B0F2HHQ8MX","https://m.media-amazon.com/images/I/71cDSDpU3XL._SX450_.jpg","B0F2HHQ8MX","Sewer Camera,7"" HD IPS Screen Drain Camera with DVR Distance Marker,23MM 12PC Lights IP68 Waterproof Borescope Drain Pipe Endoscope 32GB Card,for Plumbers and Homeowners (23MM Camera/20M)","JINXINEBAY","FBA","Industrial & Scientific",204685,"N/A","N/A","N/A","N/A","Borescopes",423,265.04,-13,7,2,-52,1938.21,617.1,2,5,"31yoosee","China",1,0,"N/A","Large bulky",11.3,13.5,15.2,10.98,1167.43,3220.5,"07/31/2025",8,6,3,3.69
"https://amazon.com/dp/B0F2HHZQZ6","https://m.media-amazon.com/images/I/71cDSDpU3XL._SX450_.jpg","B0F2HHZQZ6","Sewer Camera,7"" HD IPS Screen Drain Camera with DVR Distance Marker,23MM 12PC Lights IP68 Waterproof Borescope Drain Pipe Endoscope 32GB Card,for Plumbers and Homeowners (23MM Camera/30M)","JINXINEBAY","FBA","Industrial & Scientific",204690,"N/A","N/A","N/A","N/A","Borescopes",423,244.51,-19,7,4,-52,1938.21,1014.6,2,5,"31yoosee","China",1,0,"N/A","Large bulky",10.9,13.3,15.2,11.55,1109.42,3060.48,"07/31/2025",8,6,3,3.69
"https://amazon.com/dp/B07SLVFB8Z","https://m.media-amazon.com/images/I/21IeG2zm+dL._SX450_.jpg","B07SLVFB8Z","Vividia GB-460 USB Digital Manual Focus Gun Barrel Borescope Endoscope Videoscope Inspection Camera with 4mm Diameter and 24"" (60 cm) Long Insertion Tube (Without WiFi Box) for PC Mac Android Devices","VIVIDIA","FBM","Industrial & Scientific",205020,"N/A","N/A","N/A","N/A","Borescopes",421,199.98,-3,6,4,243,1261.13,887.25,13,3.9,"Oasis Scientific Inc.","USA",1,32,"N/A","Large bulky",2.75,3.31,31.06,2.25,"N/A","N/A","09/30/2025",78,8,2,0.45
"https://amazon.com/dp/B07SLVDMBK","https://m.media-amazon.com/images/I/510gKK+ZClL._SX450_.jpg","B07SLVDMBK","Vividia GB-460 USB Digital Manual Focus Gun Barrel Borescope Camera with 4mm Diameter and 24"" (60 cm) Long Insertion Tube (with WiFi Box)","VIVIDIA","FBM","Industrial & Scientific",205032,"N/A","N/A","N/A","N/A","Borescopes",421,249.98,"N/A",7,2,271,1419,420.83,13,3.9,"Oasis Scientific Inc.","USA",2,33,"N/A","Large bulky",2.9,4.5,30.9,2.6,"N/A","N/A","09/30/2025",78,9,2,0.51
"https://amazon.com/dp/B0CS62GR4D","https://m.media-amazon.com/images/I/71u5YkefJoL._SX450_.jpg","B0CS62GR4D","Sewer Camera 100ft,with 9'' Ultra HD 16GB DVR Screen,1080P JQKJCAM Snake Drain Pipe Line Borescope Camera with Light and Meter Counter for Duct Plumbing Sewer Inspection (30M/100 ft)","JQKJCAM","FBA","Industrial & Scientific",205079,"N/A","N/A","N/A","N/A","Borescopes",424,426,-7,6,3,,2622.36,1218.08,11,4.1,"JJKJ Cam","China",1,191,"N/A","Large bulky",11.1,12,12,12.45,804.75,2220,"08/31/2024",22,7,9,0.57
"https://amazon.com/dp/B0CS68V7GR","https://m.media-amazon.com/images/I/71RTY6nNMLL._SX450_.jpg","B0CS68V7GR","Sewer Camera 50FT,with 9'' Ultra HD 16GB DVR Screen,1080P 23MM JQKJCAM Wall Duct Plumbing Drain Inspection Camera with 12 Light Meter Counter for Sewer Pipes (20M/66FT)","JQKJCAM","FBA","Industrial & Scientific",205079,"N/A","N/A","N/A","N/A","Borescopes",424,421.6,"N/A",6,3,,2622.36,1404.14,1,5,"JJKJ Cam","China",1,191,"N/A","Large bulky",11.5,12,12,11.4,833.75,2300,"08/31/2024",22,8,9,6.26
"https://amazon.com/dp/B0FH9VN1HB","https://m.media-amazon.com/images/I/71wp8AHVw4L._SX450_.jpg","B0FH9VN1HB","4.3"" HD Industrial Borescope Inspection Camera, 5.5mm Waterproof Snake Endoscope Camera with 6 LED Lights for Automotive, Plumbing & Pipe Inspection","EFUTONPRO","FBA","Industrial & Scientific",206550,"N/A","N/A","N/A","N/A","Borescopes",428,24.99,-22,22,22,,540.88,540.51,9,4.3,"Supermarket2010","China",1,0,"N/A","Large Standard-Size",7.8,5.5,1.9,0.45,41.04,113.21,"09/30/2025",4,6,2,2.48
"https://amazon.com/dp/B0DD42GBB3","https://m.media-amazon.com/images/I/51aTLOoxfkL._SX450_.jpg","B0DD42GBB3","PRANITE Sewer Camera - 165Ft Self Leveling Drain Inspection System With Meter Marking, 9'' HD IP68 Waterproof Display, Zoom, 16GB DVR, Photo Capture, 12 LED Lights for Plumbing Checks","PRANITE","FBA","Industrial & Scientific",206740,717018403432,"N/A",0717018403432,"N/A","Borescopes",430,499.99,"N/A",11,0,200,7204.58,"-",4,4.2,"dengwencai","China",1,49,"N/A","Large bulky",8,16,17,17,1095.56,3022.22,"10/31/2025",15,6,5,2.65
"https://amazon.com/dp/B0C7S32LYT","https://m.media-amazon.com/images/I/71ADplPvliL._SX450_.jpg","B0C7S32LYT","Vividia VA-650 LCD/WiFi Two-Way Articulating Borescope Inspection Camera with 0.25"" Diameter 3.3ft Long Probe, 1280x720 Resolution, IPS 5"" LCD Monitor","VIVIDIA","FBM","Industrial & Scientific",206988,"N/A","N/A","N/A","N/A","Borescopes",424,299.98,-3,4,4,,1338.83,1338.7,"N/A","N/A","Oasis Scientific Inc.","USA",1,25,92,"N/A","N/A","N/A","N/A","N/A","N/A","N/A","06/30/2025",50,9,0,"N/A"
"https://amazon.com/dp/B0B316VKXM","https://m.media-amazon.com/images/I/71o7edRMI0L._SX450_.jpg","B0B316VKXM","Autel MaxiVideo MV108S Digital Inspection Camera, 2025 8.5mm 1080P HD Semi-Rigid Snake Camera, IP67 Waterproof USB Borescope Industrial Endoscope w/LED Light, Upgrade of MV108 MV105S MV105","Autel","FBA","Industrial & Scientific",206991,762917121833,"N/A",0762917121833,"N/A","Borescopes",423,44.99,-7,2,2,-67,111.17,111.16,20,4.4,"Autel Official","Hong Kong",1,45,-72,"Large Standard-Size",2.05,6.85,12.83,0.9,90.71,250.23,"02/29/2024",41,7,0,0.11
"https://amazon.com/dp/B0CRL4S23X","https://m.media-amazon.com/images/I/71WccVYGhCL._SX450_.jpg","B0CRL4S23X","Anysun Sewer Camera with Locator, Self Leveling Sewer Inspection Camera 165ft with Meter Marker, 9'' Monitor and DVR Recorder, 512hz Locator for Plumber, Homeowner(16GB Card)","anysun","FBA","Industrial & Scientific",207082,774049896084,"N/A",0774049896084,"N/A","Borescopes",432,799.99,180,7,7,,5659.14,5658.96,3,4.5,"Nedive","China",1,68,"N/A","Large bulky",8.3,17.6,23.2,23.55,1706.3,4707.02,"08/31/2024",22,7,2,2.37
"https://amazon.com/dp/B0DTH97TZ7","https://m.media-amazon.com/images/I/51jM7qsUUlL._SX450_.jpg","B0DTH97TZ7","xokisde 2324-21 Drain Camera, Inspection Camera, Borescope for Milwaukee M12 12V 360 Cordless M-Spector 10' Inspection Camera Kit","xokisde","FBM","Industrial & Scientific",210407,"N/A","N/A","N/A","N/A","Borescopes",436,374.95,31,6,6,433,2288.03,2287.93,"N/A","N/A","MV Supplies","USA",3,0,"N/A","N/A","N/A","N/A","N/A","N/A","N/A","N/A","01/31/2025",10,6,0,"N/A"
