"https://amazon.com/dp/B0C37DFVWG","https://m.media-amazon.com/images/I/61PbE+jzE+L._SX450_.jpg","B0C37DFVWG","Borescope Inspection Camera, Fantronics Industrial Endoscope IP67 Waterproof 8mm Camera with 8 LED Lights for OTG Android & iOS Smartphone, iPhone, iPad, Samsung (16.4FT, Type-C, Micro, Lightning)","FANTRONICS","FBA","Industrial & Scientific",50662,"N/A","N/A","N/A","N/A","Borescopes",161,22.99,-7,70,70,28,1610.45,1609.6,136,4.4,"My Fantronics","China",1,1022,-7,"Large Standard-Size",1.46,5.12,5.2,0.44,19.57,53.99,"11/30/2024",30,7,0,0.52
"https://amazon.com/dp/B0DDH1FWHT","https://m.media-amazon.com/images/I/71Unn1G2LrL._SX450_.jpg","B0DDH1FWHT","Borescope,Camii Endoscope Camera with Light,1920P Snake Scope Inspection Cameras with 8 Adjustable LED Lights, Endoscope with 10ft Semi-Rigid Cable Snake Camera for iPhone, iPad,","Camii","FBA","Industrial & Scientific",50690,"N/A","N/A","N/A","N/A","Borescopes",162,21.99,-3,97,34,658,2395.34,745.82,65,3.8,"Camii-Direct","China",1,0,"N/A","Large Standard-Size",0.87,6.5,6.54,0.29,18.62,51.37,"06/30/2025",15,8,3,1.5
"https://amazon.com/dp/B0DDGXHPYT","https://m.media-amazon.com/images/I/71zYIUFcrAL._SX450_.jpg","B0DDGXHPYT","[Dual-Lens] Borescope Camera with Light, 1920P HD Endoscope with 8+1 Adjustable LED Lights, IP67 Waterproof 16.5ft Semi-Rigid Snake Cable Inspection Camera for iPhone, iPad and Android Phone (Type C)","Camii","FBA","Industrial & Scientific",50697,"N/A","N/A","N/A","N/A","Borescopes",162,25.99,49,97,63,658,2395.34,1648.27,65,3.8,"Camii-Direct","China",1,0,"N/A","Large Standard-Size",1.02,6.46,6.5,0.46,21.56,59.49,"06/30/2025",15,9,3,1.5
"https://amazon.com/dp/B0FRMFNFHL","https://m.media-amazon.com/images/I/71zXfYqguzL._SX450_.jpg","B0FRMFNFHL","LumenScope Articulating Borescope with Light,Two-Way Industrial Endoscope Inspection Camera with 0.24In Articulated Probe, 5.3FT Flexible Snake Fiber Optic bore Scope for Automotive Engine Inspect","LumenScope","FBA","Industrial & Scientific",51073,"N/A","N/A","N/A","N/A","Borescopes",163,69.99,"N/A",36,36,,3468.81,3468.34,6,5,"SHU HUI LAI","N/A",1,0,"N/A","Large bulky",2.56,8.79,18.48,2.7,209.37,577.56,"10/31/2025",2,8,0,5.98
"https://amazon.com/dp/B0D14P2NKP","https://m.media-amazon.com/images/I/610MBkedNML._SX450_.jpg","B0D14P2NKP","Endoscope Borescope Camera with Light, 4.3"" IPS HD Garage Inspection Camera Tools, IP67 Waterproof Drain Pipe Borescope, 8 LEDs, 16.5FT Semi-Rigid Cable for Sewer, Automotive Engine, HVAC, Pipe","Binazon","FBA","Industrial & Scientific",51155,"N/A","N/A","N/A","N/A","Borescopes",164,28.99,-13,34,34,350,821.06,820.73,55,4,"Binazon","China",1,423,"N/A","Large Standard-Size",3.03,4.8,7.28,1.08,53.31,147.06,"11/30/2024",19,7,0,0.61
"https://amazon.com/dp/B07SQ4FLYX","https://m.media-amazon.com/images/I/81YfObMGmOL._SX450_.jpg","B07SQ4FLYX","Dual Lens Endoscope with 5"" Monitor, Teslong NTS500 Industrial Waterproof Borescope Inspection Camera with 0.21in Front & Side-View Double Lens with 9.8FT Probe, 5-Inch IPS LCD Screen & Case","Teslong","FBA","Industrial & Scientific",51427,"N/A","N/A","N/A","N/A","Borescopes",162,269.99,8,65,65,-19,16624,16623.36,618,4.7,"Teslong","China",1,903,-2,"Large Standard-Size",3.25,11.14,13.25,3.13,241.46,666.09,"11/30/2023",86,9,0,0.1
"https://amazon.com/dp/B0DPFGJX73","https://m.media-amazon.com/images/I/71Zd-7s-xrL._SX450_.jpg","B0DPFGJX73","Dual Lens Industrial Endoscope, 1920p Borescope with 8+1 Adjustable Led Light, Endoscope with 16.5ft Semi-Rigid Cable Snake Camera/ 7.9mm Ip67 Waterproof Camera for iPhone, Ipad, Samsung","Suntony","FBA","Industrial & Scientific",52304,721545609687,"N/A",0721545609687,"N/A","Borescopes",166,30.3,-20,104,104,-57,2316.97,2315.84,145,4.5,"Suntony Store","China",1,0,"N/A","Large Standard-Size",1.5,5.04,5.08,0.42,19.34,53.34,"08/31/2025",14,7,6,0.72
"https://amazon.com/dp/B0FR9KWW83","https://m.media-amazon.com/images/I/71cQEGntOyL._SX450_.jpg","B0FR9KWW83","Endoscope Camera with Light, 4.3"" HD Display, 5.5mm Waterproof Borescope, 6.6ft Semi-Rigid Cable, 6 LED Plumbing Camera for Pipe, Car Engine, and Drain Inspection","JYTONE","FBA","Industrial & Scientific",52543,"N/A","N/A","N/A","N/A","Borescopes",167,29.99,16,48,48,,1465.73,1465.11,14,5,"ERYUHAIAN","China",1,0,"N/A","Large Standard-Size",3.23,6.02,10.94,1.26,107.1,295.45,"09/30/2025",2,7,0,3.19
"https://amazon.com/dp/B0DNJJYG53","https://m.media-amazon.com/images/I/81UGBD-aRuL._SX450_.jpg","B0DNJJYG53","Endoscope Camera with Light, Pancellent 1920P Inspection Snake, HD Color Display, Waterproof Industrial Borescope with 8 Adjustable LED,16.5ft Semi-Rigid Cable Sewer Camera (Getting Start Level)","pancellent","FBA","Industrial & Scientific",52955,754469800595,"N/A",0754469800595,"N/A","Borescopes",168,29.9,-2,615,599,-20,18624.68,17916.11,1305,4.5,"One Discount","Hong Kong",1,0,"N/A","Large Standard-Size",3.27,9.45,10.12,0.97,157.29,433.9,"07/31/2025",12,7,3,0.47
"https://amazon.com/dp/B08PP4P6WD","https://m.media-amazon.com/images/I/71R-a4bEwjL._SX450_.jpg","B08PP4P6WD","0.197inch Dual Lens Wireless Endoscope Camera, NIDAGE 5.0mm Ultra-Slim Automotive Inspection Camera with 7 LEDs, 1080P Dual Lens Borescope Waterproof for Android & iOS Smartphone Tablet(5FT)","NIDAGE","FBA","Industrial & Scientific",53268,791727101261,"N/A",0791727101261,"N/A","Borescopes",169,55.98,-3,51,51,-39,2879.81,2879.15,208,4.2,"TELESION","China",1,816,-7,"Large Standard-Size",2.05,4.84,7.28,0.53,36.37,100.32,"11/30/2023",59,7,2,0.25
"https://amazon.com/dp/B0D59Y7B2D","https://m.media-amazon.com/images/I/71F7JiFrCaL._SX450_.jpg","B0D59Y7B2D","Hijoy Articulating Borescope Camera with Light - Two-Way Endoscope with 8 Adjustable LED Lights | 5"" LCD Screen | 1920P HD Inspection Cameras with 0.33in Articulated Snake Camera for Men | S30","Hijoy","FBA","Industrial & Scientific",53777,735550191600,"N/A",0735550191600,"N/A","Borescopes",170,159.98,43,97,22,-104,10328.6,3558.74,423,4.6,"Hijoy-US","China",1,0,"N/A","Large Standard-Size",3.39,9.29,16.93,2.93,268.44,740.53,"08/31/2025",13,9,5,0.23
"https://amazon.com/dp/B0D3XDGN6M","https://m.media-amazon.com/images/I/71vaRD60GbL._SX450_.jpg","B0D3XDGN6M","Hijoy Articulating Borescope Camera with Light - Two-Way Endoscope with 8 Adjustable LED Lights | 4.3"" LCD Screen | 1920P HD Inspection Cameras with 0.33in Articulated Snake Camera for Men | S20","Hijoy","FBA","Industrial & Scientific",53783,735550889316,"N/A",0735550889316,"N/A","Borescopes",170,89.99,6,97,75,-104,10328.6,6768.61,423,4.6,"Hijoy-US","China",1,0,"N/A","Large Standard-Size",3.23,9.33,16.85,2.93,255.66,705.26,"08/31/2025",18,8,5,0.23
"https://amazon.com/dp/B0CYPV6964","https://m.media-amazon.com/images/I/71++W0S0wRL._SX450_.jpg","B0CYPV6964","VEVOR Sewer Camera, 98.4 ft/30 m, 4.3"" Pipe Drain Inspection Camera with DVR Function and LED Lights, Waterproof IP68 Borescope, Industrial Endoscope for Home Wall Duct Drain Pipe Plumbing","VEVOR","FBM","Industrial & Scientific",54134,197988568742,"N/A",0197988568742,"N/A","Borescopes",171,220.9,-9,125,94,-17,27504.09,20670.03,70,4.3,"VEVOR Store","China",2,1744,"N/A","Large Standard-Size",13.78,11.81,6.3,7.94,"N/A","N/A","06/30/2025",20,9,3,1.79
"https://amazon.com/dp/B0BYZ4P2ST","https://m.media-amazon.com/images/I/71WuOq3YeQL._SX450_.jpg","B0BYZ4P2ST","VEVOR Sewer Camera, 65.6 ft/20 m, 4.3"" Pipe Drain Inspection Camera with DVR Function and LED Lights, Waterproof IP68 Borescope, Industrial Endoscope for Home Wall Duct Drain Pipe Plumbing","VEVOR","FBM","Industrial & Scientific",54170,840281540396,"N/A",0840281540396,"N/A","Borescopes",171,203.69,-10,125,32,-17,27504.09,6832.6,70,4.3,"VEVOR Store","China",2,1744,"N/A","Large Standard-Size",13.8,12.2,6.9,6.5,"N/A","N/A","06/30/2025",32,9,3,1.79
"https://amazon.com/dp/B0FFGFYVK9","https://m.media-amazon.com/images/I/71xpKIfEuvL._SX450_.jpg","B0FFGFYVK9","𝟐𝟎𝟐𝟔 𝐧𝐞𝐰 HD 1080P Sewer Camera with DVR 32GB, 4.3"" IPS Drain Camera (Plug and Play), HD 1080P Pipe Inspection Camera, 5000mAh, Endoscope Camera with 4-Level LED Lights, Cable Marking, 100ft/30M","ChoosePRO","FBA","Industrial & Scientific",54913,"N/A","N/A","N/A","N/A","Borescopes",173,259.99,-150,14,14,,3639.86,3639.71,6,5,"ChoosePRO Direct","Hong Kong",1,0,"N/A","Large bulky",6.97,14.02,16.19,7.17,796.53,2197.33,"10/31/2025",5,6,0,2.34
"https://amazon.com/dp/B0FHK3NQ4R","https://m.media-amazon.com/images/I/71n6pok+KQL._SX450_.jpg","B0FHK3NQ4R","Sanyipace 18MM Sewer Camera, 66FT/20M Drain Inspection Camera with Microphone and Speaker, 1080P IP68 Waterproof Pipe Camera with 8 LEDs, Stiff Cable for Drain Duct Plumbing Inspection, 32GB Card","Sanyipace","FBA","Industrial & Scientific",55472,"N/A","N/A","N/A","N/A","Borescopes",174,199.88,12,14,19,,3149.34,3714.4,126,4.4,"Yans Minie","China",1,0,"N/A","Large bulky",9,10.6,11.3,7.2,542.75,1497.25,"09/30/2025",4,7,6,0.11
"https://amazon.com/dp/B0FHK5GK5M","https://m.media-amazon.com/images/I/615u4S-yL1L._SX450_.jpg","B0FHK5GK5M","Sanyipace Sewer Camera 100FT/30M, 5"" IPS HD Inspection Camera with 32GB TF Card, DVR with Speaker, 8 LED Lights, Waterproof Pipe Camera for Drain Pipe Plumbing Sewer Line Inspection","Sanyipace","FBA","Industrial & Scientific",55488,"N/A","N/A","N/A","N/A","Borescopes",174,269.88,-11,14,6,,3149.34,1652.44,126,4.4,"Yans Minie","China",1,0,"N/A","Large bulky",9,10.58,11.75,9,563.3,1553.94,"09/30/2025",4,7,6,0.11
"https://amazon.com/dp/B0DP9QQZC1","https://m.media-amazon.com/images/I/717mx0ETEpL._SX450_.jpg","B0DP9QQZC1","Sanyipace Sewer Camera 165FT/50M, 0.67in/17mm Pipe Inspection Camera with Light, 5600mAh Battery, Meter Maker, Mic & Speaker, 4.3"" Screen, 8 LEDs, 1000TVL Plumbing Snake Camera, Included 32GB Card","Sanyipace","FBA","Industrial & Scientific",55495,"N/A","N/A","N/A","N/A","Borescopes",174,359.99,-6,68,15,30,21657.29,5276.77,126,4.4,"Yans Minie","China",1,0,"N/A","Large bulky",11.02,12.52,14,13.5,972.5,2682.76,"07/31/2025",12,6,6,0.54
"https://amazon.com/dp/B0FBWTBNTY","https://m.media-amazon.com/images/I/71aDOQ65tKL._SX450_.jpg","B0FBWTBNTY","NIDAGE 7'' IPS Two-Way Articulating Borescope 0.24in Endoscope Camera with Light Flexible Inspection Camera with Articulated Snake Head, Automotive Mechanics Fiber Optic Scope Cam 5.3FT","NIDAGE","FBA","Industrial & Scientific",56048,"N/A","N/A","N/A","N/A","Borescopes",175,168.99,3,58,58,-6,9749.74,9749.56,36,4.6,"TELESION","China",1,0,"N/A","Large bulky",3.58,9.61,18.27,3.77,316.46,873,"09/30/2025",5,7,0,1.6
"https://amazon.com/dp/B0CGMZ6V4N","https://m.media-amazon.com/images/I/71QWzbQekLL._SX450_.jpg","B0CGMZ6V4N","HBUDS Self Leveling Sewer Inspection Camera with Locator 165ft, 9"" Color Monitor Drain Pipe Cameras with 512Hz Sonde and Receiver, 12V 4500mAh Rechargeable Battery Plumbing Camera Snake with DVR 16GB","HBUDS","FBA","Industrial & Scientific",56640,717021376044,"N/A",0717021376044,"N/A","Borescopes",176,1041.23,-2,51,3,-63,26194.76,2947.01,214,4.1,"Hanxuan tech","China",1,1693,"N/A","Large bulky",8.5,17.8,24.17,23.85,1841.16,5079.06,"02/28/2025",27,7,6,0.24
"https://amazon.com/dp/B0C2Z5XR8S","https://m.media-amazon.com/images/I/61Hphsvh9qL._SX450_.jpg","B0C2Z5XR8S","HBUDS Sewer Camera, Self-Leveling Drain Pipe Cameras with Meter Counter, 12V 4500mAh Battery Plumbing Snake Camera Light, 7'' Color HD Duct Chimney Inspection DVR Recorder 16GB 7D3A,165ft","HBUDS","FBA","Industrial & Scientific",56640,774196180968,"N/A",0774196180968,"N/A","Borescopes",176,531.23,-2,51,8,-63,26194.76,3820.07,214,4.1,"Hanxuan tech","China",1,1693,"N/A","Large bulky",7.75,16.25,17,16.3,1077.9,2973.52,"02/28/2025",39,7,6,0.24
"https://amazon.com/dp/B0C2ZBB6V5","https://m.media-amazon.com/images/I/71SjUR4hqIL._SX450_.jpg","B0C2ZBB6V5","HBUDS Sewer Camera Self Leveling, 100ft Drain Pipe Cameras with Meter Counter, 12V 4500mAh Battery Plumbing Snake Camera with Light, 7"" Color HD Duct Chimney Sewer Inspection Cam, DVR Recorder 16GB","HBUDS","FBA","Industrial & Scientific",56640,774196180999,"N/A",0774196180999,"N/A","Borescopes",176,379.99,-4,51,15,-63,26194.76,5881.58,214,4.1,"Hanxuan tech","China",1,1693,"N/A","Large bulky",8.2,14.4,16.5,13.8,980.93,2706,"02/28/2025",39,7,6,0.24
"https://amazon.com/dp/B07RRNCV3G","https://m.media-amazon.com/images/I/61mpDGKmelL._SX450_.jpg","B07RRNCV3G","HBUDS Self Leveling Sewer Inspection Camera with Locator 100ft, 9"" Color Monitor Drain Pipe Cameras with 512Hz Sonde and Receiver, 12V 4500mAh Rechargeable Battery Plumbing Camera Snake with DVR 16GB","HBUDS","FBA","Industrial & Scientific",56661,699938561143,"N/A",0699938561143,"N/A","Borescopes",176,956.23,-5,51,5,-63,26194.76,4171.47,214,4.1,"Hanxuan tech","China",1,1693,"N/A","Large bulky",8.75,16.5,21.5,20.5,1562.81,4311.2,"02/28/2025",81,8,6,0.24
"https://amazon.com/dp/B0FF1WH9GJ","https://m.media-amazon.com/images/I/71XbmMZQPYL._SX450_.jpg","B0FF1WH9GJ","Zealtron Dual Lens Endoscope Camera with Light, 5.0'' IPS Screen Inspection Camera, 1080P HD Handheld Borescope with 8 LED Lights, 7.9mm IP67 Waterproof Lens with 16.5ft Semi-Rigid Cable","zealtron","FBA","Industrial & Scientific",56987,"N/A","N/A","N/A","N/A","Borescopes",177,49.99,-5,25,47,,1246.07,2339.22,71,4.8,"Zealtron","China",1,0,"N/A","Large Standard-Size",2.95,6.26,10.98,1.41,102.22,281.99,"10/31/2025",5,10,0,0.35
"https://amazon.com/dp/B0FLXRVP6M","https://m.media-amazon.com/images/I/61K3a2+FpXL._SX450_.jpg","B0FLXRVP6M","THINKCAR TES102 Endoscope Camera with Light, 0.21 Inch HD Borescope with 6 Adjustable LED Light, IP67 Waterproof Semi-Rigid Snake Camera, One Click Snapshot Inspection Borescope","thinkcar","FBA","Industrial & Scientific",57271,768297281662,"N/A",0768297281662,"N/A","Borescopes",178,59.98,242,44,44,,2611.33,2610.76,12,4.1,"XingKa Tech","China",1,0,"N/A","Large Standard-Size",1.93,5.16,11.5,0.62,57.66,159.06,"09/30/2025",3,8,0,3.63
"https://amazon.com/dp/B07SR2LHBT","https://m.media-amazon.com/images/I/71DAtpJx1lL._SX450_.jpg","B07SR2LHBT","HBUDS Pipe Camera, 50M/165ft Cable, 7 Inch LCD, Black, Wired, IP68 Waterproof","HBUDS","FBM","Industrial & Scientific",57469,699930210209,"N/A",0699930210209,"N/A","Borescopes",175,459.99,37,51,6,-63,26194.76,3860.1,214,4.1,"Hanxuan tech","China",2,1693,"N/A","Large bulky",8.6,17.2,18.8,17.9,"N/A","N/A","02/28/2025",77,7,6,0.24
"https://amazon.com/dp/B0FG7XVDQ5","https://m.media-amazon.com/images/I/71A7GryLgUL._SX450_.jpg","B0FG7XVDQ5","Endoscope with Light, 1080P HD Borescope with 8 Adjustable LEDs, 4.3"" Inspection Camera with 16.4ft Semi-Rigid Cable, 8mm IP67 Waterproof Lens-Father's Day Gift&Cool Gadgets for Men","ILIHOME","FBA","Industrial & Scientific",57883,"N/A","N/A","N/A","N/A","Borescopes",179,19.99,-13,192,192,,3842.37,3840.31,97,4.2,"ZhiYi-EU","China",1,0,"N/A","Large Standard-Size",2.8,5.71,8.46,1.19,68,187.6,"09/30/2025",4,7,1,1.98
"https://amazon.com/dp/B0CJ8TBWG8","https://m.media-amazon.com/images/I/71aLijlz+iL._SX450_.jpg","B0CJ8TBWG8","DXZtoz 3.9mm Articulating Borescope, Professional Industrial Endoscope Inspection Camera with Super Thin Articulated Camera, Flexible Fiber Optic Scope with Light, Cool Gadgets for Men- 3.3FT","DXZtoz","FBA","Industrial & Scientific",58759,"N/A","N/A","N/A","N/A","Borescopes",180,200.19,2,62,62,-23,12900.49,12900.36,75,4,"DXZtoz-USA","China",1,952,129,"Large Standard-Size",3.19,8.58,14.68,2.45,202.29,558.05,"04/30/2025",25,6,0,0.83
"https://amazon.com/dp/B0DZMN1941","https://m.media-amazon.com/images/I/41J1H5ugH8L._SX450_.jpg","B0DZMN1941","Anykit 360° Articulated Engine Endoscope, Aviation Hole Sight with 0.25"" Convertible Snake Camera, 5"" IPS Video Check Camera with Light for Mechanic Maintenance Technician - 3.28'","Anykit","FBA","Industrial & Scientific",58885,"N/A","N/A","N/A","N/A","Borescopes",181,179.99,-33,50,20,,7078.5,4475.6,1,5,"AnyKit","China",1,0,"N/A","Large Standard-Size",3.74,8.62,16.69,3.26,270.9,747.31,"10/31/2025",8,6,0,50.21
"https://amazon.com/dp/B07PWZ3KKF","https://m.media-amazon.com/images/I/71-VLmkuBGL._SX450_.jpg","B07PWZ3KKF","Sewer Camera 100FT, Can Connect External Monitor, Zoom in and Out, IP68 Waterproof, 12 pcs Adjustable Light, Plumbing Snake Cam with DVR Pipe Video Inspection, for Sewer Line, Drain, Duct, Plumbing","anysun","FBA","Industrial & Scientific",58956,717326221162,"N/A",0717326221162,"N/A","Borescopes",179,459.99,-3,44,8,-48,20530.06,3336.34,514,4.2,"ToBestGift","China",1,0,"N/A","Large bulky",8,14.75,16.75,15.1,995.11,2745.14,"04/30/2025",81,7,9,0.09
"https://amazon.com/dp/B07PBZZKJD","https://m.media-amazon.com/images/I/71-VLmkuBGL._SX450_.jpg","B07PBZZKJD","Sewer Camera, Can Connect External Monitor, Zoom in and Out, IP68 Waterproof, 12 pcs Adjustable Light, Plumbing Snake Cam with DVR Pipe Video Inspection, for Sewer Line, Drain, Duct, Plumbing(165FT)","anysun","FBA","Industrial & Scientific",58961,"N/A","N/A","N/A","N/A","Borescopes",179,489.99,-11,44,5,-48,20530.06,2426.42,514,4.2,"ToBestGift","China",1,0,"N/A","Large bulky",8.18,17,18.81,18.3,1316.94,3632.94,"04/30/2025",81,8,9,0.09
"https://amazon.com/dp/B0CYGYXDXZ","https://m.media-amazon.com/images/I/71PTZpu4+VL._SX450_.jpg","B0CYGYXDXZ","Sewer Camera with Self-Leveling, Built-in Distance Counter, Can Connect External Monitor, Zoom in and Out, IP68 Waterproof, 12 pcs Adjustable Light, Plumbing Drain Video Cam with DVR (100FT)","anysun","FBA","Industrial & Scientific",59912,717203891624,"N/A",0717203891624,"N/A","Borescopes",182,529.99,-11,44,3,-48,20530.06,1435.22,514,4.2,"ToBestGift","China",1,0,"N/A","Large bulky",8.13,16.88,18.88,16.8,1304.49,3598.59,"04/30/2025",20,8,9,0.09
"https://amazon.com/dp/B0B4SDBMPX","https://m.media-amazon.com/images/I/71-VLmkuBGL._SX450_.jpg","B0B4SDBMPX","Sewer Camera 65FT, Can Connect External Monitor, Zoom in and Out, IP68 Waterproof, 12 pcs Adjustable Light, Plumbing Snake Cam with DVR Pipe Video Inspection, for Sewer Line, Drain, Duct, Plumbing","anysun","FBA","Industrial & Scientific",59912,774829649299,"N/A",0774829649299,"N/A","Borescopes",182,369.99,-3,44,10,-48,20530.06,3790.09,514,4.2,"ToBestGift","China",1,0,"N/A","Large bulky",9,14,17,15.85,1078.44,2975,"04/30/2025",41,8,9,0.09
"https://amazon.com/dp/B0CYGX2KY3","https://m.media-amazon.com/images/I/71EcUvEQ2ML._SX450_.jpg","B0CYGX2KY3","Sewer Camera with Self-Leveling, Can Connect External Monitor, Zoom in and Out, IP68 Waterproof, 12 pcs Adjustable Light, Plumbing Cam with DVR, for Sewer Line, Drain, Duct, Plumbing (165FT)","anysun","FBA","Industrial & Scientific",59912,717203891600,"N/A",0717203891600,"N/A","Borescopes",182,569.99,-19,44,4,-48,20530.06,2063.98,514,4.2,"ToBestGift","China",1,0,"N/A","Large bulky",8,17,18.75,18.6,1283.85,3541.67,"04/30/2025",20,9,9,0.09
"https://amazon.com/dp/B09HSC4Q8Y","https://m.media-amazon.com/images/I/71gP6gP6QyL._SX450_.jpg","B09HSC4Q8Y","Sewer Camera with Locator, Anysun 165FT with 512HZ Locator Set and Receiver for Drain Plumbing Video Inspection 7'' LCD HD Screen Waterproof IP68 Cameras with 12pcs LED Light(8GB SD Card-DVR Record)","anysun","FBA","Industrial & Scientific",59925,770887234347,"N/A",0770887234347,"N/A","Borescopes",182,859.99,-11,44,2,-48,20530.06,1401.15,514,4.2,"ToBestGift","China",1,0,"N/A","Large bulky",12.4,19.6,25,25.38,3059.1,8438.89,"04/30/2025",49,9,9,0.09
"https://amazon.com/dp/B07RGV67HY","https://m.media-amazon.com/images/I/71V+CEuJ6EL._SX450_.jpg","B07RGV67HY","Anysun Sewer Camera 100ft Snake Cam with Distance Counter DVR Video Sewer Pipe Inspection Equipment 7 inch LCD Monitor Duct HVAC 1000TVL Endoscope Waterproof IP68 Camera (8GB SD Card)","anysun","FBA","Industrial & Scientific",59926,699996266981,"N/A",0699996266981,"N/A","Borescopes",182,529.99,-13,44,4,-48,20530.06,2075.2,514,4.2,"ToBestGift","China",1,0,"N/A","Large bulky",8.2,17.2,19,17.1,1349.18,3721.89,"04/30/2025",78,8,9,0.09
"https://amazon.com/dp/B09HSBR5RG","https://m.media-amazon.com/images/I/71gP6gP6QyL._SX450_.jpg","B09HSBR5RG","Sewer Camera with Locator, Anysun 100FT with 512HZ Locator Set and Receiver for Drain Plumbing Video Inspection 7'' LCD HD Screen Waterproof IP68 Cameras with 12pcs LED Light(8GB SD Card-DVR Record)","anysun","FBA","Industrial & Scientific",59931,770887234323,"N/A",0770887234323,"N/A","Borescopes",182,859.99,-25,44,2,-48,20530.06,1568.09,514,4.2,"ToBestGift","China",1,0,"N/A","Large bulky",8.2,16.7,21.8,19.8,1503.01,4146.24,"04/30/2025",49,9,9,0.09
"https://amazon.com/dp/B0CJC8KTBM","https://m.media-amazon.com/images/I/71HhC87QeUL._SX450_.jpg","B0CJC8KTBM","Endoscope Camera with Light, 5-inch Dual Lens 1920P HD Borescope, 7.9mm Camera with 9 LEDs, 16.5ft Semi-Rigid Cable, IP67 Waterproof - for Sewer/Drain Pipe, Automotive Inspection, Tools & Cool Gadgets","Daxiongmao","FBA","Industrial & Scientific",60159,739944332556,"N/A",0739944332556,"N/A","Borescopes",183,49.99,33,43,43,,2364.64,2364.48,80,4.5,"leersi_jet","China",1,0,"N/A","Large Standard-Size",2.4,5.83,8.07,1.08,56.85,156.83,"05/31/2025",9,8,0,0.55
"https://amazon.com/dp/B0DY1KCDWW","https://m.media-amazon.com/images/I/71-mnVQNb8L._SX450_.jpg","B0DY1KCDWW","Sanyipace Pipe Inspection Camera 165FT/50M, Self-Leveling Sewer Camera, Distance Counter, DVR with Speaker, 32GB Card, 10.1"" IPS Screen Plumbing Camera with 12PCS Lights, 5X Zoom, 5mm/0.2-inch Cable","Sanyipace","FBA","Industrial & Scientific",61051,"N/A","N/A","N/A","N/A","Borescopes",185,759.88,-5,78,20,,67776.19,15287.56,6,4.8,"Yans Minie","China",1,0,"N/A","Large bulky",13,12,11.2,10,879.67,2426.67,"10/31/2025",9,7,6,12.96
"https://amazon.com/dp/B0FPFQD34F","https://m.media-amazon.com/images/I/71jYsqppO7L._SX450_.jpg","B0FPFQD34F","Sanyipace Sewer Inspection Camera, 328FT/100M Drain Camera with Locator, 7MM Stiffer Cable, Self-Leveling, 512Hz Transmitter, 10.1"" Screen Pipe Camera, 32GB Card, Distance Counter","Sanyipace","FBA","Industrial & Scientific",61069,"N/A","N/A","N/A","N/A","Borescopes",185,1599.88,"N/A",78,5,,67776.19,8247.34,6,4.8,"Yans Minie","China",1,0,"N/A","Large bulky",14,19,25,35.07,3348.09,9236.11,"10/31/2025",2,7,6,12.96
"https://amazon.com/dp/B0DYDGXG2N","https://m.media-amazon.com/images/I/710SFrniiRL._SX450_.jpg","B0DYDGXG2N","Sanyipace Sewer Camera 100FT/30M, Self-Leveling Drain Camera, DVR with Speaker, 1080P Pipe Camera with Distance Counter, 32GB Card, 5mm/0.2-inch Cable, IP68 Waterproof Plumbing Camrea for Sewer Line","Sanyipace","FBA","Industrial & Scientific",61071,"N/A","N/A","N/A","N/A","Borescopes",185,659.88,-3,78,29,,67776.19,19072.56,6,4.8,"Yans Minie","China",1,0,"N/A","Large bulky",12,15,20.5,17.9,1857.81,5125,"10/31/2025",9,7,6,12.96
"https://amazon.com/dp/B0DYJGWGHB","https://m.media-amazon.com/images/I/71enHmxNcRL._SX450_.jpg","B0DYJGWGHB","Sanyipace Sewer Inspection Camera 230FT/70M, Self-Leveling Drain Pipe Camera, Distance Counter, 5-Level Brightness, 1080P Plumbing Camera for Plumber, 32GB Card, 4500mAh Battery, 5mm/0.2-inch Cable","Sanyipace","FBA","Industrial & Scientific",61071,"N/A","N/A","N/A","N/A","Borescopes",185,859.88,-3,78,14,,67776.19,12178.36,6,4.8,"Yans Minie","China",1,0,"N/A","Large bulky",11.5,15.05,20.5,21.45,1786.34,4927.83,"10/31/2025",9,7,6,12.96
"https://amazon.com/dp/B0CHH8NY8G","https://m.media-amazon.com/images/I/51BrEQ0actL._SX450_.jpg","B0CHH8NY8G","Anykit Endoscope Camera with Light,1080P Dual Lens Endoscope，6"" IPS Screen Borescope, Plumbing Snake Inspection Camera with Split Screen, 32GB Card, Plumbing Snake Camera for Home (16.5FT)","Anykit","FBA","Industrial & Scientific",61072,"N/A","N/A","N/A","N/A","Borescopes",184,99.99,-10,23,23,151,2901.08,2900.82,21,4.7,"AnyKit","China",2,367,"N/A","Large Standard-Size",4.29,13.15,14.88,5.42,422.63,1165.88,"05/31/2024",24,8,2,1.09
"https://amazon.com/dp/B0DTHZDGYD","https://m.media-amazon.com/images/I/715yDII3+iL._SX450_.jpg","B0DTHZDGYD","Teslong 360 Articulating Borescope with Light, 5'' Monitor Industrial Inspection Camera with 4-Way Joystick Articulation, HD Endoscope Camera for Automotive, Pipes, and Mechanics (0.24inch-5FT)","Teslong","FBA","Industrial & Scientific",61360,"N/A","N/A","N/A","N/A","Borescopes",186,449.99,4,71,71,-12,31682.35,31681.51,28,4.7,"Teslong","China",1,0,"N/A","Large Standard-Size",5.98,10.75,14.57,3.75,471.57,1300.88,"08/31/2025",10,9,0,2.53
"https://amazon.com/dp/B0F6TYDVT4","https://m.media-amazon.com/images/I/717wEvh18uL._SX450_.jpg","B0F6TYDVT4","Sewer Camera 100ft,SPRIDRAIN Drain Pipe Camera HD 5in Screen with 32GB DVR,Waterproof IP68 Works Underwater Up to 10Meters Sewer Inspection borescopes for Plumber(Fits Pipes>0.9"" Diameter,100ft/30M)","SPRIDRAIN","FBA","Industrial & Scientific",61368,"N/A","N/A","N/A","N/A","Borescopes",187,229.99,-138,16,4,,2924.4,796.59,1,5,"SYANSPAN TECH","China",3,0,"N/A","Large Standard-Size",12,12,7.5,8.6,543.75,1500,"10/31/2025",7,9,2,8
"https://amazon.com/dp/B0F6V19NNQ","https://m.media-amazon.com/images/I/71udZI1xgpL._SX450_.jpg","B0F6V19NNQ","Sewer Camera 100ft,SPRIDRAIN Drain Pipe Camera HD 4.3in Screen with 32GB DVR,Waterproof IP68 Works Underwater Up to 10Meters Sewer Inspection borescopes for Plumber(Fits Pipes>0.7"" Diameter,100ft/30M)","SPRIDRAIN","FBA","Industrial & Scientific",61368,"N/A","N/A","N/A","N/A","Borescopes",187,199.99,-130,16,12,,2924.4,2127.74,1,5,"SYANSPAN TECH","China",2,0,"N/A","Large Standard-Size",12,12,7.5,8.6,543.75,1500,"10/31/2025",7,9,2,8
"https://amazon.com/dp/B0DLS8PVX3","https://m.media-amazon.com/images/I/71IsfO7S-FL._SX450_.jpg","B0DLS8PVX3","Anysun Sewer Camera with Locator, Self Leveling, Distance Counter, 7MM Thicker Cable, Pipe Inspection Cameras with 9'' 1080P Monitor, Video Drain Cam IP68 Waterproof Industrial Borescope (150Ft/45M)","anysun","FBA","Industrial & Scientific",61590,"N/A","N/A","N/A","N/A","Borescopes",188,1104.99,"N/A",64,8,-11,86658.21,10646.27,91,4.2,"Yongchangsheng tech","China",1,722,"N/A","Large bulky",13.9,20,21,26,2939.27,8108.33,"01/31/2025",10,8,8,0.7
