"URL","Image URL","ASIN","Title","Brand","Fulfillment","Category","BSR","UPC","GTIN","EAN","ISBN","Subcategory","Subcategory BSR","Price","Price Trend (90 days) (%)","Parent Level Sales","ASIN Sales","Sales Trend (90 days) (%)","Parent Level Revenue","ASIN Revenue","Review Count","Reviews Rating","Seller","Seller Country/Region","Number of Active Sellers","Last Year Sales","Sales Year Over Year (%)","Size Tier","Length","Width","Height","Weight","Storage Fee (Jan - Sep)","Storage Fee (Oct - Dec)","Best Sales Period","Age (Month)","Number of Images","Variation Count","Sales to Reviews"
"https://amazon.com/dp/B0D16Y8FZM","https://m.media-amazon.com/images/I/61gVSVjmQIL._SX450_.jpg","B0D16Y8FZM","Borescope, Lighted Endoscope Camera, 2.0 MP HD Inspection, 4.3 Inch IPS Screen 1080P HD, IP67 Waterproof Pipe Snake Camera, 16.5ft Semi-Rigid Sewer Lens","LIIAMOAR","FBA","Industrial & Scientific",243415,"N/A","N/A","N/A","N/A","Borescopes",491,36.09,-12,13,6,217,1367.11,235.62,30,4.5,"LIIAMOAR","China",1,0,"N/A","Large Standard-Size",3.07,5.87,10.94,1.34,99.26,273.82,"09/30/2025",19,7,4,0.45
"https://amazon.com/dp/B0D1CLV28L","https://m.media-amazon.com/images/I/71JbFdkIuCL._SX450_.jpg","B0D1CLV28L","Borescope with Dual Cameras Rotating 360°, 5.0 MP Pixel HD Camera, 5 Inch IPS Screen, 16.5 ft Snake Pipe Inspection Endoscope for Automotive and Aircraft Mechanical Video Inspection Scope Black","LIIAMOAR","FBA","Industrial & Scientific",243415,"N/A","N/A","N/A","N/A","Borescopes",491,94.99,-19,13,4,217,1367.11,367.4,30,4.5,"LIIAMOAR","China",1,0,"N/A","Large Standard-Size",12.6,11,4.4,3.3,307.04,847,"09/30/2025",19,8,4,0.45
"https://amazon.com/dp/B0CWY87BLX","https://m.media-amazon.com/images/I/61FNXe4dFgL._SX450_.jpg","B0CWY87BLX","【Dual-Lens BORESCOPE Inspection Camera HD with Light】 Endoscope with Adjustable LED - Compatible with iPhone, Samsung, iPad, iOS & Android - 3.0MP HD, IP67 Waterproof, 16.5ft/5m","EmbraceYe","FBA","Industrial & Scientific",243476,860011616757,"N/A",0860011616757,"N/A","Borescopes",492,39.89,6,13,13,938,498.22,497.99,39,4,"EmbraceYe","China",2,172,"N/A","Large Standard-Size",1.69,4.96,5.24,0.53,22.11,61.01,"06/30/2024",20,8,0,0.33
"https://amazon.com/dp/B0FMFF8QY2","https://m.media-amazon.com/images/I/71ivsTk36aL._SX450_.jpg","B0FMFF8QY2","Endoscope Camera with Light, 1920P HD borescope Camera,IP67 Waterproof Snake,16.4ft Semi-Rigid Inspection Tool with 8 LED Lights, Borescope for iPhone/Android (Micro-USB/Type-C/Lightning)","ClarVise","FBA","Industrial & Scientific",244073,"N/A","N/A","N/A","N/A","Borescopes",495,18.99,52,24,24,,446.82,446.4,19,4.5,"ClarVise","China",1,0,"N/A","Large Standard-Size",5.28,4.92,1.32,0.44,17.26,47.63,"09/30/2025",3,9,0,1.47
"https://amazon.com/dp/B00CBKFJ9Y","https://m.media-amazon.com/images/I/51GdMrYHHwL._SX450_.jpg","B00CBKFJ9Y","Supereyes NA002-1 Digital Borescope Side View Mirror Set 30 45 60 Degrees for Supereyes Borescope N005 N013J N015 Series …","Supereyes","FBM","Industrial & Scientific",244369,045635335783,"N/A",0045635335783,"N/A","Borescopes",496,10,-4,9,9,-27,92.23,92.09,534,3.9,"Supereyes Official","China",2,142,26,"Small Standard-Size",0.3,3.8,4.9,0.05,"N/A","N/A","06/30/2025",151,2,0,0.02
"https://amazon.com/dp/B08P2BY32L","https://m.media-amazon.com/images/I/91svNuhEqRL._SX450_.jpg","B08P2BY32L","Jonard Tools Wispy CF-200 Multipurpose Wireless Inspection Camera - WiFi Borescope & Cable Pulling Tool with Telescoping Pole, Wrist Band & Rod Adapters","Jonard Tools","FBM","Industrial & Scientific",245139,810053350133,"N/A",0810053350133,"N/A","Borescopes",488,199.95,7,5,5,-71,1093.06,1092.92,49,3.9,"RedBarn Warehouse","USA",5,150,-11,"Large Standard-Size",2.64,7.17,12.17,1.54,"N/A","N/A","11/30/2023",60,6,0,0.11
"https://amazon.com/dp/B0CM3CP13Y","https://m.media-amazon.com/images/I/716qDLXAEjL._SX450_.jpg","B0CM3CP13Y","PETCHOR Dual Lens Endoscope Camera with Light, 1920P Borescope Inspection Camera with 8+1 Adjustable LED Lights, 7.9mm IP67 Waterproof Snake Camera for iPhone, Android, iOS","PETCHOR","FBA","Industrial & Scientific",245255,"N/A","N/A","N/A","N/A","Borescopes",489,21.99,-6,4,1,150,69.48,23.19,"N/A","N/A","PETCHOR-US","China",1,32,"N/A","Large Standard-Size",4.72,4.72,1.14,0.39,12.79,35.27,"09/30/2025",25,7,2,"N/A"
"https://amazon.com/dp/B0DHZQCZM4","https://m.media-amazon.com/images/I/41IqamkepbL._SX450_.jpg","B0DHZQCZM4","VNisenllc Industrial Endoscope Camera 0° Detector with Light Handheld High Brightness Borescope LED Mini Cold Light Source","VNisenllc","FBM","Industrial & Scientific",245281,717392803378,"N/A",0717392803378,"N/A","Borescopes",490,382,-7,18,5,276,2701.56,1790.83,3,5,"Northwolf","China",1,107,"N/A","N/A","N/A","N/A","N/A","N/A","N/A","N/A","09/30/2025",14,7,3,6.03
"https://amazon.com/dp/B0DGD1YS48","https://m.media-amazon.com/images/I/71l+JOm5XEL._SX450_.jpg","B0DGD1YS48","FOXWELL VS300 Car Endoscope, USB Micro-USB Type-C, 5.5mm Snake Camera, 1280 * 720P, IP67 Waterproof, 6 Brightness Adjustable LED Lights, Suitable for FOXWELL NT809BT, NT909,NT1009, Android Phone, PC","FOXWELL","FBA","Industrial & Scientific",245606,"N/A","N/A","N/A","N/A","Borescopes",498,69.99,-10,12,12,-2,810.06,809.79,29,4,"OBDZON","China",1,0,"N/A","Large Standard-Size",1.85,5.98,11.85,0.79,66,182.08,"02/28/2025",14,7,0,0.4
"https://amazon.com/dp/B08QYX32R7","https://m.media-amazon.com/images/I/81hKy-cGFfL._SX450_.jpg","B08QYX32R7","Sewer Camera 165ft , 512Hz Sonde Transmitter Plumbing Camera Snake with DVR Recorder, Inspection Cam with 7"" LCD Monitor with Fiber Optic Cable Wire (8 GB SD Card Included) (165ft/50m)","anysun","FBA","Industrial & Scientific",245684,779880273070,"N/A",0779880273070,"N/A","Borescopes",492,569.92,-6,5,1,-62,2444.3,827.44,15,3.8,"HZDZ_Shop","China",1,160,-13,"Large bulky",8.13,16.88,19,18.55,1312.78,3621.46,"07/31/2024",60,9,3,0.37
"https://amazon.com/dp/B07T7G66P8","https://m.media-amazon.com/images/I/81bcRBHka7L._SX450_.jpg","B07T7G66P8","Sewer Camera,100ft Plumbing Drain Camera with DVR 30M Cable Industrial Endoscope Waterproof IP68 Cable Snake Video System with 7 Inch LCD Monitor 1000TVL DVR Recorder","anysun","FBA","Industrial & Scientific",245708,699953439793,"N/A",0699953439793,"N/A","Borescopes",492,489.99,-9,5,4,-62,2444.3,1616.51,83,4.3,"HZDZ_Shop","China",1,160,-13,"Large bulky",7.2,14.9,16.9,15,912.81,2518.1,"07/31/2024",77,6,3,0.07
"https://amazon.com/dp/B0D6FTLCBB","https://m.media-amazon.com/images/I/71pNOerY-aL._SX450_.jpg","B0D6FTLCBB","Oiiwak OK-S1 Sewer Camera with Locator, 10.1"" 1080P Touch-Screen, Self-Leveling, Distance Counter, IP68 Waterproof, DVR/Audio Recording, Includes Keyboard & 16GB SD Card - 164FT/50M","Oiiwak","FBA","Industrial & Scientific",245802,"N/A","N/A","N/A","N/A","Borescopes",499,1199.99,-43,12,6,,15992.85,7480.15,73,3.8,"Oiiwak Tech","China",1,0,"N/A","Large bulky",14,17,25.2,34.15,3019.62,8330,"10/31/2025",17,6,8,0.16
"https://amazon.com/dp/B0D6VMKFVQ","https://m.media-amazon.com/images/I/71uiz0QK4aL._SX450_.jpg","B0D6VMKFVQ","Oiiwak Sewer Camera with Locator, OK-S1 7mm Diameter Cable 10.1"" Touch-Screen Sewer Inspection Camera with DVR for Drain Plumbing Pipe - 512 Hz Sending Set, Self-Leveling, Distance Counter, 165FT","Oiiwak","FBA","Industrial & Scientific",245806,"N/A","N/A","N/A","N/A","Borescopes",499,1799.99,-3,12,2,,15992.85,2908.55,73,3.8,"Oiiwak Tech","China",1,0,"N/A","Large bulky",14.75,17,25.25,35.7,3187.7,8793.66,"10/31/2025",17,9,8,0.16
"https://amazon.com/dp/B0DMW3PTQ1","https://m.media-amazon.com/images/I/81d6EVqggwL._SX450_.jpg","B0DMW3PTQ1","Oiiwak Sewer Camera with Locator 100ft, 7 mm Cable Self Leveling Drain Inspection Camera with Distance Counter, DVR, 10.1"" HD Touchscreen, Keyboard, IP68 Waterproof and 12 Adjustable Light","Oiiwak","FBA","Industrial & Scientific",245807,"N/A","N/A","N/A","N/A","Borescopes",499,1399.99,-17,12,4,,15992.85,5603.61,73,3.8,"Oiiwak Tech","China",1,0,"N/A","Large bulky",25.59,16.93,14.57,33.4,3178.06,8767.07,"10/31/2025",12,7,8,0.16
"https://amazon.com/dp/B0CMQPNSB2","https://m.media-amazon.com/images/I/51841lJrADL._SX450_.jpg","B0CMQPNSB2","USB 3 in 1 Endoscope Camera with Light, Borescope Inspection Camera with 5.5mm Lens for","YWBL-WH","FBM","Industrial & Scientific",246550,"N/A","N/A","N/A","N/A","Borescopes",496,14.45,4,1,1,-14,10.57,10.55,3,4.3,"Partgry-T","China",2,0,"N/A","Large Standard-Size",1.34,4.72,4.8,0.37,"N/A","N/A","05/31/2025",24,9,0,0.24
"https://amazon.com/dp/B0CQK1GSHP","https://m.media-amazon.com/images/I/81mwVnAddzL._SX450_.jpg","B0CQK1GSHP","Anysun Self-Leveling Sewer Camera with Locator, 9'' Pipe Drain Inspection System, 100ft Meter Marker Cable, DVR, 12 Adjustable Lights for Plumbing Snake","anysun","FBA","Industrial & Scientific",247031,"N/A","N/A","N/A","N/A","Borescopes",713,799.99,-7,7,4,9,8073.02,3063.01,36,4,"HZDZ_Shop","China",1,113,"N/A","Large bulky",9.09,16.93,22.32,21.19,1729.38,4770.7,"06/30/2024",23,7,6,0.19
"https://amazon.com/dp/B07P2JPKW6","https://m.media-amazon.com/images/I/71NUzkoEUDL._SX450_.jpg","B07P2JPKW6","20M 65ft Replacement Cable for HBUDS Sewer Camera (20M/30M/50M Cable Optional) Model:7D1","HBUDS","FBM","Industrial & Scientific",247424,"N/A","N/A",8011657107303,"N/A","Borescopes",1020,189.99,-2,6,3,-32,1221.7,652.95,9,3.3,"Hanxuan tech","China",1,78,34,"N/A","N/A","N/A","N/A","N/A","N/A","N/A","03/31/2025",81,7,3,0.65
"https://amazon.com/dp/B0DZ66K1CC","https://m.media-amazon.com/images/I/61ikHUIkFXL._SX450_.jpg","B0DZ66K1CC","VEVOR 100 ft/30 m Drain Inspection Camera with 7"" Screen, IP68 Waterproof, 12 LED Lights, 16GB SD Card for Sewer Line, Duct Drain Pipe Plumbing","VEVOR","FBM","Industrial & Scientific",249553,197988857686,"N/A",0197988857686,"N/A","Borescopes",501,248.9,17,3,3,-88,948.01,947.87,4,2.8,"VEVOR Store","China",2,0,"N/A","Large bulky",16.54,7.48,14.96,11.9,"N/A","N/A","03/31/2025",8,12,0,1.09
"https://amazon.com/dp/B003A7YNRG","https://m.media-amazon.com/images/I/717dNvYLEQL._SX450_.jpg","B003A7YNRG","Extech BR250 Video Borescope/Wireless Inspection Camera","Extech","FBM","Industrial & Scientific",250246,793950632505,00793950632505,0793950632505,"N/A","Borescopes",500,188.99,"N/A",1,1,-42,269.18,269.1,39,3.3,"I.R.N. GROUP LLC","USA",1,31,-26,"Large Standard-Size",3.5,11,14.5,4.8,"N/A","N/A","07/31/2024",254,6,2,0.04
"https://amazon.com/dp/B0CHMT32JF","https://m.media-amazon.com/images/I/71nLbm117-L._SX450_.jpg","B0CHMT32JF","DEPSTECH 50FT Sewer Inspection Camera with 1080P Dual Lens, Led Light, 5"" IPS Screen, Split Screen, IP67 Waterproof Endoscope, 7.9mm Borescope Probe","DEPSTECH","FBA","Industrial & Scientific",250445,"N/A","N/A","N/A","N/A","Borescopes",504,119.99,-4,8,8,620,981.11,980.92,143,4.2,"Depstech","China",1,59,-97,"Large Standard-Size",3.07,8.98,13.46,4.08,186.83,515.38,"12/31/2023",25,9,0,0.06
"https://amazon.com/dp/B0F1Y5TN2Q","https://m.media-amazon.com/images/I/71mn7lAcF0L._SX450_.jpg","B0F1Y5TN2Q","Anysun 9"" Replacement Screen for Sewer Camera Mode 9DX23, High-Resolution LCD Screen, Compatible with Anysun HBUDS Pipe Inspection Cameras System-CR110-9DX23","anysun","FBM","Industrial & Scientific",250798,717382442068,"N/A",0717382442068,"N/A","Borescopes",506,129.99,-18,21,19,,2722.33,2462.21,"N/A","N/A","HZDZ_Shop","China",1,0,"N/A","N/A","N/A","N/A","N/A","N/A","N/A","N/A","10/31/2025",8,2,2,"N/A"
"https://amazon.com/dp/B082PG2GT6","https://m.media-amazon.com/images/I/61FY-07wr1L._SX450_.jpg","B082PG2GT6","Forbest Sewer Drain Inspection Camera, 130ft Fiberglass Cable, 7"" LCD Monitor, DVR Recorder & Battery, 512Hz Sonde Transmitter, Borescope Snake Camera, IP68 Waterproof Lens with Lights, Plumbing Tool","Forbest","FBM","Industrial & Scientific",252053,"N/A","N/A","N/A","N/A","Borescopes",504,949,7,6,1,-57,4320.46,1386.18,4,2.9,"Forbest Products Co.","USA",1,129,74,"Large bulky",12.5,14,14,15.7,"N/A","N/A","12/31/2024",71,7,4,1.39
"https://amazon.com/dp/B0D6SVHCMW","https://m.media-amazon.com/images/I/71dtvMbI+BL._SX450_.jpg","B0D6SVHCMW","HBUDS Sewer Camera with Locator 300ft, 7mm Cable, Self Leveling Drain Cameras with Distance Counter, 9"" 1080P HD Plumbing Camera Snake with Light, Pipe Inspection Cam with Built-in Mic and DVR 32GB","HBUDS","FBA","Industrial & Scientific",252467,774049592320,"N/A",0774049592320,"N/A","Borescopes",858,1699.99,-3,4,1,-69,5605.11,1041.51,8,4.4,"Hanxuan tech","China",1,0,"N/A","Large bulky",12.5,19,27.25,33.05,3258.41,8988.72,"03/31/2025",17,8,5,0.53
"https://amazon.com/dp/B0DFHVCQNG","https://m.media-amazon.com/images/I/51+bWTfCarL._SX450_.jpg","B0DFHVCQNG","Pipe Sewer Inspection Camera Protective Cover, Wheel Plastic Pipe Camera Protective Cover for Endoscope Part Accessory","Heayzoki","FBA","Industrial & Scientific",252607,"N/A","N/A","N/A","N/A","Borescopes",510,18.65,3,6,6,,125.32,125.19,"N/A","N/A","Wendryer","China",2,0,"N/A","Large Standard-Size",3.15,3.15,0.79,0.07,3.93,10.85,"09/30/2025",15,9,0,"N/A"
"https://amazon.com/dp/B0DGTVC7C1","https://m.media-amazon.com/images/I/71Z1at-ciIL._SX450_.jpg","B0DGTVC7C1","Oiiwak Sewer Camera with Locator 165FT, 5.5 mm Industrial Borescope Inspection Camera with 10.1"" Touch Screen, Self-Leveling/Distance Counter/ 12 LED Lights/Keyboard for Drain Pipe Plumbing","Oiiwak","FBA","Industrial & Scientific",252767,"N/A","N/A","N/A","N/A","Borescopes",511,1299.99,-30,3,3,125,3318.95,3318.81,61,3.9,"Oiiwak Tech","China",1,0,"N/A","Large bulky",14.2,16.8,25,33.1,3002.71,8283.33,"08/31/2025",14,9,2,0.05
"https://amazon.com/dp/B0DPG3263Z","https://m.media-amazon.com/images/I/718zf-Q4jTL._SX450_.jpg","B0DPG3263Z","Sewer Camera Self Leveling,9"" HD 16GB Screen JQKJCAM Drain Pipe Plumbing Camera Snake with 12 LED Light Meter Counter for Home Industrial Pipe Inspection (10M/32.8FT)","JQKJCAM","FBA","Industrial & Scientific",252920,"N/A","N/A","N/A","N/A","Borescopes",510,473,-7,15,7,-12,8381.8,3163.68,21,3.8,"JJKJ Cam","China",1,268,"N/A","Large bulky",11,11.8,12.2,10.85,797.28,2199.39,"08/31/2024",11,9,7,0.69
"https://amazon.com/dp/B0F28YDS26","https://m.media-amazon.com/images/I/71thtTwBz1L._SX450_.jpg","B0F28YDS26","Sewer Camera, 4.3"" Pipe Snake Camera with DVR Function, Drain Plumbing Inspection with LED Light, 17mm/0.67in Waterproof Industrial Endoscope for Home Wall Duct Drain Pipe (20m/65ft)","BlessFly","FBA","Industrial & Scientific",253245,602835080914,"N/A",0602835080914,"N/A","Borescopes",513,249.99,"N/A",15,3,-86,3325.97,814.65,11,4.2,"Blessfly Smart","China",1,0,"N/A","Large Standard-Size",15.3,12.4,7.1,7.08,678.18,1870.85,"08/31/2025",8,7,3,1.34
"https://amazon.com/dp/B0F28ZLLZL","https://m.media-amazon.com/images/I/71thtTwBz1L._SX450_.jpg","B0F28ZLLZL","Sewer Camera 100ft, 4.3"" Pipe Snake Camera with DVR Function, Drain Plumbing Inspection with LED Light, 17mm/0.67in Waterproof Industrial Endoscope for Home Wall Duct Drain Pipe (30m/98ft)","BlessFly","FBA","Industrial & Scientific",253289,602835080921,"N/A",0602835080921,"N/A","Borescopes",513,269.99,5,15,3,-86,3325.97,810.02,11,4.2,"Blessfly Smart","China",1,0,"N/A","Large Standard-Size",15.3,12.4,7.1,7.77,678.18,1870.85,"08/31/2025",8,7,3,1.34
"https://amazon.com/dp/B0F28XLQLS","https://m.media-amazon.com/images/I/71thtTwBz1L._SX450_.jpg","B0F28XLQLS","Sewer Camera 10m/32ft, 4.3"" Pipe Snake Camera with DVR Function, Drain Plumbing Inspection with LED Light, 17mm/0.67in Waterproof Industrial Endoscope for Home Wall Duct Drain Pipe (10m/32ft)","BlessFly","FBA","Industrial & Scientific",253289,602835080907,"N/A",0602835080907,"N/A","Borescopes",513,199.99,-16,15,8,-86,3325.97,1700.88,11,4.2,"Blessfly Smart","China",1,0,"N/A","Large Standard-Size",7.64,12.64,15.31,6.22,744.37,2053.45,"08/31/2025",8,7,3,1.34
"https://amazon.com/dp/B0DHZPH6NN","https://m.media-amazon.com/images/I/61dB+dwFvQL._SX450_.jpg","B0DHZPH6NN","VNisenllc Handheld High Brightness Industrial Endoscope Cold Light Source LED 10W with 3 Adaptors","VNisenllc","FBM","Industrial & Scientific",253301,717392803385,"N/A",0717392803385,"N/A","Borescopes",514,68,-3,18,13,276,2701.56,910.43,3,5,"Northwolf","China",1,107,"N/A","Large Standard-Size",7,4.33,3.35,0.9,"N/A","N/A","09/30/2025",14,7,3,9.05
"https://amazon.com/dp/B0F23DYJPT","https://m.media-amazon.com/images/I/7116UZ66R3L._SX450_.jpg","B0F23DYJPT","EIXAUP Sewer Camera 100 ft, 23 MM Pipe Inspection Camera with 12pcs LED Lights, 7"" 1080P HD Monitor with DVR Function, IP68 Waterproof, Meter Marker, Included 32GB Card(30 m)","EIXAUP","FBA","Industrial & Scientific",253529,"N/A","N/A","N/A","N/A","Borescopes",516,279.99,-2,13,13,120,3757.28,3757,4,4.3,"SYST","China",1,0,"N/A","Large bulky",11.14,13.3,15.39,10.67,1148.02,3166.96,"05/31/2025",8,6,0,3.34
"https://amazon.com/dp/B09L15Q1YW","https://m.media-amazon.com/images/I/51KNrcuad0L._SX450_.jpg","B09L15Q1YW","Sewer Camera Head Accessories Self-Leveling 512Hz Sonde Transmitter for Industrial Pipe Endoscope Inspection Camera with Wheel and Protective Cover（Dia:0.9inch/23mm）","SYANSPAN","FBM","Industrial & Scientific",253900,"N/A","N/A","N/A","N/A","Borescopes",510,399.99,4,5,5,21,1941.4,1941.25,6,3.7,"pipe camera","China",2,46,-88,"Large Standard-Size",6.7,3.9,2,1.1,"N/A","N/A","02/29/2024",48,7,1,0.81
"https://amazon.com/dp/B0BWVD4WJP","https://m.media-amazon.com/images/I/51cKvt29OeL._SX450_.jpg","B0BWVD4WJP","3 in 1 High Definition Endoscope Pipe Inspection Borescope TypeC USB Mobile Phone 3.9mm for Borescopes and Fiberscopes (1 Meter Flexible Cord)","Walfront","FBA","Industrial & Scientific",254283,"N/A","N/A","N/A","N/A","Borescopes",518,22.07,6,3,10,43,64.29,212.63,10,2.9,"Luoyuu","China",2,218,54,"Large Standard-Size",1.42,4.76,4.92,0.13,16.73,46.15,"11/30/2024",33,9,0,0.32
"https://amazon.com/dp/B0CY7SW9GD","https://m.media-amazon.com/images/I/71RmAuv--RL._SX450_.jpg","B0CY7SW9GD","Sewer Camera with Locator 100FT,Self Leveling JQKJCAM Plumbing Drain Camera and Locator,9'' HD 32GB Screen,23MM Pipe Line Cameras Snake with 12 Light Meter Counter for Precise Sewer Inspection (30M)","JQKJCAM","FBA","Industrial & Scientific",255832,"N/A","N/A","N/A","N/A","Borescopes",521,699.96,-9,15,2,-12,8381.8,1629.27,21,3.8,"JJKJ Cam","China",1,268,"N/A","Large bulky",11.2,15.5,17.9,16.8,1564.51,4315.89,"08/31/2024",20,9,7,0.69
"https://amazon.com/dp/B0CY83QTD4","https://m.media-amazon.com/images/I/71RmAuv--RL._SX450_.jpg","B0CY83QTD4","Self Leveling Sewer Camera with Locator 150FT,9"" 16GB HD Screen,JQKJCAM Drain Pipe Plumbing Sewer Scope Camera Snake with 12 Light Meter Counter for Precise Home Industrial Pipe Inspection (50M/165FT)","JQKJCAM","FBA","Industrial & Scientific",255845,"N/A","N/A","N/A","N/A","Borescopes",521,727.23,-6,15,2,-12,8381.8,1104,21,3.8,"JJKJ Cam","China",1,268,"N/A","Large bulky",11.14,15.98,17.87,19.09,1601.63,4418.29,"08/31/2024",20,9,7,0.69
"https://amazon.com/dp/B0DTPVML4K","https://m.media-amazon.com/images/I/718zf-Q4jTL._SX450_.jpg","B0DTPVML4K","Sewer Camera 100FT Self Leveling,with 9"" HD 16GB Monitor,JQKJCAM 23MM/0.9'' Sewer Pipe Plumbing Drain Camera Snake with 12 Light Meter Counter Waterproof for Pipes Inspection (30M/100 FT)","JQKJCAM","FBA","Industrial & Scientific",255845,"N/A","N/A","N/A","N/A","Borescopes",521,635,-6,15,4,-12,8381.8,2484.3,1,5,"JJKJ Cam","China",1,268,"N/A","Large bulky",10.75,11.75,12,12.15,763.14,2105.21,"08/31/2024",10,8,7,14.57
"https://amazon.com/dp/B0CM3CLZMD","https://m.media-amazon.com/images/I/71VaI++dGDL._SX450_.jpg","B0CM3CLZMD","PETCHOR Endoscope Camera with Light, 7.9mm 3 in 1 USB Snake Camera, Waterproof IP67 Wireless Endoscope, Wi-Fi Industrial Borescope with 6 LED Lights, Inspection Camera for OTG Android,iOS, iPhone","PETCHOR","FBA","Industrial & Scientific",255917,"N/A","N/A","N/A","N/A","Borescopes",522,16.19,-13,4,3,150,69.48,46.1,"N/A","N/A","PETCHOR-US","China",1,32,"N/A","Large Standard-Size",4.72,4.72,1.14,0.37,12.79,35.27,"09/30/2025",25,7,2,"N/A"
"https://amazon.com/dp/B07P2JLJNN","https://m.media-amazon.com/images/I/71MxKI62loL._SX450_.jpg","B07P2JLJNN","30M Cable for Sewer Camera (7D1-30M-Cable)(Only for Brands: HBUDS, IHBUDS, Anysuns)","HBUDS","FBM","Industrial & Scientific",256178,"N/A","N/A",8011657107259,"N/A","Borescopes",1014,219.98,-9,6,2,-32,1221.7,343.4,10,3.6,"Hanxuan tech","China",1,78,34,"N/A","N/A","N/A","N/A","N/A","N/A","N/A","03/31/2025",81,7,3,0.65
"https://amazon.com/dp/B00EHAIIG2","https://m.media-amazon.com/images/I/61uyXJkT98L._SX450_.jpg","B00EHAIIG2","Supereyes N015-2 2M/6.5FT Waterproof 100X USB 7mm Endoscope Borescope Inspection Camera with LED","Supereyes","FBA","Industrial & Scientific",256698,045635335929,"N/A",0045635335929,"N/A","Borescopes",514,29,-7,1,1,600,40.62,40.57,15,3.6,"Supereyes Official","China",2,18,20,"Large Standard-Size",1.3,5.51,7.17,0.18,25.83,71.27,"05/31/2024",147,5,0,0.09
"https://amazon.com/dp/B07YDTG464","https://m.media-amazon.com/images/I/61v43HxALnL._SX450_.jpg","B07YDTG464","XpertMatic F160 USB and WiFi 2.0 MP HD Endoscope, 16.4FT Large Focal Range Borescope Drain Camera for iPhone, Android Phone, PC, MacBook - 16.4FT Semi-Rigid with 8 Adjustable LED Lights","XpertMatic","FBA","Industrial & Scientific",256960,"N/A","N/A",4897093822178,"N/A","Borescopes",516,14.99,53,18,18,800,284.58,284.25,328,3.7,"SainSmart Official","USA",1,144,-47,"Large Standard-Size",2.52,5.87,7.13,0.64,53.1,146.49,"11/30/2023",74,8,0,0.06
"https://amazon.com/dp/B0DSG5V4KZ","https://m.media-amazon.com/images/I/5179fY7cTUL._SX450_.jpg","B0DSG5V4KZ","Anysun Sewer Camera with Locator 200ft, Self Leveling Sewer Inspection Camera, 7MM Diameter Cable with 12PCS LED Lights, 9"" HD Monitor with DVR(32GB Card)","anysun","FBA","Industrial & Scientific",257077,717504241845,"N/A",0717504241845,"N/A","Borescopes",518,1274.98,-14,13,3,356,14999.49,4209.43,1,5,"Nedive","China",1,0,"N/A","Extra-large 50+ to 70 lb",17.8,20.7,23,29.9,4266.72,11770.25,"10/31/2025",10,7,2,13.31
"https://amazon.com/dp/B0D2ZPKZ3G","https://m.media-amazon.com/images/I/51qnZGdl23L._SX450_.jpg","B0D2ZPKZ3G","Anysun Black Camera Cover Protective Cover for 22mm & 23mm Sewer Camera Pipe Inspection Camera, 2pcs","anysun","FBA","Industrial & Scientific",257381,774049595765,"N/A",0774049595765,"N/A","Borescopes",523,23.99,4,1,1,-50,18.85,18.83,1,5,"Yongchangsheng tech","China",1,21,"N/A","Small Standard-Size",0.59,0.59,0.39,0.4,0.07,0.19,"06/30/2024",19,2,0,0.78
"https://amazon.com/dp/B084SQ1369","https://m.media-amazon.com/images/I/8190L8cyzSL._SX450_.jpg","B084SQ1369","RIDGID 63603 200' Standard SeeSnake Self Leveling TruSense Sewer Camera Reel, Sewer Inspection","RIDGID","FBM","Industrial & Scientific",257647,095691636034,"N/A",0095691636034,"N/A","Borescopes",519,9725.24,-7,0,0,-110,"-","-","N/A","N/A","Barnett Workz LLC","USA",12,29,-28,"Extra-large 70+ to 150 lb",30,16,32,65,"N/A","N/A","06/30/2024",69,16,0,"N/A"
"https://amazon.com/dp/B0DHRQ9KM1","https://m.media-amazon.com/images/I/71TMrzDaETL._SX450_.jpg","B0DHRQ9KM1","Sewer Camera 100FT/30M, Wohuole Pipe Inspection Camera with 6pcs LEDs Light, 5"" 1080P HD Screen, Plumbing Snake Borescope with 5000mAh Battery DVR Recorder, Included 32GB Card","wohuole","FBA","Industrial & Scientific",259213,"N/A","N/A","N/A","N/A","Borescopes",526,209,-5,21,21,-59,4412.28,4412.14,16,3.6,"QX Direct US","China",1,0,"N/A","Large Standard-Size",16.02,13.66,6.69,7.36,737.64,2034.88,"08/31/2025",5,6,2,1.32
"https://amazon.com/dp/B0FFGDMNSX","https://m.media-amazon.com/images/I/71WyORtnf-L._SX450_.jpg","B0FFGDMNSX","𝟐𝟎𝟐𝟔 𝐧𝐞𝐰 9” Sewer Camera, HD 1080P w/DVR-32GB, [All-in-One Design with Magnetic Box] Drain Pipe Inspection Camera, [One Big Screw Unlock] Sewer Pipe Cam, 4500mAh, Cable Markers, 100ft/30m","ChoosePRO","FBA","Industrial & Scientific",259608,"N/A","N/A","N/A","N/A","Borescopes",529,399.99,22,26,26,,10433.11,10432.71,5,5,"ChoosePRO Direct","Hong Kong",1,0,"N/A","Large Standard-Size",7.72,13.78,16.38,15.37,877.32,2420.18,"09/30/2025",5,6,0,5.22
"https://amazon.com/dp/B0FC5K4J6L","https://m.media-amazon.com/images/I/41EOnSXL4ZL._SX450_.jpg","B0FC5K4J6L","Two-Way Articulating Borescope,4'' HD Screen Endoscope Camera with Light,4 FT Snake Inspection Camera for Automotive, HVAC & Mechanics","PLAYOCCAR","FBA","Industrial & Scientific",261850,"N/A","N/A","N/A","N/A","Borescopes",531,79.89,2,0,0,-200,"-","-",18,4.9,"PLAYOCCAR","China",1,0,"N/A","Large Standard-Size",2.8,12.05,14.61,1.68,247.64,683.16,"07/31/2025",5,10,0,0
"https://amazon.com/dp/B0F27JTJZQ","https://m.media-amazon.com/images/I/51vKDFGTpYL._SX450_.jpg","B0F27JTJZQ","MAJIAOFANG Endoscope Camera with 6 LED Light Borescope Inspection Cameras Snake Cameras for Cellphone PC","MAJIAOFANG","FBM","Industrial & Scientific",262552,"N/A","N/A",7709280004762,"N/A","Borescopes",523,8.43,-81,0,0,-44,"-","-","N/A","N/A","GuangZhouYunWeiKeJiYouXianGongSi","China",1,0,"N/A","N/A","N/A","N/A","N/A","N/A","N/A","N/A","08/31/2025",8,9,11,"N/A"
"https://amazon.com/dp/B0DQB44XS6","https://m.media-amazon.com/images/I/71c0OFqpoOL._SX450_.jpg","B0DQB44XS6","PUSILIN Endoscope Camera with Light，6.5ft semi-Rigid Snake Camera with 6.2mm HD Probe (1080 * 720) ，IP67 Waterproof borescope Inspection Camera Tools","PUSILIN","FBM","Industrial & Scientific",264131,"N/A","N/A","N/A","N/A","Borescopes",527,197,-9,16,3,10,1390.4,525.18,34,4,"Pusilin","China",1,0,"N/A","Large Standard-Size",12.4,8.46,2.95,2.09,"N/A","N/A","07/31/2025",11,9,0,0.47
"https://amazon.com/dp/B0B61G7CVX","https://m.media-amazon.com/images/I/613KKVibFFL._SX450_.jpg","B0B61G7CVX","Sewer Camera HD 1080P Video Image-Scaling Distanc Counter 10.1inch Pipe Inspection Camera 512HZ Locator 10-50M Self-Leveling Video Audio Recording Endoscop for for Plumber, Homeowners(131ft)","SYANSPAN","FBM","Industrial & Scientific",264355,"N/A","N/A","N/A","N/A","Borescopes",536,1802,3,2,0,150,2197.13,"-",2,5,"pipe camera","China",1,55,189,"Large bulky",16.54,14.17,18.9,33.07,"N/A","N/A","11/30/2023",40,7,6,0.94
